"subreddit";"date";"title";"cleaned";"sentiment_vader_comp";"sentiment_final";"subjectivity";"subjectivity_label";"emojis";"emoji_count";"entities";"topic_tags";"upvotes";"image_urls";"title_length";"capslock_ratio"
"superstonk";"2022-11-10";"GME Tokenized Stock $33 per FTX";"gme tokenized stock 33 per ftx";"0.4995";"0.4995";"0.0";"opinionated";"";"0";"";"";"";"https://web.archive.org/web/20221110090346im_/https://preview.redd.it/ttaitwqgf1z91.jpg?width=640&crop=smart&auto=webp&s=3fb5e4a62628b2640c60e1ab80a47612a9904b4f";"30";"0.25806451612903225"
"gme";"2022-11-10";"r/GME Megathread for November 10, 2022";"rgme megathread for november 10 2022";"0.0";"0.0";"0.0";"factual";"";"0";"";"";"";"";"36";"0.13157894736842105"
"gme";"2022-11-11";"r/GME Megathread for November 11, 2022";"rgme megathread for november 11 2022";"0.0";"0.0";"0.0";"factual";"";"0";"";"";"";"";"36";"0.13157894736842105"
"gme";"2022-11-13";"r/GME Megathread for November 12, 2022";"rgme megathread for november 12 2022";"0.0";"0.0";"0.0";"factual";"";"0";"";"";"";"";"36";"0.13157894736842105"
"superstonk";"2022-11-13";"Hedge fund Galois Capital says half its capital stuck on FTX exchange, Financial Times reports";"hedge fund galois capital says half its capital stuck on ftx exchange financial times reports";"-0.25";"-0.25";"0.08333333333333333";"factual";"";"0";"hedge fund galois capital";"hedge funds";"";"";"93";"0.0851063829787234"
"gme";"2022-11-13";"Everthing Citadel touches, turns to 💩. I'm noticing a pattern here.";"everthing citadel touches turns to  im noticing a pattern here";"-0.6124";"-0.6124";"0.0";"factual";"💩";"1";"";"hedge funds";"";"https://web.archive.org/web/20221113030835im_/https://preview.redd.it/qcb8uggqslz91.jpg?width=640&crop=smart&auto=webp&s=1cbc6b5a13163d891ea34c038d9675aa945400cd";"62";"0.04477611940298507"
"gme";"2022-11-14";"Hey GG, isn't this the same stuff your buddy's son at MIT and shitadel/wall street are doing? Borrowing from their own customer's GME stock and trading them without their knowledge?";"hey gg isnt this the same stuff your buddys son at mit and shitadelwall street are doing borrowing from their own customers gme stock and trading them without their knowledge";"0.5563";"0.5563";"0.5625";"opinionated";"";"0";"";"dd/analysis";"";"";"174";"0.055248618784530384"
"superstonk";"2022-11-14";"""This is a rug pull machine.. Please be aware!"" The anonymous comment written on January 26, 2021 on the GME FTX token's first transfer before the ""sneeze"" timeline.";"this is a rug pull machine please be aware the anonymous comment written on january 26 2021 on the gme ftx tokens first transfer before the sneeze timeline";"0.7027";"0.7027";"0.29166666666666663";"opinionated";"";"0";"";"";"";"";"155";"0.06060606060606061"
"superstonk";"2022-11-14";"⚠️GME Tokenized Stock⚠️ IT GETS WORSE! - CoinmarketCap Claims GME Tokens can be Redeemed For Underlying Shares If Desired - The Key Information Document from CM-Equity Says Otherwise";"gme tokenized stock it gets worse  coinmarketcap claims gme tokens can be redeemed for underlying shares if desired  the key information document from cmequity says otherwise";"0.6476";"0.6476";"0.8";"opinionated";"⚠⚠";"2";"";"";"";"https://web.archive.org/web/20221114101410im_/https://preview.redd.it/kj7lgkpoetz91.jpg?width=640&crop=smart&auto=webp&s=f132757bc24b8f8185ac759c536a4df73df54bf7";"174";"0.2087912087912088"
"superstonk";"2022-11-14";"HOLY SHIT! THIS Is Why CTB Was So Low for So Long!!! 🤯 GME Tokenized Stock Was Listed on Jan 28th - NOT A COINCIDENCE";"holy shit this is why ctb was so low for so long  gme tokenized stock was listed on jan 28th  not a coincidence";"-0.7192";"-0.7192";"0.5";"opinionated";"🤯";"1";"ctb";"";"";"https://web.archive.org/web/20221114101410im_/https://preview.redd.it/f951otff3uz91.jpg?width=640&crop=smart&auto=webp&s=c58fd10e47ee290063ea2a364a621a4d81a56879";"111";"0.38461538461538464"
"gme";"2022-11-14";"r/GME Megathread for November 13, 2022";"rgme megathread for november 13 2022";"0.0";"0.0";"0.0";"factual";"";"0";"";"";"";"";"36";"0.13157894736842105"
"superstonk";"2022-11-15";"Institutions loading up on GME shares in new 13F Filings";"institutions loading up on gme shares in new 13f filings";"0.6633";"0.6633";"0.45454545454545453";"opinionated";"";"0";"";"";"";"";"56";"0.10714285714285714"
"superstonk";"2022-11-15";"So: 1) They created a token of no value and said it had value equivalent to GME price; 2) they traded this token for something of value, thus 3) the question is how much of our money have they stolen from us in this counterfeiting ring?";"so 1 they created a token of no value and said it had value equivalent to gme price 2 they traded this token for something of value thus 3 the question is how much of our money have they stolen from us in this counterfeiting ring";"0.5855";"0.5855";"0.2";"opinionated";"";"0";"";"";"";"";"229";"0.0211864406779661"
"superstonk";"2022-11-15";"GME TOKENIZED STOCKS USED AS LOCATES UNDER DTCC ELIGIBILITY OF HYBRID SECURITIES??? 🤔";"gme tokenized stocks used as locates under dtcc eligibility of hybrid securities";"0.7721";"0.8493100000000001";"0.0";"opinionated";"🤔";"1";"";"regulation";"";"https://web.archive.org/web/20221115050106im_/https://preview.redd.it/p3laz8n2l10a1.jpg?width=640&crop=smart&auto=webp&s=093342103b02f26de769c595efaac33e655d12b3";"80";"0.8117647058823529"
"gme";"2022-11-15";"r/GME Megathread for November 15, 2022";"rgme megathread for november 15 2022";"0.0";"0.0";"0.0";"factual";"";"0";"";"";"";"";"36";"0.13157894736842105"
"superstonk";"2022-11-15";"SEC & FIDELITY DATA COMBINED INDICATES RETAIL BOUGHT 540% GME FLOAT POST SNEEZE";"sec  fidelity data combined indicates retail bought 540 gme float post sneeze";"0.25";"0.275";"0.6";"opinionated";"";"0";"fidelity data, sec";"regulation";"";"";"77";"0.7848101265822784"
"gme";"2022-11-16";"r/GME Megathread for November 16, 2022";"rgme megathread for november 16 2022";"0.0";"0.0";"0.0";"factual";"";"0";"";"";"";"";"36";"0.13157894736842105"
"wallstreetbets";"2022-11-17";"GME is about to have a positive crossover on the 1 Week scale. This means GME has a very good chance of going on a rip soon.";"gme is about to have a positive crossover on the 1 week scale this means gme has a very good chance of going on a rip soon";"0.9386";"0.9386";"0.6627272727272728";"opinionated";"";"0";"gme";"";"";"";"122";"0.06451612903225806"
"gme";"2022-11-17";"r/GME Megathread for November 17, 2022";"rgme megathread for november 17 2022";"0.0";"0.0";"0.0";"factual";"";"0";"";"";"";"";"36";"0.13157894736842105"
"gme";"2022-11-17";"+14 for the Bot LFG GME";"14 for the bot lfg gme";"0.4995";"0.4995";"0.0";"opinionated";"";"0";"";"";"";"https://web.archive.org/web/20221117124838im_/https://preview.redd.it/haguu6lxah0a1.png?width=640&crop=smart&auto=webp&s=7c307db29f4a4bae12a8c1ddf92542cac2522e04";"22";"0.30434782608695654"
"gme";"2022-11-17";"Retail owns 67.5% of GME stock";"retail owns 675 of gme stock";"0.4995";"0.4995";"0.0";"opinionated";"";"0";"";"";"";"";"28";"0.13333333333333333"
"gme";"2022-11-18";"r/GME Megathread for November 18, 2022";"rgme megathread for november 18 2022";"0.0";"0.0";"0.0";"factual";"";"0";"";"";"";"";"36";"0.13157894736842105"
"superstonk";"2022-11-18";"GME popped with 5 seconds left before close AH.... After two years of watching this happen it almost always means we get a big green day the following day with lots of volatility. Buckle up!";"gme popped with 5 seconds left before close ah after two years of watching this happen it almost always means we get a big green day the following day with lots of volatility buckle up";"0.5461";"0.5461";"0.125";"opinionated";"";"0";"gme";"regulation";"";"https://web.archive.org/web/20221118065428im_/https://preview.redd.it/3864kgrzgn0a1.jpg?width=640&crop=smart&auto=webp&s=54a954651423147df6973f5e36cde2aab5c5681f";"184";"0.03684210526315789"
"superstonk";"2022-11-19";"Unwrapping Wrapped GME Part II: Plugging a $4.1 Billion Dollar Hole";"unwrapping wrapped gme part ii plugging a 41 billion dollar hole";"0.4995";"0.4995";"0.0";"opinionated";"";"0";"41 billion dollar";"";"";"";"64";"0.1791044776119403"
"superstonk";"2022-11-19";"GME is on the tail end of becoming profitable, and this will start the real squeeze";"gme is on the tail end of becoming profitable and this will start the real squeeze";"0.8788";"0.8788";"0.5750000000000001";"opinionated";"";"0";"gme";"";"";"";"82";"0.03614457831325301"
"gme";"2022-11-20";"🚀🚀🚀 r/GME’s NFT Weekend is Now Live 🚀🚀🚀";"rgmes nft weekend is now live";"0.9776";"0.9776";"0.5";"opinionated";"🚀🚀🚀🚀🚀🚀";"6";"";"";"";"";"29";"0.23076923076923078"
"gme";"2022-11-20";"r/GME Megathread for November 19, 2022";"rgme megathread for november 19 2022";"0.0";"0.0";"0.0";"factual";"";"0";"";"";"";"";"36";"0.13157894736842105"
"superstonk";"2022-11-21";"GMEDD interview with Ryan Cohen";"gmedd interview with ryan cohen";"0.0";"0.0";"0.0";"factual";"";"0";"ryan cohen";"dd/analysis";"";"";"31";"0.22580645161290322"
"gme";"2022-11-22";"r/GME Megathread for November 21, 2022";"rgme megathread for november 21 2022";"0.0";"0.0";"0.0";"factual";"";"0";"";"";"";"";"36";"0.13157894736842105"
"gme";"2022-11-22";"GME wallet is live on iOS!";"gme wallet is live on ios";"0.5461";"0.5461";"0.5";"opinionated";"";"0";"gme";"";"";"https://web.archive.org/web/20221122034852im_/https://external-preview.redd.it/UZIHqMYDuKe-nVe9qU1A6XbPmz9yMHp8kpCmqBHSOTY.jpg?width=640&crop=smart&auto=webp&s=cf4edcbfdbc2cf0125a1bc60e4583afa7345c130";"25";"0.19230769230769232"
"superstonk";"2022-11-23";"$GME Daily Directory | New? Start Here! | Discussion, DRS & NFT Megathreads, DD Library, and User Flairs | I CAN'T HEAR YOU!";"gme daily directory  new start here  discussion drs  nft megathreads dd library and user flairs  i cant hear you";"0.5882";"0.5882";"0.22727272727272727";"opinionated";"";"0";"gme daily";"drs, dd/analysis";"";"";"112";"0.2661290322580645"
"wallstreetbets";"2022-11-23";"The Ban of GME";"the ban of gme";"-0.0943";"-0.0943";"0.0";"factual";"";"0";"";"regulation";"";"";"14";"0.35714285714285715"
"gme";"2022-11-24";"r/GME Megathread for November 23, 2022";"rgme megathread for november 23 2022";"0.0";"0.0";"0.0";"factual";"";"0";"";"";"";"";"36";"0.13157894736842105"
"superstonk";"2022-11-24";"Ihor Dusaniwsky (S3 Partners) says that there is not enough stock borrow available to execute large short trades on $GME";"ihor dusaniwsky s3 partners says that there is not enough stock borrow available to execute large short trades on gme";"0.4995";"0.4995";"0.40714285714285714";"opinionated";"";"0";"";"";"";"https://web.archive.org/web/20221124004257im_/https://preview.redd.it/k4y8swd13t1a1.jpg?width=640&crop=smart&auto=webp&s=527f4dae38597ecd6be74f2d6fe0cc1881371235";"117";"0.058333333333333334"
"superstonk";"2022-11-25";"WEN DFV?";"wen dfv";"0.0";"0.0";"0.0";"factual";"";"0";"wen dfv";"";"";"https://web.archive.org/web/20221125021203im_/https://preview.redd.it/quo8ppc70x1a1.jpg?width=640&crop=smart&auto=webp&s=736fa14b54b451346fa47584f27be9a5d9bbd021";"7";"0.75"
"gme";"2022-11-25";"r/GME Megathread for November 24, 2022";"rgme megathread for november 24 2022";"0.0";"0.0";"0.0";"factual";"";"0";"";"";"";"";"36";"0.13157894736842105"
"gme";"2022-11-26";"Investors who shorted GME are hoping for some miracles 😜. Per Brad’s comments on yahoo finance🤗";"investors who shorted gme are hoping for some miracles  per brads comments on yahoo finance";"0.8331";"0.8331";"0.0";"opinionated";"😜🤗";"2";"yahoo";"";"";"https://web.archive.org/web/20221126054104im_/https://preview.redd.it/yjf8kmkpk62a1.jpg?width=640&crop=smart&auto=webp&s=eb3b0438e42f7eb9f1fa8f7d1dcd92a65e230c52";"91";"0.06315789473684211"
"gme";"2022-11-26";"If you still don’t understand the Icahn FUD on #GME, get in here !";"if you still dont understand the icahn fud on gme get in here";"0.1759";"0.1759";"0.0";"opinionated";"";"0";"";"";"";"https://web.archive.org/web/20221126054104im_/https://preview.redd.it/irl2ghtqz72a1.jpg?width=640&crop=smart&auto=webp&s=df3062d1ba1a17d2dca45a9fab13de705098c1ff";"61";"0.12121212121212122"
"gme";"2022-11-26";"r/GME Megathread for November 25, 2022";"rgme megathread for november 25 2022";"0.0";"0.0";"0.0";"factual";"";"0";"";"";"";"";"36";"0.13157894736842105"
"superstonk";"2022-11-27";"A Look Back: The Cellar Boxing Playbook DD discovered by u/thabat. GME managed to escape the cellar.";"a look back the cellar boxing playbook dd discovered by uthabat gme managed to escape the cellar";"0.6037";"0.6037";"0.0";"opinionated";"";"0";"u/thabat";"dd/analysis, apes/community";"";"";"96";"0.12"
"gme";"2022-11-27";"r/GME Megathread for November 26, 2022";"rgme megathread for november 26 2022";"0.0";"0.0";"0.0";"factual";"";"0";"";"";"";"";"36";"0.13157894736842105"
"superstonk";"2022-11-28";"Rule 2a: Posts and comments must be related to GME - Help Revise Superstonk's Rules";"rule 2a posts and comments must be related to gme  help revise superstonks rules";"0.7125";"0.7125";"0.4";"opinionated";"";"0";"";"";"";"";"80";"0.10843373493975904"
"gme";"2022-11-29";"r/GME Megathread for November 28, 2022";"rgme megathread for november 28 2022";"0.0";"0.0";"0.0";"factual";"";"0";"";"";"";"";"36";"0.13157894736842105"
"superstonk";"2022-12-01";"After seeing GME short volume was almost 72% yesterday, I decided to look at some other companies for comparison. One of these is not like the others…";"after seeing gme short volume was almost 72 yesterday i decided to look at some other companies for comparison one of these is not like the others";"0.2785";"0.2785";"0.3375";"factual";"";"0";"";"";"";"";"146";"0.04"
"gme";"2022-12-01";"r/GME Megathread for November 30, 2022";"rgme megathread for november 30 2022";"0.0";"0.0";"0.0";"factual";"";"0";"";"";"";"";"36";"0.13157894736842105"
"superstonk";"2022-12-02";"GME 100% Utilization - Day 90 via Ortex";"gme 100 utilization  day 90 via ortex";"0.4995";"0.4995";"0.0";"opinionated";"";"0";"";"";"";"";"37";"0.15384615384615385"
"gme";"2022-12-04";"r/GME Megathread for December 04, 2022";"rgme megathread for december 04 2022";"0.0";"0.0";"0.0";"factual";"";"0";"";"";"";"";"36";"0.13157894736842105"
"superstonk";"2022-12-06";"Citadel Securities Accused of Illicit Trading";"citadel securities accused of illicit trading";"-0.6124";"-0.6124";"0.0";"factual";"";"0";"";"hedge funds, regulation";"";"";"45";"0.1111111111111111"
"superstonk";"2022-12-06";"Todays GME short volume go Cray cray! 75.6% LFG 🚀🚀🚀🚀";"todays gme short volume go cray cray 756 lfg";"0.9662";"0.9662";"0.3";"opinionated";"🚀🚀🚀🚀";"4";"";"";"";"https://web.archive.org/web/20221206054050im_/https://preview.redd.it/tajzd60xf84a1.jpg?width=640&crop=smart&auto=webp&s=912007c19bbea19def773094acefc67c7fe43879";"44";"0.15384615384615385"
"gme";"2022-12-06";"r/GME Megathread for December 05, 2022";"rgme megathread for december 05 2022";"0.0";"0.0";"0.0";"factual";"";"0";"";"";"";"";"36";"0.13157894736842105"
"gme";"2022-12-06";"layoffs are only bad if it's GME";"layoffs are only bad if its gme";"-0.0688";"-0.0688";"0.8333333333333333";"opinionated";"";"0";"";"";"";"https://web.archive.org/web/20221206030037im_/https://preview.redd.it/6jn8alys674a1.jpg?width=640&crop=smart&auto=webp&s=bb395c8ea49964e145e0491341bad54fb3a44443";"31";"0.09375"
"gme";"2022-12-07";"I asked OpenAi to write a Poem about GME.";"i asked openai to write a poem about gme";"0.4995";"0.4995";"0.0";"opinionated";"";"0";"";"";"";"https://web.archive.org/web/20221207000819im_/https://i.redd.it/owm5d8xdn94a1.png";"40";"0.17073170731707318"
"gme";"2022-12-07";"r/GME Megathread for December 06, 2022";"rgme megathread for december 06 2022";"0.0";"0.0";"0.0";"factual";"";"0";"";"";"";"";"36";"0.13157894736842105"
"gme";"2022-12-07";"Happy r/GME To The Moon Holidays";"happy rgme to the moon holidays";"0.8834";"0.8834";"1.0";"opinionated";"";"0";"";"";"";"";"31";"0.25"
"gme";"2022-12-08";"r/GME Megathread for December 08, 2022";"rgme megathread for december 08 2022";"0.0";"0.0";"0.0";"factual";"";"0";"";"";"";"";"36";"0.13157894736842105"
"gme";"2022-12-10";"Add these to GME shares to the bot🟣♾️";"add these to gme shares to the bot";"0.6633";"0.6633";"0.0";"opinionated";"🟣♾";"2";"";"dd/analysis";"";"https://web.archive.org/web/20221210053155im_/https://preview.redd.it/67mlvju0py4a1.jpg?width=640&crop=smart&auto=webp&s=ef67c55bf57d011619ffc27f7dfdb85f59462182";"34";"0.10810810810810811"
"gme";"2022-12-10";"r/GME Megathread for December 09, 2022";"rgme megathread for december 09 2022";"0.0";"0.0";"0.0";"factual";"";"0";"";"";"";"";"36";"0.13157894736842105"
"superstonk";"2022-12-12";"Another 477 stonks, Booked and ready! Some amazing artwork with me in my top hat, enjoying a Cuban cigar, when MOASS kicks in tomorrow! This is the way!";"another 477 stonks booked and ready some amazing artwork with me in my top hat enjoying a cuban cigar when moass kicks in tomorrow this is the way";"0.9077";"0.9077";"0.625";"opinionated";"";"0";"";"regulation";"";"https://web.archive.org/web/20221212131720im_/https://preview.redd.it/1906qkt10h5a1.png?width=640&crop=smart&auto=webp&s=319dab1e45ac131224cda0684a2054d0bad0d198";"146";"0.06578947368421052"
"superstonk";"2022-12-12";"Hedge fund billionaire Ken Griffin spent $54 million to stop Illinois from taxing the super-rich. It worked. His savings over 10 years from beating the measure: $510 million. It's not much of a democracy when you can buy it";"hedge fund billionaire ken griffin spent 54 million to stop illinois from taxing the superrich it worked his savings over 10 years from beating the measure 510 million its not much of a democracy when you can buy it";"-0.6369";"-0.6369";"0.15000000000000002";"factual";"";"0";"illinois";"hedge funds";"";"https://web.archive.org/web/20221212131720im_/https://preview.redd.it/g7qborld0e5a1.jpg?width=640&crop=smart&auto=webp&s=5dc4e7ce46c0ef72a8c2e4d94dbbcf2fc98c20d1";"215";"0.03139013452914798"
"superstonk";"2022-12-13";"Senator Merkley Introduces Legislation to Ban Hedge Fund Ownership of Residential Housing | U.S. Senator Jeff Merkley of Oregon";"senator merkley introduces legislation to ban hedge fund ownership of residential housing  us senator jeff merkley of oregon";"-0.5574";"-0.5574";"0.0";"factual";"";"0";"merkley, us, jeff merkley, oregon";"hedge funds, regulation";"";"";"124";"0.12598425196850394"
"gme";"2022-12-14";"r/GME Megathread for December 14, 2022";"rgme megathread for december 14 2022";"0.0";"0.0";"0.0";"factual";"";"0";"";"";"";"";"36";"0.13157894736842105"
"superstonk";"2022-12-14";"GME mirrored tokens shown to be delisted this whole time on Terra Luna blockchain.";"gme mirrored tokens shown to be delisted this whole time on terra luna blockchain";"0.4995";"0.4995";"0.4";"opinionated";"";"0";"gme";"";"";"";"81";"0.06097560975609756"
"superstonk";"2022-12-14";"The Securities and Exchange Commission is set to propose the biggest shake-up of the U.S. stock market in more than a decade. In the crosshairs: Ken Griffin’s Citadel Securities.";"the securities and exchange commission is set to propose the biggest shakeup of the us stock market in more than a decade in the crosshairs ken griffins citadel securities";"-0.1531";"-0.1531";"0.5";"opinionated";"";"0";"the securities and exchange commission, us";"hedge funds, regulation";"";"https://web.archive.org/web/20221214071459im_/https://preview.redd.it/ew5kdtlpgs5a1.jpg?width=640&crop=smart&auto=webp&v=enabled&s=6f96af55773133c7c71d861f1dcdf4870fa33f83";"171";"0.06179775280898876"
"superstonk";"2022-12-14";"76.4% short volume today on GME. Over the past 30 days, the average Short Volume has been 69.97%. - NICE 🚀🚀🚀🚀🚀🚀🚀🚀🚀🚀🚀🚀🚀🚀🚀🚀🚀🚀";"764 short volume today on gme over the past 30 days the average short volume has been 6997  nice";"0.9978";"0.9978";"0.45";"opinionated";"🚀🚀🚀🚀🚀🚀🚀🚀🚀🚀🚀🚀🚀🚀🚀🚀🚀🚀";"18";"";"";"";"https://web.archive.org/web/20221214071459im_/https://preview.redd.it/qck3bu49kt5a1.jpg?width=640&crop=smart&auto=webp&v=enabled&s=a38fce78e2a87a5ad3d6c0fc04bd96ed2e4d31b5";"96";"0.08130081300813008"
"gme";"2022-12-16";"r/GME Megathread for December 15, 2022";"rgme megathread for december 15 2022";"0.0";"0.0";"0.0";"factual";"";"0";"";"";"";"";"36";"0.13157894736842105"
"gme";"2022-12-16";"Trust the invaluable DD, believe in our mission, and keep DRS’ing. The price is fake and does not matter. Look at the daily short volume, look at GME’s average buy/sell ratio. +460";"trust the invaluable dd believe in our mission and keep drsing the price is fake and does not matter look at the daily short volume look at gmes average buysell ratio 460";"0.0325";"0.0325";"0.425";"factual";"";"0";"";"drs, dd/analysis";"";"https://web.archive.org/web/20221216004900im_/https://preview.redd.it/2xrfzz7f466a1.jpg?width=640&crop=smart&auto=webp&s=336da1dbadb108845e652faf8aad7fe2f685ae51";"170";"0.06111111111111111"
"superstonk";"2022-12-17";"$GME Daily Directory | New? Start Here! | DRS Guide | Wallet Help/Activation Megathread | Help Revise Superstonk's Rule! - Find out more inside";"gme daily directory  new start here  drs guide  wallet helpactivation megathread  help revise superstonks rule  find out more inside";"0.7592";"0.7592";"0.3181818181818182";"opinionated";"";"0";"gme daily";"drs";"";"";"132";"0.14685314685314685"
"superstonk";"2022-12-17";"D Lauer telling Gary to check out DRSGME 🟣📄🟣🚀 (repost with sauce)";"d lauer telling gary to check out drsgme  repost with sauce";"0.6124";"0.6124";"0.0";"opinionated";"🟣📄🟣🚀";"4";"";"drs";"";"";"59";"0.13846153846153847"
"gme";"2022-12-17";"r/GME Megathread for December 17, 2022";"rgme megathread for december 17 2022";"0.0";"0.0";"0.0";"factual";"";"0";"";"";"";"";"36";"0.13157894736842105"
"gme";"2022-12-18";"r/GME Megathread for December 18, 2022";"rgme megathread for december 18 2022";"0.0";"0.0";"0.0";"factual";"";"0";"";"";"";"";"36";"0.13157894736842105"
"superstonk";"2022-12-19";"Carl Icahn sold over $32 Million worth of Herc Holdings Inc (HRI) on 12/12-12/14 and then the following 2 days we saw massive trades in AH for GME.... Just posting this in case this entire Icahn theory proves right 🤷🏼‍♂️";"carl icahn sold over 32 million worth of herc holdings inc hri on 12121214 and then the following 2 days we saw massive trades in ah for gme just posting this in case this entire icahn theory proves right";"0.6289";"0.6289";"0.39345238095238094";"opinionated";"🤷🏼♂";"3";"carl, herc holdings inc hri";"dd/analysis, diamond hands";"";"https://web.archive.org/web/20221219082052im_/https://preview.redd.it/b6od7nqver6a1.png?width=640&crop=smart&auto=webp&s=1b72b50f694d384e7ff0dcc39b90b8dbcb62572c";"204";"0.07272727272727272"
"gme";"2022-12-20";"r/GME Megathread for December 19, 2022";"rgme megathread for december 19 2022";"0.0";"0.0";"0.0";"factual";"";"0";"";"";"";"";"36";"0.13157894736842105"
"gme";"2022-12-22";"r/GME Megathread for December 22, 2022";"rgme megathread for december 22 2022";"0.0";"0.0";"0.0";"factual";"";"0";"";"";"";"";"36";"0.13157894736842105"
"wallstreetbets";"2022-12-22";"AMC 🤡";"amc";"0.3034";"0.33374000000000004";"0.0";"factual";"🤡";"1";"";"";"";"https://web.archive.org/web/20221222141827im_/https://preview.redd.it/kwu9pojrwh7a1.png?width=640&crop=smart&auto=webp&s=e4fe10c36dc943fb4bb7277b715e0686ad7e9adb";"3";"0.6"
"gme";"2022-12-23";"r/GME Megathread for December 23, 2022";"rgme megathread for december 23 2022";"0.0";"0.0";"0.0";"factual";"";"0";"";"";"";"";"36";"0.13157894736842105"
"superstonk";"2022-12-23";"GME borrow fee was 2000% today?! :o";"gme borrow fee was 2000 today o";"0.481";"0.481";"0.0";"opinionated";"";"0";"gme";"";"";"https://web.archive.org/web/20221223040842im_/https://preview.redd.it/zn2j67idqi7a1.png?width=640&crop=smart&auto=webp&s=bcd05786b579355f7491954e312beefc0850863b";"31";"0.08571428571428572"
"gme";"2022-12-25";"A collage of photos at Citadel. Merry Christmas!";"a collage of photos at citadel merry christmas";"-0.2003";"-0.2003";"0.0";"opinionated";"";"0";"";"hedge funds";"";"https://web.archive.org/web/20221225015016im_/https://preview.redd.it/n4lbj6bgez7a1.jpg?width=640&crop=smart&auto=webp&s=e6f10ae26f19ea3447b1165a9109878848a26582";"46";"0.08333333333333333"
"gme";"2022-12-25";"GME Booming";"gme booming";"0.4995";"0.4995";"0.0";"opinionated";"";"0";"";"";"";"https://web.archive.org/web/20221225015016im_/https://preview.redd.it/w5mrnwunoy7a1.jpg?width=640&crop=smart&auto=webp&s=9b522bd3df015deb4b63c947ec3ea26a4549a0fb";"11";"0.36363636363636365"
"gme";"2022-12-25";"r/GME Megathread for December 24, 2022";"rgme megathread for december 24 2022";"0.0";"0.0";"0.0";"factual";"";"0";"";"";"";"";"36";"0.13157894736842105"
"gme";"2022-12-27";"Are we still doing receipt porn? A very GMErry holiday 💜";"are we still doing receipt porn a very gmerry holiday";"0.8008";"0.8008";"0.3";"opinionated";"💜";"1";"";"";"";"https://web.archive.org/web/20221227034928im_/https://preview.redd.it/mvytlnf2bc8a1.jpg?width=640&crop=smart&auto=webp&s=fa7c6a81fff094c27fbbe0aea45c5dcefbf39970";"53";"0.08928571428571429"
"gme";"2022-12-27";"r/GME Megathread for December 26, 2022";"rgme megathread for december 26 2022";"0.0";"0.0";"0.0";"factual";"";"0";"";"";"";"";"36";"0.13157894736842105"
"wallstreetbets";"2022-12-28";"Parody: Elon Musk’s Robinhood";"parody elon musks robinhood";"-0.3612";"-0.3612";"0.0";"factual";"";"0";"";"robinhood";"";"https://web.archive.org/web/20221228043335im_/https://preview.redd.it/lcglqt0hzg8a1.jpg?width=640&crop=smart&auto=webp&s=c8312b611353413760d2e70eb80b97ccc268f7c9";"27";"0.13793103448275862"
