"subreddit";"date";"title";"cleaned";"sentiment_vader_comp";"sentiment_final";"subjectivity";"subjectivity_label";"emojis";"emoji_count";"entities";"topic_tags";"upvotes";"image_urls";"title_length";"capslock_ratio"
"wallstreetbets";"2021-01-06";"How I feel dumping $40k more into GME shares this morning... 💎✋ 🚀🚀🚀";"how i feel dumping 40k more into gme shares this morning";"0.9632";"0.9632";"0.5";"opinionated";"💎✋🚀🚀🚀";"5";"";"";"";"https://web.archive.org/web/20210106002033im_/https://preview.redd.it/ewongyj50j961.jpg?width=640&crop=smart&auto=webp&s=51b5bbc835316fc22128959c51adfb285b1ee753";"56";"0.07462686567164178"
"wallstreetbets";"2021-01-13";"$GME Autists preparing to break the $20.25 ceiling";"gme autists preparing to break the 2025 ceiling";"0.4995";"0.4995";"0.0";"opinionated";"";"0";"";"apes/community";"";"";"47";"0.08"
"wallstreetbets";"2021-01-14";"GME YOLO update — Jan 13 2021";"gme yolo update  jan 13 2021";"0.7555";"0.7555";"0.0";"opinionated";"";"0";"gme yolo update  ";"meme stocks";"";"https://web.archive.org/web/20210114041032im_/https://preview.redd.it/1hw6ljgfz5b61.png?width=640&crop=smart&auto=webp&s=a5377fcf2e0bf08450f7bc571507df3eda6a18e4";"28";"0.27586206896551724"
"wallstreetbets";"2021-01-14";"THX TO WSB AND GME I CAN FINALLY GIVE BACK TO MY 70 YEARS OLD DAD, I WILL BE HELPING TO PAY FOR HIS NEW ROOF, HE WAS SO SCARED OF NOT BEING ABLE TO PAY. I LOVE YOU WSB. REALLY! WE ARE GOING TO THE MOON 🚀🚀🚀🚀";"thx to wsb and gme i can finally give back to my 70 years old dad i will be helping to pay for his new roof he was so scared of not being able to pay i love you wsb really we are going to the moon";"0.9809";"1.0";"0.43993506493506496";"opinionated";"🚀🚀🚀🚀";"4";"";"apes/community";"";"https://web.archive.org/web/20210114041032im_/https://preview.redd.it/393eb4kcn4b61.jpg?width=640&crop=smart&auto=webp&s=7cad6fcacc1d854121fa88e437fd99677ac5044d";"196";"0.7184466019417476"
"wallstreetbets";"2021-01-15";"GME YOLO update — Jan 14 2021";"gme yolo update  jan 14 2021";"0.7555";"0.7555";"0.0";"opinionated";"";"0";"gme yolo update  ";"meme stocks";"";"https://web.archive.org/web/20210115025528im_/https://preview.redd.it/dxc04m314db61.png?width=640&crop=smart&auto=webp&s=8a1e19ca6257f639cbdf2d9f4aaaa1e5bfa2856b";"28";"0.27586206896551724"
"wallstreetbets";"2021-01-15";"Watching everyone post millions in Gain Porn as I continue to hold my 15 GME shares.";"watching everyone post millions in gain porn as i continue to hold my 15 gme shares";"0.87";"0.87";"0.0";"opinionated";"";"0";"";"diamond hands";"";"";"83";"0.08333333333333333"
"wallstreetbets";"2021-01-16";"GME Comrades! Prepare to receive your mission!";"gme comrades prepare to receive your mission";"0.5882";"0.5882";"0.0";"opinionated";"";"0";"gme";"";"";"https://web.archive.org/web/20210116012959im_/https://external-preview.redd.it/i2lvePGAxl-qiGkMQZmo7dSzwt28JzOyHlikgfIveeE.png?width=960&crop=smart&format=pjpg&auto=webp&s=0269528cbed2475e2ef1204f5db6b15433d34a00";"44";"0.10869565217391304"
"wallstreetbets";"2021-01-17";"Melvin Capital on Tuesday (forgive the watermarks for I am a meme apprentice)";"melvin capital on tuesday forgive the watermarks for i am a meme apprentice";"0.0258";"0.0258";"0.0";"factual";"";"0";"melvin capital";"hedge funds";"";"";"75";"0.05194805194805195"
"wallstreetbets";"2021-01-17";"GME - Option, Margin and Other Factors for Trading Next Week";"gme  option margin and other factors for trading next week";"0.4995";"0.4995";"0.1875";"opinionated";"";"0";"gme";"";"";"";"58";"0.16666666666666666"
"wallstreetbets";"2021-01-18";"(GME DD) One DD to rule them. One DD to find them. One DD to to bring them all and in the darkness bind them.";"gme dd one dd to rule them one dd to find them one dd to to bring them all and in the darkness bind them";"0.3034";"0.3034";"0.0";"factual";"";"0";"gme dd";"dd/analysis";"";"";"104";"0.12844036697247707"
"wallstreetbets";"2021-01-19";"For you GME autists that claim to have 💎🤲 that have been in this for a couple weeks or months...";"for you gme autists that claim to have  that have been in this for a couple weeks or months";"0.4995";"0.4995";"0.0";"opinionated";"💎🤲";"2";"";"apes/community, diamond hands";"";"https://web.archive.org/web/20210119023533im_/https://preview.redd.it/8hfps72rv5c61.jpg?width=640&crop=smart&auto=webp&s=f7df90ca351b00947319a72f50400447682615c5";"91";"0.041666666666666664"
"wallstreetbets";"2021-01-20";"GME YOLO update — Jan 19 2021";"gme yolo update  jan 19 2021";"0.7555";"0.7555";"0.0";"opinionated";"";"0";"gme yolo update  ";"meme stocks";"";"https://web.archive.org/web/20210120022523im_/https://preview.redd.it/y7v5vgx5tcc61.png?width=640&crop=smart&auto=webp&s=5094cb74c70486eeb45524aef7ca69189f28901d";"28";"0.27586206896551724"
"wallstreetbets";"2021-01-21";"GME Megathread - Lemon Party (keep your shitposting here)";"gme megathread  lemon party keep your shitposting here";"0.7125";"0.7125";"0.0";"opinionated";"";"0";"lemon party, gme megathread  ";"";"";"";"54";"0.10526315789473684"
"wallstreetbets";"2021-01-21";"GME now the top stonk on Robinhood. We have done it my brothers. 🚀🚀🚀🚀🌕";"gme now the top stonk on robinhood we have done it my brothers";"0.9736";"0.9736";"0.5";"opinionated";"🚀🚀🚀🚀🌕";"5";"gme";"robinhood";"";"https://web.archive.org/web/20210121013659im_/https://preview.redd.it/uwcdv4fm1kc61.jpg?width=640&crop=smart&auto=webp&s=525af34b2b921c12cfa05b819a83446a725743ec";"62";"0.07142857142857142"
"wallstreetbets";"2021-01-22";"How I feel after squeezing Melvin and Citron by the balls and closing GME above $43.";"how i feel after squeezing melvin and citron by the balls and closing gme above 43";"0.3034";"0.3034";"0.1";"opinionated";"";"0";"";"hedge funds";"";"";"82";"0.08333333333333333"
"wallstreetbets";"2021-01-23";"First 20 bagger! GME to 100 EOW";"first 20 bagger gme to 100 eow";"0.5461";"0.5461";"0.3333333333333333";"opinionated";"";"0";"";"";"";"https://web.archive.org/web/20210123000605im_/https://preview.redd.it/fiungv2nuwc61.jpg?width=640&crop=smart&auto=webp&s=2ee1d97c75d932ebd043553522f23021a17d5dc4";"30";"0.22580645161290322"
"wallstreetbets";"2021-01-23";"GMREEEEEEEEEEkend Containment Thread - GME shitposts go here";"gmreeeeeeeeeekend containment thread  gme shitposts go here";"0.4995";"0.4995";"0.0";"opinionated";"";"0";"";"";"";"";"59";"0.3"
"wallstreetbets";"2021-01-23";"GME YOLO update — Jan 22 2021";"gme yolo update  jan 22 2021";"0.7555";"0.7555";"0.0";"opinionated";"";"0";"gme yolo update  ";"meme stocks";"";"https://web.archive.org/web/20210123000605im_/https://preview.redd.it/xho46kzt7yc61.png?width=640&crop=smart&auto=webp&s=a110a9b1b5dc685a136fe52732d94d21cca70a2e";"28";"0.27586206896551724"
"wallstreetbets";"2021-01-24";"How Friday's GME gamma squeeze may trigger a short squeeze on Monday and Tuesday";"how fridays gme gamma squeeze may trigger a short squeeze on monday and tuesday";"0.9049";"0.9049";"0.3";"opinionated";"";"0";"";"short squeeze";"";"";"79";"0.0875"
"gme";"2021-01-25";"HOLY SHIT LADS!!!!! THIS IS INSANE! WE MIGHT HIT $100 TODAY! LOOKING AT THE PREMARKET RIGHT NOW! $84 FREAKING DOLLLLARRRRSSS I Hope Every person on this group is ready and loaded for Today's GME Rally. No Doubts but Full Conviction to the $1000's. Ladies and Gentlemen lets fly";"holy shit lads this is insane we might hit 100 today looking at the premarket right now 84 freaking dollllarrrrsss i hope every person on this group is ready and loaded for todays gme rally no doubts but full conviction to the 1000s ladies and gentlemen lets fly";"-0.4691";"-0.4691";"0.7142857142857144";"opinionated";"";"0";"";"";"";"";"262";"0.37545126353790614"
"wallstreetbets";"2021-01-26";"GME Megathread Part 2";"gme megathread part 2";"0.4995";"0.4995";"0.0";"opinionated";"";"0";"";"";"";"";"21";"0.23809523809523808"
"wallstreetbets";"2021-01-26";"GME YOLO update — Jan 25 2021";"gme yolo update  jan 25 2021";"0.7555";"0.7555";"0.0";"opinionated";"";"0";"gme yolo update  ";"meme stocks";"";"https://web.archive.org/web/20210126000249im_/https://preview.redd.it/1ubfvqedmjd61.png?width=640&crop=smart&auto=webp&s=8d58b102b54e5eea74989ab4a3574d8da07d7b88";"28";"0.27586206896551724"
"wallstreetbets";"2021-01-27";"This Autist filed an SEC complaint against Melvin Capital. It aint much but its honest work.";"this autist filed an sec complaint against melvin capital it aint much but its honest work";"0.4558";"0.4558";"0.475";"opinionated";"";"0";"sec";"hedge funds, apes/community, regulation";"";"";"90";"0.08695652173913043"
"wallstreetbets";"2021-01-27";"GME YOLO update — Jan 26 2021";"gme yolo update  jan 26 2021";"0.7555";"0.7555";"0.0";"opinionated";"";"0";"gme yolo update  ";"meme stocks";"";"https://web.archive.org/web/20210127000222im_/https://preview.redd.it/cltvfhzmrqd61.png?width=640&crop=smart&auto=webp&s=934df3b874f4e16d79afe3d68cd8dbd6efe4fe7b";"28";"0.27586206896551724"
"wallstreetbets";"2021-01-27";"The GME Thread Part 3 for January 26, 2020";"the gme thread part 3 for january 26 2020";"0.4995";"0.4995";"0.0";"opinionated";"";"0";"";"";"";"";"41";"0.16666666666666666"
"gme";"2021-01-29";"If we end the day in the green it'll be the biggest 'fuck you' to Robinhood. And they'll have lost millions of users and a few stars on the app store. Just hold and we'll be unstoppable 🚀🚀";"if we end the day in the green itll be the biggest fuck you to robinhood and theyll have lost millions of users and a few stars on the app store just hold and well be unstoppable";"0.4404";"0.4404";"0.3333333333333333";"opinionated";"🚀🚀";"2";"";"diamond hands, robinhood";"";"";"178";"0.02127659574468085"
"gme";"2021-01-29";"PLEASE UNDERSTAND why Robinhood pulled the stunt they did today. The big money shorts are out of shares and out of capital. We were on the cusp of triggering a full-blown infinite squeeze. The nuclear bomb of squeezes.";"please understand why robinhood pulled the stunt they did today the big money shorts are out of shares and out of capital we were on the cusp of triggering a fullblown infinite squeeze the nuclear bomb of squeezes";"0.5473";"0.5473";"0.1";"opinionated";"";"0";"";"robinhood";"";"";"213";"0.09174311926605505"
"gme";"2021-01-29";"GME: Understand the WAR Strategy! The GME Short Squeeze will last 6 days or longer!";"gme understand the war strategy the gme short squeeze will last 6 days or longer";"0.7519";"0.7519";"0.18333333333333332";"opinionated";"";"0";"gme";"short squeeze";"";"";"80";"0.1686746987951807"
"wallstreetbets";"2021-01-30";"How to Buy GME Above Broker Limits";"how to buy gme above broker limits";"0.4995";"0.4995";"0.1";"opinionated";"";"0";"";"";"";"";"34";"0.23529411764705882"
"wallstreetbets";"2021-01-30";"GME YOLO month-end update — Jan 2021";"gme yolo monthend update  jan 2021";"0.7555";"0.7555";"0.0";"opinionated";"";"0";"gme yolo monthend";"meme stocks";"";"https://web.archive.org/web/20210130000118im_/https://preview.redd.it/r557em3t5ce61.png?width=640&crop=smart&auto=webp&s=f851fdeb1b7a416878364bbd1ff1c3d9f13a5442";"34";"0.2222222222222222"
"wallstreetbets";"2021-01-30";"CNBC now running Ads promoting that Melvin Capital closed their short positions on $GME";"cnbc now running ads promoting that melvin capital closed their short positions on gme";"0.5766";"0.5766";"0.2";"opinionated";"";"0";"cnbc";"hedge funds";"";"https://web.archive.org/web/20210130000118im_/https://i.redd.it/8vxraurkcce61.png";"86";"0.11494252873563218"
"wallstreetbets";"2021-02-01";"A SIMPLE REMINDER FOR MONDAY!! $GME ONLY";"a simple reminder for monday gme only";"0.4738";"0.5211800000000001";"0.6785714285714286";"opinionated";"";"0";"";"";"";"https://web.archive.org/web/20210201001615im_/https://preview.redd.it/k1h9yydrpqe61.jpg?width=640&crop=smart&auto=webp&s=b3ac867a21e48caf8ac8e4f0bcf79a1222899915";"37";"0.775"
"wallstreetbets";"2021-02-01";"Regulatory agencies overseeing short selling activities of big hedge funds";"regulatory agencies overseeing short selling activities of big hedge funds";"0.0";"0.0";"0.2";"factual";"";"0";"";"hedge funds";"";"";"74";"0.013513513513513514"
"wallstreetbets";"2021-02-01";"Greb talks Tendieman, Citron, Robinhood, DFV & More";"greb talks tendieman citron robinhood dfv  more";"-0.3612";"-0.3612";"0.5";"opinionated";"";"0";"";"robinhood";"";"";"47";"0.1568627450980392"
"gme";"2021-02-03";"$GME down -40% premarket. I urge you to either buy more or look away until this drop blows over. DO NOT SELL 🚀🚀🚀";"gme down 40 premarket i urge you to either buy more or look away until this drop blows over do not sell";"-0.1486";"-0.1486";"0.3944444444444445";"factual";"🚀🚀🚀";"3";"";"";"";"";"103";"0.11607142857142858"
"wallstreetbets";"2021-02-05";"GME Afternoon Tea Megathread - Feb 4, 2021";"gme afternoon tea megathread  feb 4 2021";"0.4995";"0.4995";"0.0";"opinionated";"";"0";"";"";"";"";"40";"0.16666666666666666"
"wallstreetbets";"2021-02-05";"This is 100% Proof that GME is *literally* in Countdown-to-Launch Phase";"this is 100 proof that gme is literally in countdowntolaunch phase";"0.4995";"0.4995";"0.0";"opinionated";"";"0";"";"";"";"";"66";"0.11267605633802817"
"gme";"2021-02-06";"You know when $GME hit $460 last week we were fucking legit heading towards $1000 right? Then they PREVENTED us from buying more to STOP the Momentum. Our HYPE was taking it to the fucking MOON. DO you think we CANT fucking do it AGAIN next Week? THE HYPE IS STILL HERE.";"you know when gme hit 460 last week we were fucking legit heading towards 1000 right then they prevented us from buying more to stop the momentum our hype was taking it to the fucking moon do you think we cant fucking do it again next week the hype is still here";"0.7874";"0.7874";"0.5003401360544217";"opinionated";"";"0";"";"meme stocks";"";"";"262";"0.21481481481481482"
"wallstreetbets";"2021-02-06";"Which of you retards made me almost crash to get this picture on my Nashville commute? AMC TO THE MOOOOOON!!11!1!1!1!1!! 🚀";"which of you retards made me almost crash to get this picture on my nashville commute amc to the moooooon111111";"0.7179";"0.7179";"1.0";"opinionated";"🚀";"1";"moooooon111111";"apes/community";"";"https://web.archive.org/web/20210206024204im_/https://preview.redd.it/y4zwqqj4iof61.jpg?width=640&crop=smart&auto=webp&s=9617dd9a64375706ba3649521ea1483b4c9f8419";"111";"0.14754098360655737"
"wallstreetbets";"2021-02-06";"Mark Cuban said ""once the brokerage stops restricting trades, then we'll see what WSB is really made of"". Well, guess what? Robinhood has removed all restrictions.";"mark cuban said once the brokerage stops restricting trades then well see what wsb is really made of well guess what robinhood has removed all restrictions";"-0.5165";"-0.5165";"0.2";"factual";"";"0";"mark cuban";"regulation, apes/community, robinhood";"";"";"155";"0.04294478527607362"
"gme";"2021-02-06";"This is what diamond hands looks like 💎🙌💎";"this is what diamond hands looks like";"0.5994";"0.5994";"0.0";"opinionated";"💎🙌💎";"3";"";"diamond hands";"";"https://web.archive.org/web/20210206090117im_/https://preview.redd.it/rw9geestksf61.jpg?width=640&crop=smart&auto=webp&s=4070683971c984aafb7c8a8fd3f7c9b0ec3277b6";"37";"0.024390243902439025"
"gme";"2021-02-06";"GME vs AMC over 5 days. They are tracking together allmost 100%";"gme vs amc over 5 days they are tracking together allmost 100";"0.6669";"0.6669";"0.0";"opinionated";"";"0";"gme vs";"";"";"";"61";"0.1111111111111111"
"wallstreetbets";"2021-02-06";"If they go after DFV for this, SEC is really sick in the head. One of the few guys that actually did serious DD and stuck to his guns. He didn’t start a rally, we just followed the path.";"if they go after dfv for this sec is really sick in the head one of the few guys that actually did serious dd and stuck to his guns he didnt start a rally we just followed the path";"-0.8143";"-0.8143";"0.4647619047619048";"factual";"";"0";"sec";"dd/analysis, regulation";"";"https://web.archive.org/web/20210206024204im_/https://preview.redd.it/ceb9q66nvnf61.jpg?width=640&crop=smart&auto=webp&s=6202cbaae5f889cd809429194ef6d455e3168865";"180";"0.05913978494623656"
"wallstreetbets";"2021-02-06";"$GME & $AMC Line comparation, from the last 5 Days...";"gme  amc line comparation from the last 5 days";"0.6669";"0.6669";"0.06666666666666667";"opinionated";"";"0";"";"";"";"https://web.archive.org/web/20210206024204im_/https://preview.redd.it/rmw4womtcpf61.jpg?width=640&crop=smart&auto=webp&s=c7bb55877941316f42ccfee039c71097590949b3";"46";"0.1509433962264151"
"gme";"2021-02-07";"GME short interest as of EOD 29th Jan from NASDAQ (ACTUALLY RELIABLE) - 121%";"gme short interest as of eod 29th jan from nasdaq actually reliable  121";"0.7378";"0.7378";"0.2";"opinionated";"";"0";"gme";"";"";"";"72";"0.3815789473684211"
"wallstreetbets";"2021-02-07";"GME Institutions Hold 177% of Float Why the Squeeze is not Squoze";"gme institutions hold 177 of float why the squeeze is not squoze";"0.8494";"0.8494";"0.0";"opinionated";"";"0";"";"diamond hands, short squeeze";"";"";"64";"0.13846153846153847"
"wallstreetbets";"2021-02-07";"Can we continue realizing that Robinhood fucked 5 Million+ retail investors. Can we not forget that GameStop could have left the galaxy.";"can we continue realizing that robinhood fucked 5 million retail investors can we not forget that gamestop could have left the galaxy";"-0.7379";"-0.7379";"0.35";"factual";"";"0";"";"robinhood";"";"";"133";"0.04411764705882353"
"gme";"2021-02-07";"A serious take on $GME and WSB";"a serious take on gme and wsb";"0.4466";"0.4466";"0.6666666666666666";"opinionated";"";"0";"";"apes/community";"";"";"29";"0.23333333333333334"
"gme";"2021-02-10";"FINRA right now $GME";"finra right now gme";"0.4995";"0.4995";"0.5357142857142857";"opinionated";"";"0";"";"";"";"https://web.archive.org/web/20210210100823im_/https://i.redd.it/0tpuazt3fjg61.jpg";"19";"0.4"
"wallstreetbets";"2021-02-10";"Y'all need to let GME happen";"yall need to let gme happen";"0.4995";"0.4995";"0.0";"opinionated";"";"0";"";"";"";"";"27";"0.14285714285714285"
"gme";"2021-02-10";"GME short interest 78.46%! The REAL squeeze starts tomorrow 🚀 🚀 🚀";"gme short interest 7846 the real squeeze starts tomorrow";"0.9736";"0.9736";"0.30000000000000004";"opinionated";"🚀🚀🚀";"3";"gme short";"";"";"https://web.archive.org/web/20210210100823im_/https://preview.redd.it/2tldi43b7kg61.jpg?width=640&crop=smart&auto=webp&s=a72288212203d553292612f8b6b4927874207596";"56";"0.12307692307692308"
"gme";"2021-02-12";"Do NOT swing trade $GME. Only BUY & HOLD 💎🤚🤚🚀🚀";"do not swing trade gme only buy  hold";"0.938";"0.938";"1.0";"opinionated";"💎🤚🤚🚀🚀";"5";"";"diamond hands";"";"";"37";"0.32608695652173914"
"gme";"2021-02-12";"GME GANG MUST READ🙏💎🙏🚀🚀🚀";"gme gang must read";"0.9454";"1.0";"0.0";"opinionated";"🙏💎🙏🚀🚀🚀";"6";"gme gang";"";"";"https://web.archive.org/web/20210212064830im_/https://preview.redd.it/xzl0b4p60wg61.jpg?width=640&crop=smart&auto=webp&s=26b33ac316074b8ece6e0d8a5b529d726ead76df";"18";"0.625"
"gme";"2021-02-12";"If I wanted gold. I'd buy gold. Not gold stocks. If I wanted silver. I'd buy silver. Not silver stocks. If I wanted weed. I'd buy weed. Not weed stocks. If I want a trip to the moon. Ill keep holding my GME shares";"if i wanted gold id buy gold not gold stocks if i wanted silver id buy silver not silver stocks if i wanted weed id buy weed not weed stocks if i want a trip to the moon ill keep holding my gme shares";"0.7865";"0.7865";"1.0";"opinionated";"";"0";"the moon ill";"diamond hands";"";"";"200";"0.08450704225352113"
"gme";"2021-02-12";"GME endgame: If she blows, smart ape will sell share by share";"gme endgame if she blows smart ape will sell share by share";"0.8964";"0.8964";"0.6428571428571429";"opinionated";"";"0";"";"apes/community";"";"";"59";"0.06557377049180328"
"gme";"2021-02-13";"If DFV can testify about why he thinks GME is a good investment long-term, it could be the catalyst we need";"if dfv can testify about why he thinks gme is a good investment longterm it could be the catalyst we need";"0.7297";"0.7297";"0.6000000000000001";"opinionated";"";"0";"";"";"";"";"105";"0.06542056074766354"
"gme";"2021-02-13";"GME 🦍 Roll Call! Are you Hodlin’? RAISE YOUR HAND! Is this shit global? Damn straight it is! RAISE YOUR HAND! Do you want to break the HFer’s down to nothing?! RAISE. YOUR. DIAMOND. MOTHER-FUCKING. HANDS!! 💎🙌🦍🚀🌔 Apes strong together. Not financial advice. Words to live by.";"gme  roll call are you hodlin raise your hand is this shit global damn straight it is raise your hand do you want to break the hfers down to nothing raise your diamond motherfucking hands  apes strong together not financial advice words to live by";"0.9608";"0.9608";"0.3888888888888889";"opinionated";"🦍💎🙌🦍🚀🌔";"6";"gme  roll";"hedge funds, apes/community, diamond hands";"";"";"247";"0.27472527472527475"
"gme";"2021-02-13";"I’m going to put down 20 K as soon as the market opens for GME I signed a lucrative contract for my company and I’m sick and tired of these Hedgehogs. YOU LISTENING ???? Time to pay the piper";"im going to put down 20 k as soon as the market opens for gme i signed a lucrative contract for my company and im sick and tired of these hedgehogs you listening  time to pay the piper";"-0.6516";"-0.6516";"0.6153439153439153";"opinionated";"";"0";"";"";"";"";"184";"0.1099476439790576"
"gme";"2021-02-13";"Okay guys. We know the risks of GME and know how huge this play still is. In the coming weeks, if you see overly negative gme sentiment, downvote the bots.";"okay guys we know the risks of gme and know how huge this play still is in the coming weeks if you see overly negative gme sentiment downvote the bots";"0.708";"0.708";"0.6";"opinionated";"";"0";"";"";"";"";"150";"0.03870967741935484"
"gme";"2021-02-16";"XRT Shorts mapped to GME's chart";"xrt shorts mapped to gmes chart";"0.0";"0.0";"0.0";"factual";"";"0";"";"";"";"https://web.archive.org/web/20210216023714im_/https://preview.redd.it/qlws6xqb1oh61.png?width=640&crop=smart&auto=webp&s=0882c927772bbd946d5ac854e2d3d2860c9b6e86";"31";"0.21875"
"gme";"2021-02-16";"XRT is being used to hide GME shorts. XRT currently sits at 190% SHORT FLOAT. Peaking on 2/1 at over 800% SHORT FLOAT!!";"xrt is being used to hide gme shorts xrt currently sits at 190 short float peaking on 21 at over 800 short float";"0.4796";"0.4796";"0.3333333333333333";"opinionated";"";"0";"xrt";"";"";"";"112";"0.25210084033613445"
"gme";"2021-02-17";"Super low volume for GME on 16th with only 7.9M, which means everyone's HODLING!!";"super low volume for gme on 16th with only 79m which means everyones hodling";"0.7661";"0.7661";"0.6555555555555556";"opinionated";"";"0";"";"diamond hands";"";"https://web.archive.org/web/20210217065742im_/https://preview.redd.it/5s9sf509gxh61.jpg?width=640&crop=smart&auto=webp&s=734fdcca357329e73d15c0931b6d879fbe7d207a";"76";"0.14814814814814814"
"gme";"2021-02-17";"The fact that DFV needs no introduction is some major big dick energy";"the fact that dfv needs no introduction is some major big dick energy";"-0.5291";"-0.5291";"0.3";"factual";"";"0";"";"";"";"https://web.archive.org/web/20210217065742im_/https://preview.redd.it/3mt29v9anxh61.jpg?width=640&crop=smart&auto=webp&s=71b3e68f935e7599e7c1490e4631898c5f92afc1";"69";"0.057971014492753624"
"gme";"2021-02-17";"GME is responsible for 6 million new WSB users and then 2 weeks later everyone that mentions GME gets banned on WSB. That is why I buy more GME.";"gme is responsible for 6 million new wsb users and then 2 weeks later everyone that mentions gme gets banned on wsb that is why i buy more gme";"0.8516";"0.8516";"0.37613636363636366";"opinionated";"";"0";"gme";"apes/community, regulation";"";"";"142";"0.11805555555555555"
"gme";"2021-02-18";"BREAKING NEWS HARD EVIDENCE OF DFV SHARING INSIDER SECRETS";"breaking news hard evidence of dfv sharing insider secrets";"0.34";"0.37400000000000005";"0.5416666666666666";"opinionated";"";"0";"";"regulation";"";"";"58";"0.8620689655172413"
"gme";"2021-02-18";"DFV Testimony - Check the last Paragraph";"dfv testimony  check the last paragraph";"0.0";"0.0";"0.06666666666666667";"factual";"";"0";"dfv testimony";"";"";"";"39";"0.15"
"gme";"2021-02-18";"Let’s make tomorrow’s hearing the most viewed event in HISTORY to show our love of u/deepFUCKINGvalue and $GME.";"lets make tomorrows hearing the most viewed event in history to show our love of udeepfuckingvalue and gme";"0.8143";"0.8143";"0.55";"opinionated";"";"0";"u/deepFUCKINGvalue";"regulation";"";"";"106";"0.16216216216216217"
"wallstreetbets";"2021-02-20";"Robinhood brand is severely damaged: 56% of account holders are considering leaving Robinhood";"robinhood brand is severely damaged 56 of account holders are considering leaving robinhood";"-0.872";"-0.872";"0.0";"factual";"";"0";"";"diamond hands, robinhood";"";"";"91";"0.021505376344086023"
"wallstreetbets";"2021-02-20";"GME YOLO update — Feb 19 2021";"gme yolo update  feb 19 2021";"0.7555";"0.7555";"0.0";"opinionated";"";"0";"gme yolo update  ";"meme stocks";"";"https://web.archive.org/web/20210220001355im_/https://preview.redd.it/2xswz0h11ii61.png?width=640&crop=smart&auto=webp&s=a5fdb5e208e1769a6c2298ebecb83e24bf2f8239";"28";"0.27586206896551724"
"gme";"2021-02-21";"DFV’s YOLO now has the most awards on any Reddit post - 10.6k 🚀";"dfvs yolo now has the most awards on any reddit post  106k";"0.8892";"0.8892";"0.5";"opinionated";"🚀";"1";"106k, dfvs yolo now";"dd/analysis, meme stocks";"";"";"58";"0.12698412698412698"
