"subreddit";"date";"title";"cleaned";"sentiment_vader_comp";"sentiment_final";"subjectivity";"subjectivity_label";"emojis";"emoji_count";"entities";"topic_tags";"upvotes";"image_urls";"title_length";"capslock_ratio"
"superstonk";"2021-07-19";"#GME breaking. According to Thomson Reuters GameStop has short squeeze score of 100. That the maximum it can get. This index probably is the only index hasn’t be manipulated by big hedge funds and market makers because apes only check Bloomberg.";"gme breaking according to thomson reuters gamestop has short squeeze score of 100 that the maximum it can get this index probably is the only index hasnt be manipulated by big hedge funds and market makers because apes only check bloomberg";"0.6841";"0.6841";"0.6000000000000001";"opinionated";"";"0";"";"hedge funds, apes/community, short squeeze";"";"";"239";"0.044897959183673466"
"gme";"2021-07-19";"For the records: Gamestop beta changed from -1.73 to -2.00; For apes doesn't know, beta is the correlation of the price to the whole market. -2.00 beta means, if the market goes $1 down, $GME will go $2 up and vice versa. Finally $GME is perfect investment to hedge against market crash.";"for the records gamestop beta changed from 173 to 200 for apes doesnt know beta is the correlation of the price to the whole market 200 beta means if the market goes 1 down gme will go 2 up and vice versa finally gme is perfect investment to hedge against market crash";"0.8159";"0.8159";"0.6722222222222223";"opinionated";"";"0";"";"apes/community";"";"https://web.archive.org/web/20210719181449im_/https://i.redd.it/791co04ik6c71.png";"268";"0.03484320557491289"
"gme";"2021-07-19";"r/GME Megathread for Monday - July 19, 2021";"rgme megathread for monday  july 19 2021";"0.0";"0.0";"0.0";"factual";"";"0";"";"";"";"";"40";"0.13953488372093023"
"superstonk";"2021-07-19";"$GME Daily Discussion - July 17, 2021";"gme daily discussion  july 17 2021";"0.4995";"0.4995";"0.0";"opinionated";"";"0";"gme daily";"";"";"";"34";"0.16216216216216217"
"gme";"2021-07-21";"Practice makes MOASS.";"practice makes moass";"0.0";"0.0";"0.0";"factual";"";"0";"";"";"";"https://web.archive.org/web/20210721014936im_/https://preview.redd.it/wrpvb8bt2ec71.jpg?width=640&crop=smart&auto=webp&s=8ada12b57aa599291757c4785f468e542d335c43";"20";"0.2857142857142857"
"superstonk";"2021-07-21";"A Post MOASS idea";"a post moass idea";"0.0";"0.0";"0.0";"factual";"";"0";"";"";"";"https://web.archive.org/web/20210721014959im_/https://preview.redd.it/20x70bsiwec71.jpg?width=640&crop=smart&auto=webp&s=52b62dbd67477f45ddb89bfe720d930bfff974b9";"17";"0.4117647058823529"
"gme";"2021-07-21";"IF GME HITS 350 BY FRIDAY I’M GETTING A GAMESTOP LOGO TATTOO ON MY ASS";"if gme hits 350 by friday im getting a gamestop logo tattoo on my ass";"-0.25";"-0.275";"0.0";"factual";"";"0";"";"";"";"https://web.archive.org/web/20210721014936im_/https://preview.redd.it/aotlnehxcfc71.jpg?width=640&crop=smart&auto=webp&s=854b61568bd46e2966e2a4d37c6ff3eaa9f15045";"69";"0.7428571428571429"
"gme";"2021-07-21";"r/GME Megathread for Tuesday - July 20, 2021";"rgme megathread for tuesday  july 20 2021";"0.0";"0.0";"0.0";"factual";"";"0";"";"";"";"";"41";"0.13636363636363635"
"wallstreetbets";"2021-07-21";"Daily Popular Tickers Thread for July 20, 2021 - AMC | GME | NVDA";"daily popular tickers thread for july 20 2021  amc  gme  nvda";"0.8056";"0.8056";"0.45";"opinionated";"";"0";"";"";"";"";"61";"0.23076923076923078"
"wallstreetbets";"2021-07-21";"Gain porn for AMC.";"gain porn for amc";"0.6841";"0.6841";"0.0";"opinionated";"";"0";"";"";"";"https://web.archive.org/web/20210721092945im_/https://preview.redd.it/tcmsnzfxfhc71.jpg?width=640&crop=smart&auto=webp&s=0621f69acbd8639e0b3a6c672b85e1d94238185f";"17";"0.2222222222222222"
"superstonk";"2021-07-21";"$GME Daily Discussion";"gme daily discussion";"0.4995";"0.4995";"0.0";"opinionated";"";"0";"gme daily";"";"";"";"20";"0.23809523809523808"
"wallstreetbets";"2021-07-22";"Daily Popular Tickers Thread for July 21, 2021 - AMC | GME | NVDA";"daily popular tickers thread for july 21 2021  amc  gme  nvda";"0.8056";"0.8056";"0.45";"opinionated";"";"0";"";"";"";"";"61";"0.23076923076923078"
"gme";"2021-07-22";"A (Rough) Visualization of the VW Short Squeeze from 2008";"a rough visualization of the vw short squeeze from 2008";"0.6124";"0.6124";"0.35";"opinionated";"";"0";"";"short squeeze";"";"";"55";"0.12280701754385964"
"gme";"2021-07-22";"r/GME Megathread for Thursday - July 22, 2021";"rgme megathread for thursday  july 22 2021";"0.0";"0.0";"0.0";"factual";"";"0";"";"";"";"";"42";"0.13333333333333333"
"gme";"2021-07-22";"GME added to Vanguard Value Index fund";"gme added to vanguard value index fund";"0.6841";"0.6841";"0.0";"opinionated";"";"0";"gme";"hedge funds, dd/analysis";"";"";"38";"0.15789473684210525"
"gme";"2021-07-22";"Until a catalyst triggers MOASS, the price action of GME is largely irrelevant";"until a catalyst triggers moass the price action of gme is largely irrelevant";"0.4995";"0.4995";"0.55";"opinionated";"";"0";"";"";"";"";"77";"0.11538461538461539"
"wallstreetbets";"2021-07-23";"Daily Popular Tickers Thread for July 22, 2021 - CLOV | AMC | SOFI";"daily popular tickers thread for july 22 2021  clov  amc  sofi";"0.6166";"0.6166";"0.45";"opinionated";"";"0";"";"";"";"";"62";"0.24242424242424243"
"superstonk";"2021-07-26";"Single? Want more GME? One-weeks worth of meal prep for under $60/week.";"single want more gme oneweeks worth of meal prep for under 60week";"0.7468";"0.7468";"0.2714285714285714";"opinionated";"";"0";"";"";"";"";"65";"0.08450704225352113"
"superstonk";"2021-07-26";"[Speculative] Piecing together the ITM CALLs and the OTM PUTs. Melvin was margin called on January 25th, so they swapped risk to Citadel. Melvin bought up those OTM PUTs from Citadel hoping to profit off of their original shorts, but the expirations of the OTM PUTs do nothing.";"speculative piecing together the itm calls and the otm puts melvin was margin called on january 25th so they swapped risk to citadel melvin bought up those otm puts from citadel hoping to profit off of their original shorts but the expirations of the otm puts do nothing";"-0.5395";"-0.5395";"0.75";"opinionated";"";"0";"";"hedge funds";"";"";"270";"0.11552346570397112"
"wallstreetbets";"2021-07-28";"United States Sells Unique Wu-Tang Clan Album Forfeited by Convicted Hedge Fund Manager Martin Shkreli";"united states sells unique wutang clan album forfeited by convicted hedge fund manager martin shkreli";"0.4215";"0.4215";"1.0";"opinionated";"";"0";"united states, martin shkreli";"hedge funds";"";"";"101";"0.14705882352941177"
"gme";"2021-07-31";"How I track my 1 share of GME 🙂";"how i track my 1 share of gme";"0.7987";"0.7987";"0.0";"opinionated";"🙂";"1";"";"";"";"https://web.archive.org/web/20210731052218im_/https://preview.redd.it/1o9ye8b70ee71.jpg?width=640&crop=smart&auto=webp&s=60d732bedf1bda51f9b3108850e29cbd147d5c0b";"29";"0.16129032258064516"
"gme";"2021-07-31";"r/GME Megathread for Friday - July 30, 2021";"rgme megathread for friday  july 30 2021";"0.0";"0.0";"0.0";"factual";"";"0";"";"";"";"";"40";"0.13953488372093023"
"gme";"2021-07-31";"They live like Gods: One reason to understand why the MOASS may take longer and/or is being delayed";"they live like gods one reason to understand why the moass may take longer andor is being delayed";"0.1531";"0.1531";"0.5";"opinionated";"";"0";"";"";"";"";"97";"0.08080808080808081"
"superstonk";"2021-08-01";"Before you get too horny and upvote every damn post, look at OP's history first. OP made a bunch of posts promoting WKHS a month ago. He's trying really hard to get attention with this new post. He hasn't proven a damn thing beyond what we already knew. He posted same shit for GME and movie stock";"before you get too horny and upvote every damn post look at ops history first op made a bunch of posts promoting wkhs a month ago hes trying really hard to get attention with this new post he hasnt proven a damn thing beyond what we already knew he posted same shit for gme and movie stock";"-0.0005";"-0.0005";"0.450909090909091";"factual";"";"0";"";"";"";"https://web.archive.org/web/20210801043211im_/https://preview.redd.it/746k00kjqle71.jpg?width=640&crop=smart&auto=webp&s=f2226eb40267809f0152c6986639bff520273a04";"289";"0.050505050505050504"
"gme";"2021-08-02";"r/GME Megathread for Monday - August 02, 2021";"rgme megathread for monday  august 02 2021";"0.0";"0.0";"0.0";"factual";"";"0";"";"";"";"";"42";"0.13333333333333333"
"gme";"2021-08-02";"GME MOASS 🚀!!! Debt ceiling suspension expired ✅, Eviction order expired ✅, S&P 400 MidCap inclusion on 8/4, and more!! Don't let all the shitty FUD from this weekend derail us. GME go MOON 🚀🤑";"gme moass  debt ceiling suspension expired  eviction order expired  sp 400 midcap inclusion on 84 and more dont let all the shitty fud from this weekend derail us gme go moon";"0.8494";"0.8494";"0.5";"opinionated";"🚀✅✅🚀🤑";"5";"gme moass  ";"";"";"";"174";"0.13020833333333334"
"gme";"2021-08-02";"After the MOASS,";"after the moass";"0.0";"0.0";"0.0";"factual";"";"0";"";"";"";"";"15";"0.375"
"wallstreetbets";"2021-08-03";"GME $950 Calls YOLO (IV Dipped Under 100% again | Joining S&P400, Earnings Call Approaching, Indicators Showing Due for Another Run Up)";"gme 950 calls yolo iv dipped under 100 again  joining sp400 earnings call approaching indicators showing due for another run up";"0.7885";"0.7885";"0.1875";"opinionated";"";"0";"sp400";"meme stocks";"";"https://web.archive.org/web/20210803075342im_/https://preview.redd.it/9pds8gxrxye71.jpg?width=640&crop=smart&auto=webp&s=207520b32f3f3972152da6508b10532b010debe9";"127";"0.17777777777777778"
"gme";"2021-08-03";"r/GME Megathread for Tuesday - August 03, 2021";"rgme megathread for tuesday  august 03 2021";"0.0";"0.0";"0.0";"factual";"";"0";"";"";"";"";"43";"0.13043478260869565"
"wallstreetbets";"2021-08-03";"Daily Popular Tickers Thread for August 02, 2021 - BABA | GME | AMD";"daily popular tickers thread for august 02 2021  baba  gme  amd";"0.7213";"0.7213";"0.45";"opinionated";"";"0";"";"";"";"";"63";"0.22388059701492538"
"wallstreetbets";"2021-08-03";"Robinhood insider selling - Vlad sold 1,250,000 ($45+ million) worth of $HOOD";"robinhood insider selling  vlad sold 1250000 45 million worth of hood";"-0.1531";"-0.1531";"0.1";"factual";"";"0";"";"robinhood";"";"";"69";"0.07792207792207792"
"wallstreetbets";"2021-08-04";"GME 20k YOLO - Going to 0 or 6 figures";"gme 20k yolo  going to 0 or 6 figures";"0.7555";"0.7555";"0.0";"opinionated";"";"0";"gme 20k yolo  going";"meme stocks";"";"https://web.archive.org/web/20210804000947im_/https://preview.redd.it/plfafes9s6f71.jpg?width=640&crop=smart&auto=webp&s=6c4354a7478afc6fa54b67bce7e0df14c3b562ea";"37";"0.21052631578947367"
"gme";"2021-08-04";"r/GME Megathread for Wednesday - August 04, 2021";"rgme megathread for wednesday  august 04 2021";"0.0";"0.0";"0.0";"factual";"";"0";"";"";"";"";"45";"0.125"
"wallstreetbets";"2021-08-04";"Simple Jack Robinhood Trader";"simple jack robinhood trader";"-0.3612";"-0.3612";"0.35714285714285715";"factual";"";"0";"jack robinhood";"robinhood";"";"";"28";"0.14285714285714285"
"superstonk";"2021-08-04";"Dear SEC, on 8/3/21 GME Stonk was BLATANTLY Manipulated Through the Tactic Known as ""Banging the Close"". Please Disregard All Evidence and Continue to Destroy the World's Faith in the US Stonk Market.";"dear sec on 8321 gme stonk was blatantly manipulated through the tactic known as banging the close please disregard all evidence and continue to destroy the worlds faith in the us stonk market";"0.128";"0.128";"0.3666666666666667";"factual";"";"0";"us, sec";"regulation";"";"";"192";"0.175"
"wallstreetbets";"2021-08-04";"Unpopular opinion: Robinhood still has the best mobile interface";"unpopular opinion robinhood still has the best mobile interface";"0.4019";"0.4019";"0.3";"opinionated";"";"0";"";"robinhood";"";"";"63";"0.03125"
"superstonk";"2021-08-04";"tens of millions of gme shorted last minute 🤣";"tens of millions of gme shorted last minute";"0.6908";"0.6908";"0.06666666666666667";"opinionated";"🤣";"1";"tens of millions";"";"";"https://web.archive.org/web/20210804020627im_/https://i.redd.it/feuaxh5v87f71.png";"43";"0.0"
"wallstreetbets";"2021-08-04";"Daily Popular Tickers Thread for August 03, 2021 - AMD | GME | TSLA";"daily popular tickers thread for august 03 2021  amd  gme  tsla";"0.7213";"0.7213";"0.45";"opinionated";"";"0";"";"";"";"";"63";"0.22388059701492538"
"wallstreetbets";"2021-08-05";"It absolutely blows my mind that so many people and especially people on this sub are STILL using Robinhood despite what happened with the whole gamestop fiasco.";"it absolutely blows my mind that so many people and especially people on this sub are still using robinhood despite what happened with the whole gamestop fiasco";"-0.7003";"-0.7003";"0.7";"opinionated";"";"0";"";"robinhood";"";"";"160";"0.043478260869565216"
"superstonk";"2021-08-05";"Ethereum update in 6 hours. GME data feed added to LINK oracle Network. TITS JACKED TO THE MOON !";"ethereum update in 6 hours gme data feed added to link oracle network tits jacked to the moon";"0.7667";"0.7667";"0.0";"opinionated";"";"0";"";"dd/analysis";"";"https://web.archive.org/web/20210805120448im_/https://preview.redd.it/ru4hel7wghf71.png?width=640&crop=smart&auto=webp&s=15e61bdddadeb090f4ff67193abfb3a73b0c2c00";"93";"0.28865979381443296"
"superstonk";"2021-08-05";"The GME is not fair !";"the gme is not fair";"0.3742";"0.3742";"0.9";"opinionated";"";"0";"";"";"";"https://web.archive.org/web/20210805120448im_/https://preview.redd.it/s9bk054pqff71.jpg?width=640&crop=smart&auto=webp&s=4db9c37193648784a4680a8549afb96be992896e";"19";"0.19047619047619047"
"wallstreetbets";"2021-08-05";"My experience trading with Robinhood this past year";"my experience trading with robinhood this past year";"-0.3612";"-0.3612";"0.25";"factual";"";"0";"";"robinhood";"";"";"51";"0.0392156862745098"
"wallstreetbets";"2021-08-06";"Someone hacked my Robinhood account and GAVE me $15k";"someone hacked my robinhood account and gave me 15k";"-0.6369";"-0.6369";"0.0";"factual";"";"0";"";"robinhood";"";"";"51";"0.11538461538461539"
"wallstreetbets";"2021-08-06";"Riding $AMC to the Moon on next Monday's Earnings🚀🚀";"riding amc to the moon on next mondays earnings";"0.9353";"0.9353";"0.0";"opinionated";"🚀🚀";"2";"";"";"";"";"47";"0.13725490196078433"
"wallstreetbets";"2021-08-06";"Daily Popular Tickers Thread for August 05, 2021 - AMD | GME | AMC";"daily popular tickers thread for august 05 2021  amd  gme  amc";"0.8056";"0.8056";"0.45";"opinionated";"";"0";"";"";"";"";"62";"0.21212121212121213"
"wallstreetbets";"2021-08-06";"Robinhood shares fall as stockholders file to sell up to 97.9 million shares";"robinhood shares fall as stockholders file to sell up to 979 million shares";"0.2263";"0.2263";"0.0";"factual";"";"0";"";"diamond hands, robinhood";"";"";"75";"0.013157894736842105"
"superstonk";"2021-08-06";"CNBC UNDENIABLY WANTS TO STEER A NARRATIVE AWAY FROM CITADEL AND FUCKERY. Remember folks! Deleting Gary Gensler's recent clip is NOT their first time. They absolutely do NOT want to bring full light to the PURE CORRUPTION! They want to have a CONTROLLED DISCUSSION to let it fizzle out!!!";"cnbc undeniably wants to steer a narrative away from citadel and fuckery remember folks deleting gary genslers recent clip is not their first time they absolutely do not want to bring full light to the pure corruption they want to have a controlled discussion to let it fizzle out";"-0.7956";"-0.7956";"0.4761904761904763";"opinionated";"";"0";"cnbc";"hedge funds";"";"https://web.archive.org/web/20210806061114im_/https://preview.redd.it/z3dl6o8rolf71.jpg?width=640&crop=smart&auto=webp&s=edba50eb44265dca1b5c85ecc0e59741761eff54";"280";"0.3715277777777778"
"wallstreetbets";"2021-08-08";"If you are you a Robinhood trader who lost money in Gamestop, AMC, Nokia, Blackberry, or other stocks on or after January 28, 2021, contact nationally ranked plaintiff law firm Labaton Sucharow to find out if you could receive compensation.";"if you are you a robinhood trader who lost money in gamestop amc nokia blackberry or other stocks on or after january 28 2021 contact nationally ranked plaintiff law firm labaton sucharow to find out if you could receive compensation";"-0.3751";"-0.3751";"0.3875";"factual";"";"0";"";"robinhood";"";"https://web.archive.org/web/20210808024144im_/https://external-preview.redd.it/YWaUNIsK35VaIycdMx6p-NlrFNkvt7bo5XaqK8QAsLE.jpg?width=640&crop=smart&auto=webp&s=7e39aa92962e493a87dda0ceabb8e62df49c64b8";"233";"0.04583333333333333"
"superstonk";"2021-08-09";"The US Treasury Secretary Janet Yellen has been accused of corruption due to receiving $7.2 million in ‘speaking fees’ from just Citi bank and the Citadel hedge fund.";"the us treasury secretary janet yellen has been accused of corruption due to receiving 72 million in speaking fees from just citi bank and the citadel hedge fund";"-0.6597";"-0.6597";"0.375";"factual";"";"0";"treasury, janet yellen, us, the citadel hedge fund";"hedge funds, regulation";"";"";"161";"0.05421686746987952"
"superstonk";"2021-08-09";"Change.org: ""Secretary of the Treasury Janet Yellen Needs to Resign or Recuse Immediately"". Janet Yellen received roughly $810,000 in speaking fees from the hedge fund Citadel LLC who is currently embroiled in the Gamestop trade war.";"changeorg secretary of the treasury janet yellen needs to resign or recuse immediately janet yellen received roughly 810000 in speaking fees from the hedge fund citadel llc who is currently embroiled in the gamestop trade war";"-0.8591";"-0.8591";"0.4";"factual";"";"0";"treasury";"hedge funds, regulation";"";"";"225";"0.06866952789699571"
"wallstreetbets";"2021-08-10";"Daily Popular Tickers Thread for August 09, 2021 - MVST | AMC | GME";"daily popular tickers thread for august 09 2021  mvst  amc  gme";"0.8056";"0.8056";"0.45";"opinionated";"";"0";"";"";"";"";"63";"0.22388059701492538"
"superstonk";"2021-08-10";"NFT DIVIDENDs ARE REAL! Biologics company on the OTC Market announced theirs back in July, when GME's was predicted to go live. This is a really exciting precedent set for decentralized finance and of course...the MOASS!";"nft dividends are real biologics company on the otc market announced theirs back in july when gmes was predicted to go live this is a really exciting precedent set for decentralized finance and of coursethe moass";"0.6221";"0.6221";"0.4";"opinionated";"";"0";"";"drs";"";"";"212";"0.15"
"wallstreetbets";"2021-08-12";"Daily Popular Tickers Thread for August 11, 2021 - MVST | AMC | CLOV";"daily popular tickers thread for august 11 2021  mvst  amc  clov";"0.6166";"0.6166";"0.45";"opinionated";"";"0";"";"";"";"";"64";"0.23529411764705882"
"gme";"2021-08-13";"r/GME Megathread for Friday - August 13, 2021";"rgme megathread for friday  august 13 2021";"0.0";"0.0";"0.0";"factual";"";"0";"";"";"";"";"42";"0.13333333333333333"
"gme";"2021-08-13";"🕹🎮GME🎮🕹 HERE WE GO BOYS. Golden Cross Chart Patten on GameStop's 30min chart";"gme here we go boys golden cross chart patten on gamestops 30min chart";"0.34";"0.34";"0.25";"factual";"🕹🎮🎮🕹";"4";"";"";"";"https://web.archive.org/web/20210813125026im_/https://preview.redd.it/g0u1vpf2v3h71.png?width=640&crop=smart&auto=webp&s=763ce70adc58c71ea86b5b9f44db415611b76d77";"70";"0.27631578947368424"
"superstonk";"2021-08-15";"In case you're wondering if LinkedIn posts create any awareness, never have one of my articles had views from Citadel until this final one. Something shook the hornets nest. Maybe it's the DTCC part near the end for creating MOASS.";"in case youre wondering if linkedin posts create any awareness never have one of my articles had views from citadel until this final one something shook the hornets nest maybe its the dtcc part near the end for creating moass";"-0.2732";"-0.2732";"0.7";"opinionated";"";"0";"";"hedge funds";"";"https://web.archive.org/web/20210815004519im_/https://preview.redd.it/ibdq7aqzbch71.png?width=640&crop=smart&auto=webp&s=86bbb348ba65bbe88d16b66bc2b4e0877e0e94f0";"225";"0.06493506493506493"
"superstonk";"2021-08-16";"January GME OTC trades increased by 32% last week! The financial system is so corrupt that they allow criminals like Robinhood to cook their books almost 6 months after the public data is published. Ironic that FINRA's website is called OTC TrAnSpArEnCy. Hey FINRA, SEC, GG, FBI - what doing???";"january gme otc trades increased by 32 last week the financial system is so corrupt that they allow criminals like robinhood to cook their books almost 6 months after the public data is published ironic that finras website is called otc transparency hey finra sec gg fbi  what doing";"-0.2575";"-0.2575";"0.4388888888888889";"opinionated";"";"0";"fbi, sec";"regulation, robinhood";"";"";"282";"0.1292517006802721"
"wallstreetbets";"2021-08-16";"AMC - Quick technical and fundamental analysis for the next weeks";"amc  quick technical and fundamental analysis for the next weeks";"0.3034";"0.3034";"0.19999999999999998";"factual";"";"0";"";"hedge funds, dd/analysis";"";"";"64";"0.06153846153846154"
"superstonk";"2021-08-17";"SHFs and MMs are coordinating to keep GME from returning to the NYSE threshold securities list, because it triggered the January sneeze.";"shfs and mms are coordinating to keep gme from returning to the nyse threshold securities list because it triggered the january sneeze";"0.6633";"0.6633";"0.0";"opinionated";"";"0";"nyse";"hedge funds, diamond hands, regulation";"";"";"134";"0.09558823529411764"
"gme";"2021-08-17";"Still holding for years. I can do the same with GME";"still holding for years i can do the same with gme";"0.4995";"0.4995";"0.125";"opinionated";"";"0";"";"diamond hands";"";"https://web.archive.org/web/20210817144225im_/https://preview.redd.it/xq0ev4hz7xh71.jpg?width=640&crop=smart&auto=webp&s=91da5845925d755fff4b4714cb91345f03e4585b";"50";"0.09803921568627451"
"gme";"2021-08-17";"Here's an interesting thought: the bidding i am supposed to be doing for Citadel. Can you tell me what they care about? I have no idea. What's their plan? what do they buy or sell? I have never met anyone from Citadel. I could not pick the ceo out of a line-up 🤡🤡🤡🤡🤡🤡🤡🤡🤡🤡🤡🤡🤡🤡🤡🤡🤡🤡🤡";"heres an interesting thought the bidding i am supposed to be doing for citadel can you tell me what they care about i have no idea whats their plan what do they buy or sell i have never met anyone from citadel i could not pick the ceo out of a lineup";"-0.7041";"-0.7041";"0.5";"opinionated";"🤡🤡🤡🤡🤡🤡🤡🤡🤡🤡🤡🤡🤡🤡🤡🤡🤡🤡🤡";"19";"";"hedge funds, dd/analysis";"";"https://web.archive.org/web/20210817144225im_/https://preview.redd.it/50r77zllgvh71.jpg?width=640&crop=smart&auto=webp&s=aa77e9108b5a1e8b3589996bba45e14dc1074a63";"250";"0.02857142857142857"
"wallstreetbets";"2021-08-17";"Daily Popular Tickers Thread for August 16, 2021 - CLOV | AMC | GME";"daily popular tickers thread for august 16 2021  clov  amc  gme";"0.8056";"0.8056";"0.45";"opinionated";"";"0";"";"";"";"";"63";"0.22388059701492538"
"gme";"2021-08-17";"""And guys like me can't even say anything other than 'they're in great shape' because then I don't get in trouble. Right? See when you're reporting an outfit like Citadel, the important thing is not get in trouble. That's why I continue to tell you they're in great shape."" -Jim Cramer";"and guys like me cant even say anything other than theyre in great shape because then i dont get in trouble right see when youre reporting an outfit like citadel the important thing is not get in trouble thats why i continue to tell you theyre in great shape jim cramer";"0.9262";"0.9262";"0.5443877551020408";"opinionated";"";"0";"jim cramer";"hedge funds, apes/community";"";"";"269";"0.031578947368421054"
"gme";"2021-08-17";"r/GME Megathread for Tuesday - August 17, 2021";"rgme megathread for tuesday  august 17 2021";"0.0";"0.0";"0.0";"factual";"";"0";"";"";"";"";"43";"0.13043478260869565"
"superstonk";"2021-08-18";"Blackrock sold 22% of GME (Probably Rebalancing)...but: Vanguard increased its position by 9%..and what's that...Morgan Stanley increased its position by 210%!";"blackrock sold 22 of gme probably rebalancingbut vanguard increased its position by 9and whats thatmorgan stanley increased its position by 210";"0.7734";"0.7734";"0.0";"opinionated";"";"0";"s thatmorgan stanley";"";"";"https://web.archive.org/web/20210818133118im_/https://preview.redd.it/bay10cahb3i71.png?width=640&crop=smart&auto=webp&s=b2d10ea06e21a1b4b7d0800bedcb617e8e5bd655";"143";"0.05660377358490566"
"wallstreetbets";"2021-08-18";"Daily Popular Tickers Thread for August 17, 2021 - CLOV | AMC | GME";"daily popular tickers thread for august 17 2021  clov  amc  gme";"0.8056";"0.8056";"0.45";"opinionated";"";"0";"";"";"";"";"63";"0.22388059701492538"
"wallstreetbets";"2021-08-19";"Daily Popular Tickers Thread for August 18, 2021 - AMC | CLOV | GME";"daily popular tickers thread for august 18 2021  amc  clov  gme";"0.8056";"0.8056";"0.45";"opinionated";"";"0";"";"";"";"";"63";"0.22388059701492538"
"wallstreetbets";"2021-08-20";"How to make and sequentially lose over 100k at 18 years old. Rolled my AMC $40 calls over to September 17, unfortunately my luck ran out.";"how to make and sequentially lose over 100k at 18 years old rolled my amc 40 calls over to september 17 unfortunately my luck ran out";"0.1613";"0.1613";"0.6";"opinionated";"";"0";"100k";"";"";"";"133";"0.043795620437956206"
