"subreddit";"date";"title";"cleaned";"sentiment_vader_comp";"sentiment_final";"subjectivity";"subjectivity_label";"emojis";"emoji_count";"entities";"topic_tags";"upvotes";"image_urls";"title_length";"capslock_ratio"
"superstonk";"2024-07-05";"MOASS…This is it. Once in a lifetime chance to call the price of something you own. Something you can legally sell. To a market that needs to buy. Change your life this ONE time. Get your head around the money required to make the changes you actually want in life.";"moassthis is it once in a lifetime chance to call the price of something you own something you can legally sell to a market that needs to buy change your life this one time get your head around the money required to make the changes you actually want in life";"0.4019";"0.4019";"0.43333333333333335";"opinionated";"";"0";"";"";"2564.0";"https://web.archive.org/web/20240705223941im_/https://preview.redd.it/moass-this-is-it-once-in-a-lifetime-chance-to-call-the-v0-84r5wtr8moad1.jpeg?width=640&crop=smart&auto=webp&s=57cdb275d47fdbd9ce44dd564002b75ae63fcd71";"258";"0.052830188679245285"
"superstonk";"2024-07-05";"Day 720 of Running 7.41 Until MOASS";"day 720 of running 741 until moass";"0.0";"0.0";"0.0";"factual";"";"0";"";"";"870.0";"https://web.archive.org/web/20240705223941im_/https://preview.redd.it/day-720-of-running-7-41-until-moass-v0-shhdvdhjzpad1.jpeg?width=640&crop=smart&auto=webp&s=b198d0b0791435d701eaf324534ec348d46d69bf";"34";"0.22857142857142856"
"superstonk";"2024-07-10";"Insider Cheng Lawrence reports buying 4,140 shares of GME / GameStop Corp. at a total cost of $102,879.00";"insider cheng lawrence reports buying 4140 shares of gme  gamestop corp at a total cost of 10287900";"0.6633";"0.6633";"0.75";"opinionated";"";"0";"gme  gamestop corp, cheng lawrence";"";"7680.0";"";"99";"0.08571428571428572"
"gme";"2024-07-16";"[S3:E87] The Golden Pinecone Daily GME Tournament (15th July 2024";"s3e87 the golden pinecone daily gme tournament 15th july 2024";"0.4995";"0.4995";"0.25";"opinionated";"";"0";"";"";"14.0";"";"61";"0.16923076923076924"
"gme";"2024-07-16";"r/GME Megathread for July 15, 2024";"rgme megathread for july 15 2024";"0.0";"0.0";"0.0";"factual";"";"0";"";"";"52.0";"";"32";"0.14705882352941177"
"gme";"2024-07-16";"Time for a run? $GME";"time for a run gme";"0.4995";"0.4995";"0.0";"opinionated";"";"0";"";"";"124.0";"";"18";"0.2"
"gme";"2024-07-16";"GME Fails-to-Deliver (FTD)";"gme failstodeliver ftd";"0.4995";"0.4995";"0.0";"opinionated";"";"0";"gme failstodeliver";"";"131.0";"https://web.archive.org/web/20240716003930im_/https://preview.redd.it/gme-fails-to-deliver-ftd-v0-zzbxq6192pcd1.jpeg?width=640&crop=smart&auto=webp&s=fdf4e54844f555fdf505aa499ffc5657e1ce70e0";"22";"0.3076923076923077"
"gme";"2024-07-16";"#GME 🔥 $30 this week? $GME getting stronger!";"gme  30 this week gme getting stronger";"0.7881";"0.7881";"0.0";"opinionated";"🔥";"1";"gme  ";"";"53.0";"";"38";"0.13636363636363635"
"gme";"2024-07-16";"Ken Griffin of Citadel, what a guy he is... Where are you Ken?!";"ken griffin of citadel what a guy he is where are you ken";"-0.6476";"-0.6476";"0.0";"opinionated";"";"0";"ken griffin";"hedge funds";"578.0";"https://web.archive.org/web/20240716003930im_/https://external-preview.redd.it/ken-griffin-of-citadel-what-a-guy-he-is-where-are-you-ken-v0-bnU1dnRqaWp0cWNkMVbYdd7G3YfqYzZvjnTDbgHioPFsysohHVlaQEqCVpX8.png?width=640&crop=smart&format=pjpg&auto=webp&s=ed9768141d9a03989a060bf7baa1ffd742345f7f";"57";"0.07936507936507936"
"gme";"2024-07-16";"Continuation on my previous post that turned true $GME:";"continuation on my previous post that turned true gme";"0.7213";"0.7213";"0.4083333333333333";"opinionated";"";"0";"";"";"113.0";"";"53";"0.07272727272727272"
"gme";"2024-08-03";"GME ENTERED BUY ZONE ON JULY 30TH FOLLOWED BY MAJOR MARKET CORRECTION SETTING UP AN AMAZING MONTHLY CALL OPPORTUNITY.";"gme entered buy zone on july 30th followed by major market correction setting up an amazing monthly call opportunity";"0.8442";"0.92862";"0.7";"opinionated";"";"0";"";"";"10.0";"https://web.archive.org/web/20240803064140im_/https://preview.redd.it/gme-entered-buy-zone-on-july-30th-followed-by-major-market-v0-6c0k4g0rmdgd1.jpeg?width=640&crop=smart&auto=webp&s=7efb8b70769455dc82d920ff48b1173e01ef11ed";"116";"0.8205128205128205"
"gme";"2024-08-03";"r/GME Megathread for August 03, 2024";"rgme megathread for august 03 2024";"0.0";"0.0";"0.0";"factual";"";"0";"";"";"6.0";"";"34";"0.1388888888888889"
"gme";"2024-08-03";"The price keeps dropping - I keep buying. Just reached XXXX shares and tits couldn’t be more jacked. GME is my new currency 😂 question below:";"the price keeps dropping  i keep buying just reached xxxx shares and tits couldnt be more jacked gme is my new currency  question below";"0.797";"0.797";"0.4772727272727273";"opinionated";"😂";"1";"";"";"391.0";"https://web.archive.org/web/20240803064140im_/https://preview.redd.it/the-price-keeps-dropping-i-keep-buying-just-reached-xxxx-v0-9fx2elghi9gd1.jpeg?width=640&crop=smart&auto=webp&s=8883328c4a7adfa6580fdc8836a7b6447eb357f3";"135";"0.07092198581560284"
"wallstreetbets";"2024-08-07";"$470 to $11K on online blackjack. Threw it in robinhood yesterday $5K gain today";"470 to 11k on online blackjack threw it in robinhood yesterday 5k gain today";"0.2263";"0.2263";"0.0";"factual";"";"0";"";"robinhood";"4312.0";"https://web.archive.org/web/20240807171532im_/https://preview.redd.it/470-to-11k-on-online-blackjack-threw-it-in-robinhood-v0-0er3r7frn2hd1.jpeg?width=640&crop=smart&auto=webp&s=34d2672582777fea07250b37805231467545d375";"76";"0.0375"
"superstonk";"2024-08-25";"“Babe, can you show me how tight the Bollinger bands on $GME are right now??”";"babe can you show me how tight the bollinger bands on gme are right now";"0.5563";"0.5563";"0.4107142857142857";"opinionated";"";"0";"";"regulation";"218.0";"https://web.archive.org/web/20240825200448im_/https://preview.redd.it/babe-can-you-show-me-how-tight-the-bollinger-bands-on-gme-v0-lnvmt6jmcukd1.jpeg?width=640&crop=smart&auto=webp&s=637796c9aa7a5c28d390966c1f16b84a90d72986";"71";"0.06493506493506493"
"superstonk";"2024-08-25";"Caught between MOASS and Gameshire Stopaway (a.k.a. ""Why I think the $4.1533 billion M&A war chest is, one way or another, highly likely to make us all filthy rich"")";"caught between moass and gameshire stopaway aka why i think the 41533 billion ma war chest is one way or another highly likely to make us all filthy rich";"-0.0772";"-0.0772";"0.9166666666666666";"opinionated";"";"0";"41533 billion";"";"2476.0";"";"153";"0.07272727272727272"
"superstonk";"2024-08-25";"Milano GameStop #3, has a post MOASS store to go with our new welcome mats. These post have been fun, thanks all! Safe travels!";"milano gamestop 3 has a post moass store to go with our new welcome mats these post have been fun thanks all safe travels";"0.9133";"0.9133";"0.45090909090909087";"opinionated";"";"0";"";"";"226.0";"";"121";"0.07874015748031496"
"superstonk";"2024-08-25";"An x-ray of the average GME investor";"an xray of the average gme investor";"0.4995";"0.4995";"0.39999999999999997";"opinionated";"";"0";"";"";"270.0";"https://web.archive.org/web/20240825200448im_/https://preview.redd.it/an-x-ray-of-the-average-gme-investor-v0-g849nj372skd1.jpeg?width=640&crop=smart&auto=webp&s=149e6d578da5c652d79bae3f71b860daa4802a1e";"35";"0.1111111111111111"
"superstonk";"2024-08-25";"MOASS next week? Maybe, in two weeks? (Repost. Broke rule 14; rationale inside)";"moass next week maybe in two weeks repost broke rule 14 rationale inside";"-0.4871";"-0.4871";"0.0";"factual";"";"0";"";"";"616.0";"https://web.archive.org/web/20240825200448im_/https://preview.redd.it/moass-next-week-maybe-in-two-weeks-repost-broke-rule-14-v0-o6geyb6m0qkd1.png?width=640&crop=smart&auto=webp&s=beb308ea255f434c71e0bff56d90420492fb949c";"72";"0.10126582278481013"
"gme";"2024-08-28";"GME Earnings Date - Sept 10th";"gme earnings date  sept 10th";"0.4995";"0.4995";"0.0";"opinionated";"";"0";"";"";"743.0";"https://web.archive.org/web/20240828151140im_/https://preview.redd.it/gme-earnings-date-sept-10th-v0-10uvoqcw0ald1.jpeg?width=640&crop=smart&auto=webp&s=97cf6fe6da55141f1329d7dc53f5f098fdff26bc";"28";"0.20689655172413793"
"gme";"2024-08-28";"GME price glitch 4pm";"gme price glitch 4pm";"0.4995";"0.4995";"0.0";"opinionated";"";"0";"";"";"176.0";"";"20";"0.15"
"gme";"2024-08-28";"GME After hours is DIFFERENT move 1 penny up or down";"gme after hours is different move 1 penny up or down";"0.4995";"0.4995";"0.4444444444444444";"opinionated";"";"0";"1 penny";"";"18.0";"https://web.archive.org/web/20240828151140im_/https://preview.redd.it/gme-after-hours-is-different-move-1-penny-up-or-down-v0-fq3bsmm8neld1.jpeg?width=640&crop=smart&auto=webp&s=546e8d74fed8e41373ad5a918098cdaf58171d00";"52";"0.25"
"gme";"2024-08-28";"GME GenX Movie Posters";"gme genx movie posters";"0.4995";"0.4995";"0.0";"opinionated";"";"0";"gme genx";"";"7.0";"";"22";"0.3181818181818182"
"gme";"2024-08-28";"Average GME investor ";"average gme investor";"0.4995";"0.4995";"0.39999999999999997";"opinionated";"";"0";"";"";"140.0";"https://web.archive.org/web/20240828151140im_/https://external-preview.redd.it/average-gme-investor-v0-cm8wNXQ0NHVpZWxkMeLKEpS2ucgSSraRwP6sQ4C1UcJxPMiZkk9QtAWSiXMH.png?width=640&crop=smart&format=pjpg&auto=webp&s=bfa0c4fd06fc237f8de0cbd3bf4758bb14f9909a";"20";"0.19047619047619047"
"gme";"2024-08-28";"r/GME Megathread for August 28, 2024";"rgme megathread for august 28 2024";"0.0";"0.0";"0.0";"factual";"";"0";"";"";"39.0";"";"34";"0.1388888888888889"
"gme";"2024-08-28";"[S3:E119] The Golden Pinecone Daily GME Tournament (28th August 2024)";"s3e119 the golden pinecone daily gme tournament 28th august 2024";"0.4995";"0.4995";"0.25";"opinionated";"";"0";"";"";"9.0";"";"64";"0.15942028985507245"
"gme";"2024-08-28";"Zen and GME";"zen and gme";"0.4995";"0.4995";"0.0";"opinionated";"";"0";"";"";"275.0";"https://web.archive.org/web/20240828151140im_/https://preview.redd.it/zen-and-gme-v0-7q21e19m6ald1.jpeg?width=640&crop=smart&auto=webp&s=62b9a3078d551c683cce3a4080a9814f4b1b933e";"11";"0.36363636363636365"
"gme";"2024-08-28";"GME!!!⚡️🚀⬆️ Today Is The Day!!! LFG!!!";"gme today is the day lfg";"0.8556";"0.8556";"0.0";"opinionated";"⚡🚀⬆";"3";"gme today";"";"49.0";"https://web.archive.org/web/20240828151140im_/https://preview.redd.it/gme-today-is-the-day-lfg-v0-04getwzh2dld1.jpeg?width=640&crop=smart&auto=webp&s=1e5dfa588c3e51fef3922d320257795f73e6331f";"24";"0.2631578947368421"
"superstonk";"2024-09-03";"Northen Trust - Crazy stuff with GME and not only ";"northen trust  crazy stuff with gme and not only";"0.6289";"0.6289";"0.95";"opinionated";"";"0";"";"";"1099.0";"";"48";"0.12"
"superstonk";"2024-09-05";"The walls are closing in on hedge funds engaged in illegal market manipulation. On 09/04/2024 a SINGLE hedge fund (the name of which has been REDACTED) triggered 2,940 alerts of potentially illegal spoofing activity 🔥 ";"the walls are closing in on hedge funds engaged in illegal market manipulation on 09042024 a single hedge fund the name of which has been redacted triggered 2940 alerts of potentially illegal spoofing activity";"-0.8442";"-0.8442";"0.4047619047619048";"factual";"🔥";"1";"";"hedge funds";"1627.0";"https://web.archive.org/web/20240905192605im_/https://preview.redd.it/the-walls-are-closing-in-on-hedge-funds-engaged-in-illegal-v0-vucqjbotf0nd1.jpeg?auto=webp&s=5e01752e1e0bdfcce3b6a830333e6318dd4d6a50";"209";"0.07339449541284404"
"superstonk";"2024-09-06";"It's harder and harder to talk to anyone outside the ""ape community"" about GME - but I'd really like to !";"its harder and harder to talk to anyone outside the ape community about gme  but id really like to";"0.7813";"0.7813";"0.0625";"opinionated";"";"0";"";"apes/community";"86.0";"";"98";"0.047619047619047616"
"superstonk";"2024-09-06";"Max Pain Upgrade and New Baby Gamma Ramp Coming Up? - GME 9/6 Open Interest Price Movement Forecast and Options Analysis";"max pain upgrade and new baby gamma ramp coming up  gme 96 open interest price movement forecast and options analysis";"0.4466";"0.4466";"0.4772727272727273";"opinionated";"";"0";"max";"dd/analysis";"89.0";"";"117";"0.15833333333333333"
"superstonk";"2024-09-06";"September might wreck the stock market... will GME be the only one to survive? Brace yourselves! This is the month where everything starts to unfold! 🔥💥🚀";"september might wreck the stock market will gme be the only one to survive brace yourselves this is the month where everything starts to unfold";"0.254";"0.254";"1.0";"opinionated";"🔥💥🚀";"3";"";"";"200.0";"https://web.archive.org/web/20240906144323im_/https://preview.redd.it/september-might-wreck-the-stock-market-will-gme-be-the-only-v0-gem92ip7p5nd1.jpeg?width=640&crop=smart&auto=webp&s=3f8d18c306e0024abeda7fd2b6165b3a298e45a3";"143";"0.0392156862745098"
"superstonk";"2024-09-06";"Me post-MOASS";"me postmoass";"0.0";"0.0";"0.0";"factual";"";"0";"";"";"94.0";"https://web.archive.org/web/20240906144323im_/https://external-preview.redd.it/me-post-moass-v0-cGd3amsza3lkNm5kMUwqLgV8Y7Q5ktEULJYsH7novu-kzsk4uBwFfDTnK9Dy.png?width=640&crop=smart&format=pjpg&auto=webp&s=5b64d72583ff42206da3313cc530279f65057874";"12";"0.46153846153846156"
"superstonk";"2024-09-06";"""I think DFV was trying to tell us via his stockcharts account there is an algo pattern that repeats itself at different scales/time intervals -- and if this is correct, $GME is on track to skip past the Moon and ping Jupiter.""";"i think dfv was trying to tell us via his stockcharts account there is an algo pattern that repeats itself at different scalestime intervals  and if this is correct gme is on track to skip past the moon and ping jupiter";"0.8038";"0.8038";"0.425";"opinionated";"";"0";"ping jupiter";"";"203.0";"";"219";"0.039647577092511016"
"gme";"2024-09-10";"YT video that describes how hedge funds are killing our economy. ";"yt video that describes how hedge funds are killing our economy";"-0.6597";"-0.6597";"0.0";"factual";"";"0";"";"hedge funds";"59.0";"";"63";"0.03076923076923077"
"gme";"2024-09-10";"MOASS IS TOMORROW !!!💥💥💥🚀🚀🚀💎🙌🏽💎🙌🏽💎🙌🏽";"moass is tomorrow";"0.8114";"0.8925400000000001";"0.0";"opinionated";"💥💥💥🚀🚀🚀💎🙌🏽💎🙌🏽💎🙌🏽";"15";"";"diamond hands";"194.0";"https://web.archive.org/web/20240910062425im_/https://preview.redd.it/moass-is-tomorrow-v0-5vsuhup3mund1.jpeg?width=640&crop=smart&auto=webp&s=b84e584ed214cd51d154efd39cb8c3fa5101918a";"17";"0.4166666666666667"
"gme";"2024-09-10";"cat is forming, moass soon";"cat is forming moass soon";"0.0";"0.0";"0.0";"factual";"";"0";"";"";"189.0";"https://web.archive.org/web/20240910062425im_/https://preview.redd.it/cat-is-forming-moass-soon-v0-afa8wn8qmtnd1.jpeg?width=640&crop=smart&auto=webp&s=641742cbc5cc61278b6d5ccc633c578569f297b6";"25";"0.0"
"gme";"2024-09-10";"What if GameStop reports that RC made $100,000,000 or more in the quarter trading the 4 BILLION $$$ that GME has in cash and equivalents on hand?!?!?!? To da moon, baby, TO DA MOON!!! 🚀🚀🚀🚀🚀🚀🚀🚀🚀🚀🚀🚀🚀🚀🚀🚀🚀🚀🚀🚀🚀🚀🚀🚀🚀🚀🚀🚀🚀🚀🚀🚀🚀🚀🚀🚀🚀🚀🚀🚀🚀🚀🚀🚀🚀🚀🚀🚀🚀🚀🚀🚀🚀🚀🚀🚀🚀🚀";"what if gamestop reports that rc made 100000000 or more in the quarter trading the 4 billion  that gme has in cash and equivalents on hand to da moon baby to da moon";"0.9998";"0.9998";"0.5";"opinionated";"🚀🚀🚀🚀🚀🚀🚀🚀🚀🚀🚀🚀🚀🚀🚀🚀🚀🚀🚀🚀🚀🚀🚀🚀🚀🚀🚀🚀🚀🚀🚀🚀🚀🚀🚀🚀🚀🚀🚀🚀🚀🚀🚀🚀🚀🚀🚀🚀🚀🚀🚀🚀🚀🚀🚀🚀🚀🚀";"58";"";"";"672.0";"";"165";"0.09917355371900827"
"gme";"2024-09-10";"Larry Cheng tweeted about CEO salaries! GME GO BRRRRRRR";"larry cheng tweeted about ceo salaries gme go brrrrrrr";"0.5461";"0.5461";"0.0";"opinionated";"";"0";"larry cheng";"";"59.0";"";"54";"0.32727272727272727"
"gme";"2024-09-10";"$GME Go BRRR 🤞";"gme go brrr";"0.4995";"0.54945";"0.0";"opinionated";"🤞";"1";"";"";"474.0";"https://web.archive.org/web/20240910062425im_/https://external-preview.redd.it/gme-go-brrr-v0-NmhzZGxhZzUydW5kMa4X4gzQZnFi9rZpYkYxWbXLGPnHTjMBHdj9ObyEk77Z.png?width=640&crop=smart&format=pjpg&auto=webp&s=f0ea9d234d5c1b48aa18e8cd04bd67763a2895f1";"11";"0.5714285714285714"
"superstonk";"2024-09-14";"Financial times taking a piss on GME (ps, the stock soared 2 weeks later the last time they did that) ";"financial times taking a piss on gme ps the stock soared 2 weeks later the last time they did that";"0.1363";"0.1363";"0.022222222222222223";"factual";"";"0";"gme ps";"";"1056.0";"";"98";"0.0392156862745098"
"gme";"2024-09-15";"Can GME now decide who buys the dilution shares?";"can gme now decide who buys the dilution shares";"0.6633";"0.6633";"0.0";"opinionated";"";"0";"";"";"96.0";"";"47";"0.08333333333333333"
"gme";"2024-09-15";"I'm so thankful GME provides a solid place for cards traders...";"im so thankful gme provides a solid place for cards traders";"0.8444";"0.8444";"0.1";"opinionated";"";"0";"";"";"195.0";"";"59";"0.06349206349206349"
"gme";"2024-09-15";"Putting the emoji timeline in context of the upcoming FOMC interest rate decision— How DFV figured out about the Japanese carry trade through RC’s tweets 🥸👀🤩, an explanation for 🍏🤨😵‍💫, and using a recent Senate report investigating Citadel to explain what regulators fear may cause the next 💥";"putting the emoji timeline in context of the upcoming fomc interest rate decision how dfv figured out about the japanese carry trade through rcs tweets  an explanation for  and using a recent senate report investigating citadel to explain what regulators fear may cause the next";"-0.8591";"-0.8591";"0.08333333333333333";"factual";"🥸👀🤩🍏🤨😵💫💥";"8";"senate";"hedge funds, drs";"1.0";"";"278";"0.04794520547945205"
"gme";"2024-09-15";"Can We Prove GME Swaps Settlement After Archegos? Let’s Discuss the Facts.";"can we prove gme swaps settlement after archegos lets discuss the facts";"0.4995";"0.4995";"0.0";"opinionated";"";"0";"";"";"66.0";"";"71";"0.17567567567567569"
"gme";"2024-09-15";"r/GME Megathread for September 15, 2024";"rgme megathread for september 15 2024";"0.0";"0.0";"0.0";"factual";"";"0";"";"";"38.0";"";"37";"0.1282051282051282"
"superstonk";"2024-09-24";"At around 4.6 billion GME has the 117th biggest stockpile in America 🚀🚀";"at around 46 billion gme has the 117th biggest stockpile in america";"0.9049";"0.9049";"0.0";"opinionated";"🚀🚀";"2";"america, around 46 billion";"";"2877.0";"https://web.archive.org/web/20240924115147im_/https://preview.redd.it/at-around-4-6-billion-gme-has-the-117th-biggest-stockpile-v0-vcorbhkqemqd1.jpeg?width=640&crop=smart&auto=webp&s=0cdead1adb535971560483a27aae5ac55ff54455";"67";"0.07042253521126761"
"superstonk";"2024-09-24";"Adding further perspective to a previous post, GME has the 17th highest Cash-Debt figure out of the 102 companies I could be bothered looking at (got another 98 to go).";"adding further perspective to a previous post gme has the 17th highest cashdebt figure out of the 102 companies i could be bothered looking at got another 98 to go";"0.2342";"0.2342";"0.3333333333333333";"factual";"";"0";"";"dd/analysis";"631.0";"";"163";"0.041666666666666664"
"superstonk";"2024-09-24";"Larry sends you a heads up. He is chatting with an obvious GME ape. Link in Comments";"larry sends you a heads up he is chatting with an obvious gme ape link in comments";"0.694";"0.694";"0.5";"opinionated";"";"0";"larry";"apes/community";"501.0";"https://web.archive.org/web/20240924115147im_/https://preview.redd.it/larry-sends-you-a-heads-up-he-is-chatting-with-an-obvious-v0-dfwqoc1dbqqd1.png?auto=webp&s=156185a9c4a27fcf80f2d65a86055ead86e23761";"82";"0.08333333333333333"
"gme";"2024-09-27";"Poor Student DRS’d GME";"poor student drsd gme";"0.0343";"0.0343";"0.6";"opinionated";"";"0";"";"drs";"724.0";"https://web.archive.org/web/20240927060114im_/https://preview.redd.it/poor-student-drsd-gme-v0-dqauaxr297rd1.jpeg?width=640&crop=smart&auto=webp&s=f58bf2b722fe804ba6033c17519220127a68096f";"21";"0.36363636363636365"
"gme";"2024-09-27";"[S3:E139] The Golden Pinecone Daily GME Tournament (26th September 2024)";"s3e139 the golden pinecone daily gme tournament 26th september 2024";"0.4995";"0.4995";"0.25";"opinionated";"";"0";"";"";"50.0";"";"67";"0.1527777777777778"
"gme";"2024-09-27";"Today is a good day? GME 📈";"today is a good day gme";"0.7297";"0.7297";"0.6000000000000001";"opinionated";"📈";"1";"";"";"87.0";"https://web.archive.org/web/20240927060114im_/https://preview.redd.it/today-is-a-good-day-gme-v0-tb85mg99p5rd1.jpeg?width=640&crop=smart&auto=webp&s=68e285d506fa7b3d7f4a4e96fa7a5cbd87e97848";"23";"0.15384615384615385"
"gme";"2024-09-27";"Mark Vadon, RC's mentor at Chewy (2014): Raise Big, Hold Cash, Stay Quiet. Advice on 28-year-old (RC's age then) and interview response mirrors GME's strategy today. Did he just explain Ryan Cohen's approach with GameStop? (credit to u/No_Map_8307, see discussion post ""GameStop business approach"")";"mark vadon rcs mentor at chewy 2014 raise big hold cash stay quiet advice on 28yearold rcs age then and interview response mirrors gmes strategy today did he just explain ryan cohens approach with gamestop credit to uno_map_8307 see discussion post gamestop business approach";"0.5574";"0.5574";"0.21666666666666667";"opinionated";"";"0";"mark vadon, u/No_Map_8307";"drs, diamond hands";"267.0";"https://web.archive.org/web/20240927060114im_/https://external-preview.redd.it/mark-vadon-rcs-mentor-at-chewy-2014-raise-big-hold-cash-v0-bnBtcTAwNDBpOHJkMccJMpj08V9gF49ZqJ_Lgvtv0uG7H88i68UBRXPWTQPY.png?width=640&crop=smart&format=pjpg&auto=webp&s=eb9b824e234b3827c4472a6d334396b83b4c943f";"275";"0.087248322147651"
"gme";"2024-09-27";"GME price bi-polar between $22.28 vs $23.45 ";"gme price bipolar between 2228 vs 2345";"0.4995";"0.4995";"0.0";"opinionated";"";"0";"";"";"179.0";"https://web.archive.org/web/20240927060114im_/https://preview.redd.it/gme-price-bi-polar-between-22-28-vs-23-45-v0-c3y2glgzp5rd1.jpeg?width=640&crop=smart&auto=webp&s=98a3323b853785d6af8c2c154b2033702299dd02";"38";"0.06818181818181818"
"gme";"2024-09-27";"r/GME Megathread for September 27, 2024";"rgme megathread for september 27 2024";"0.0";"0.0";"0.0";"factual";"";"0";"";"";"5.0";"";"37";"0.1282051282051282"
"gme";"2024-09-27";"I love how halfway down they rate GME as a sell.... However, the article is explaining that large holders keep buying in LOLZ>>>.";"i love how halfway down they rate gme as a sell however the article is explaining that large holders keep buying in lolz";"0.9164";"0.9164";"0.43915343915343913";"opinionated";"";"0";"";"diamond hands";"170.0";"";"120";"0.06976744186046512"
"superstonk";"2024-09-30";"GME FTDs for the first half of September";"gme ftds for the first half of september";"0.4995";"0.4995";"0.25";"opinionated";"";"0";"";"";"472.0";"https://web.archive.org/web/20240930221411im_/https://preview.redd.it/gme-ftds-for-the-first-half-of-september-v0-4db17w92uyrd1.png?auto=webp&s=a0732142078f2da79390611ab6d0496cd2f728a3";"40";"0.175"
"superstonk";"2024-09-30";"GME under RC...";"gme under rc";"0.4995";"0.4995";"0.0";"opinionated";"";"0";"gme under rc";"";"1243.0";"";"12";"0.3333333333333333"
"superstonk";"2024-09-30";"$GME tests $23 🎯";"gme tests 23";"0.4995";"0.4995";"0.0";"opinionated";"🎯";"1";"";"";"1195.0";"https://web.archive.org/web/20240930221411im_/https://preview.redd.it/gme-tests-23-v0-0tvfnvoziyrd1.jpeg?width=640&crop=smart&auto=webp&s=c82f6908e940cb8e129c5066533c7d9e7963f5af";"12";"0.1875"
"superstonk";"2024-09-30";"Ryan Cohen & DFV first time meeting each other 🚀";"ryan cohen  dfv first time meeting each other";"0.6124";"0.6124";"0.35416666666666663";"opinionated";"🚀";"1";"ryan cohen  dfv";"";"313.0";"https://web.archive.org/web/20240930221411im_/https://external-preview.redd.it/ryan-cohen-dfv-first-time-meeting-each-other-v0-NDNveDQ0cG5oenJkMZM4PviTXKXhdPkcMJcfkafXG1EhX3OxtRr7teOwwUZ_.png?width=640&crop=smart&format=pjpg&auto=webp&s=de88742c15871711f5f80361235115744dd9359e";"45";"0.10416666666666667"
"superstonk";"2024-09-30";"Kinda crazy to me that Analysts think GME is going to post a negative EPS in 64 days( q3). Are these guys forgetting about GME's short term interest income? GME should bank 55+ million from that alone! ";"kinda crazy to me that analysts think gme is going to post a negative eps in 64 days q3 are these guys forgetting about gmes short term interest income gme should bank 55 million from that alone";"0.4499";"0.4499";"0.5333333333333333";"opinionated";"";"0";"kinda";"regulation";"245.0";"https://web.archive.org/web/20240930221411im_/https://preview.redd.it/kinda-crazy-to-me-that-analysts-think-gme-is-going-to-post-v0-rxry4wgezzrd1.jpeg?auto=webp&s=b805f0b179425e00944bbb77f13a78961a7d822d";"194";"0.07425742574257425"
"superstonk";"2024-09-30";"The masterpiece - MOASS (possibly) begins in January 2025";"the masterpiece  moass possibly begins in january 2025";"0.6249";"0.6249";"1.0";"opinionated";"";"0";"";"";"1529.0";"";"54";"0.12280701754385964"
"gme";"2024-10-02";"r/GME Megathread for October 02, 2024";"rgme megathread for october 02 2024";"0.0";"0.0";"0.0";"factual";"";"0";"";"";"43.0";"";"35";"0.13513513513513514"
"gme";"2024-10-02";"[S3:E143] The Golden Pinecone Daily GME Tournament (2nd October 2024)";"s3e143 the golden pinecone daily gme tournament 2nd october 2024";"0.4995";"0.4995";"0.16666666666666666";"opinionated";"";"0";"";"";"42.0";"";"64";"0.15942028985507245"
