"subreddit";"date";"title";"cleaned";"sentiment_vader_comp";"sentiment_final";"subjectivity";"subjectivity_label";"emojis";"emoji_count";"entities";"topic_tags";"upvotes";"image_urls";"title_length";"capslock_ratio"
"superstonk";"2021-03-23";"Guess who had puts in December on AMC....";"guess who had puts in december on amc";"0.186";"0.186";"0.0";"factual";"";"0";"";"";"";"https://web.archive.org/web/20210323184914im_/https://preview.redd.it/njbymt0hkno61.jpg?width=640&crop=smart&auto=webp&s=52b229df3bdc03fddf29fb9a6833871f42becfca";"37";"0.12195121951219512"
"superstonk";"2021-04-06";"$GME Terminal drop with short interest";"gme terminal drop with short interest";"0.6289";"0.6289";"0.3";"opinionated";"";"0";"";"";"";"";"37";"0.10526315789473684"
"superstonk";"2021-04-08";"NEW RECORD: GME had the lowest volume, EVER! (4,602,621)";"new record gme had the lowest volume ever 4602621";"0.2323";"0.2323";"0.45454545454545453";"opinionated";"";"0";"";"";"";"";"49";"0.2857142857142857"
"superstonk";"2021-04-08";"The MOASS Preparation Guide";"the moass preparation guide";"0.0";"0.0";"0.0";"factual";"";"0";"";"";"";"";"27";"0.2962962962962963"
"superstonk";"2021-04-10";"BREAKING NEWS: Melvin Capital, obviously they didn’t cover lmfao";"breaking news melvin capital obviously they didnt cover lmfao";"0.3612";"0.3612";"0.5";"opinionated";"";"0";"";"hedge funds";"";"https://web.archive.org/web/20210410001733im_/https://preview.redd.it/7480wx3hd7s61.jpg?width=640&crop=smart&auto=webp&s=e19e0f9ee98da38c6c9f599cf21248bc9a040b05";"61";"0.21875"
"superstonk";"2021-04-10";"Superstonk $GME Discussion";"superstonk gme discussion";"0.4995";"0.4995";"0.0";"opinionated";"";"0";"";"";"";"";"25";"0.19230769230769232"
"superstonk";"2021-04-14";"DFV and Ryan Cohen’s first meeting went well 🦍";"dfv and ryan cohens first meeting went well";"0.2732";"0.2732";"0.3333333333333333";"factual";"🦍";"1";"";"";"";"";"43";"0.10869565217391304"
"superstonk";"2021-04-16";"Fun Graphs: Citadels twitter posts by month";"fun graphs citadels twitter posts by month";"0.5106";"0.5106";"0.2";"opinionated";"";"0";"";"hedge funds";"";"https://web.archive.org/web/20210416011052im_/https://i.redd.it/iy7myblf4et61.png";"42";"0.06976744186046512"
"superstonk";"2021-04-16";"DFV JUST WENT ALL IN! TWEETS DECODED";"dfv just went all in tweets decoded";"0.0";"0.0";"0.0";"opinionated";"";"0";"";"";"";"";"35";"0.8055555555555556"
"superstonk";"2021-04-17";"DFV!!";"dfv";"0.0";"0.0";"0.0";"opinionated";"";"0";"";"";"";"https://web.archive.org/web/20210417032425im_/https://preview.redd.it/n7m08253glt61.png?width=640&crop=smart&auto=webp&s=680312bbc2fd033fb1b98662df040fb91fc83ed8";"3";"0.6"
"superstonk";"2021-04-17";"GAMESTOP REPLIED TO DFV’s NEWEST TWEET";"gamestop replied to dfvs newest tweet";"0.0";"0.0";"0.0";"factual";"";"0";"";"";"";"https://web.archive.org/web/20210417032425im_/https://preview.redd.it/owmy0mh5qmt61.jpg?width=640&crop=smart&auto=webp&s=e488cc0e31d869ad6de4cabf1b771ca34847ad77";"37";"0.8157894736842105"
"superstonk";"2021-04-19";"MOASS : How to not fuck up - extended";"moass  how to not fuck up  extended";"0.2755";"0.2755";"0.6";"opinionated";"";"0";"";"";"";"https://web.archive.org/web/20210419003851im_/https://preview.redd.it/fc8tacfjsyt61.jpg?width=640&crop=smart&auto=webp&s=def7109191ab06ed905a3ad1da32e18587443ac3";"35";"0.16216216216216217"
"superstonk";"2021-04-19";"I think I figured out what DFV knows... and it’s pretty simple.";"i think i figured out what dfv knows and its pretty simple";"0.4939";"0.4939";"0.6785714285714286";"opinionated";"";"0";"";"";"";"";"58";"0.07936507936507936"
"superstonk";"2021-04-22";"$GME Daily Discussion - April 21, 2021";"gme daily discussion  april 21 2021";"0.4995";"0.4995";"0.0";"opinionated";"";"0";"gme daily";"";"";"";"35";"0.15789473684210525"
"superstonk";"2021-04-22";"GME closed $0.01 from previous day close - This has happened only two other days in the past January 12th with a delta of $0.01 and February 23rd with the exact same closing price as open. The next day after each, the price doubled. You're likely seeing the settled price of entrance into margin call";"gme closed 001 from previous day close  this has happened only two other days in the past january 12th with a delta of 001 and february 23rd with the exact same closing price as open the next day after each the price doubled youre likely seeing the settled price of entrance into margin call";"0.4995";"0.4995";"0.37666666666666665";"opinionated";"";"0";"gme";"";"";"https://web.archive.org/web/20210422042818im_/https://preview.redd.it/tc8uzsm35lu61.png?width=640&crop=smart&auto=webp&s=b6f56bc8d33697686b1c3226244afbd1c1839dc6";"291";"0.02666666666666667"
"superstonk";"2021-04-23";"$GME Daily Discussion - April 22, 2021";"gme daily discussion  april 22 2021";"0.4995";"0.4995";"0.0";"opinionated";"";"0";"gme daily";"";"";"";"35";"0.15789473684210525"
"superstonk";"2021-04-24";"$GME Daily Discussion - April 23, 2021";"gme daily discussion  april 23 2021";"0.4995";"0.4995";"0.0";"opinionated";"";"0";"gme daily";"";"";"";"35";"0.15789473684210525"
"superstonk";"2021-04-27";"$GME Daily Discussion - April 26, 2021";"gme daily discussion  april 26 2021";"0.4995";"0.4995";"0.0";"opinionated";"";"0";"gme daily";"";"";"";"35";"0.15789473684210525"
"superstonk";"2021-04-27";"I called out Bloomberg and they corrected the article calling DFV a day trader";"i called out bloomberg and they corrected the article calling dfv a day trader";"0.0";"0.0";"0.0";"factual";"";"0";"";"";"";"https://web.archive.org/web/20210427013721im_/https://preview.redd.it/qcyyw3rh5lv61.jpg?width=640&crop=smart&auto=webp&s=6e044953e0cb2954f98f725fcaae9054a90b4819";"78";"0.0641025641025641"
"superstonk";"2021-04-28";"I made a post on the thread before discussing my positive experience with Fidelity. I just spoke with a rep from there and he said 8-10 million robinhood users have switched to Fidelity 🤯 we definitely own the float";"i made a post on the thread before discussing my positive experience with fidelity i just spoke with a rep from there and he said 810 million robinhood users have switched to fidelity  we definitely own the float";"0.5859";"0.5859";"0.7727272727272727";"opinionated";"🤯";"1";"";"robinhood";"";"";"212";"0.018604651162790697"
"superstonk";"2021-04-29";"GME 2020 Annual Report- JUST POSTED!!";"gme 2020 annual report just posted";"0.5882";"0.64702";"0.0";"opinionated";"";"0";"";"";"";"";"34";"0.40540540540540543"
"superstonk";"2021-04-29";"$GME Daily Discussion - April 28, 2021";"gme daily discussion  april 28 2021";"0.4995";"0.4995";"0.0";"opinionated";"";"0";"gme daily";"";"";"";"35";"0.15789473684210525"
"superstonk";"2021-04-30";"$GME Daily Discussion - April 29, 2021";"gme daily discussion  april 29 2021";"0.4995";"0.4995";"0.0";"opinionated";"";"0";"gme daily";"";"";"";"35";"0.15789473684210525"
"superstonk";"2021-05-01";"I made millions on Runescape with a free account aged 13. Citadel can’t outlast me.";"i made millions on runescape with a free account aged 13 citadel cant outlast me";"-0.1779";"-0.1779";"0.6000000000000001";"opinionated";"";"0";"";"hedge funds, apes/community";"";"";"80";"0.03614457831325301"
"superstonk";"2021-05-01";"$GME Daily Discussion - April 30, 2021";"gme daily discussion  april 30 2021";"0.4995";"0.4995";"0.0";"opinionated";"";"0";"gme daily";"";"";"";"35";"0.15789473684210525"
"superstonk";"2021-05-01";"What Diamond Hands really look like:";"what diamond hands really look like";"0.6344";"0.6344";"0.2";"opinionated";"";"0";"";"diamond hands";"";"https://web.archive.org/web/20210501033421im_/https://preview.redd.it/lpgnxwplucw61.png?width=640&crop=smart&auto=webp&s=80756b7d4e00ef9331c7256ea2763abb86ce54b6";"35";"0.08333333333333333"
"superstonk";"2021-05-02";"Once citadel realise this is what they’re up against it’s gonna be all over";"once citadel realise this is what theyre up against its gonna be all over";"-0.6124";"-0.6124";"0.0";"factual";"";"0";"";"hedge funds";"";"https://web.archive.org/web/20210502161156im_/https://external-preview.redd.it/8vPyYeQurKiLuIvKKFYjTQh-NE_qS8o5XRicopkGKNE.jpg?width=640&crop=smart&auto=webp&s=dbd83a63675d03116eac92d2b26209dbb6bc8063";"73";"0.013333333333333334"
"superstonk";"2021-05-02";"The Importance of Education: I have learned more in 5 months trading GME, than the previous 30 years ""investing"". I have learned about the corruption, the lies, the deception of using media to control us ""dumb"" money. Literally, the worst thing they could have done was shut down trading in Jan!!";"the importance of education i have learned more in 5 months trading gme than the previous 30 years investing i have learned about the corruption the lies the deception of using media to control us dumb money literally the worst thing they could have done was shut down trading in jan";"-0.8381";"-0.8381";"0.49111111111111105";"opinionated";"";"0";"";"";"";"";"283";"0.033783783783783786"
"superstonk";"2021-05-03";"$GME Daily Discussion - May 02, 2021";"gme daily discussion  may 02 2021";"0.4995";"0.4995";"0.0";"opinionated";"";"0";"gme daily";"";"";"";"33";"0.16666666666666666"
"superstonk";"2021-05-04";"$GME Daily Discussion - May 03, 2021";"gme daily discussion  may 03 2021";"0.4995";"0.4995";"0.0";"opinionated";"";"0";"gme daily";"";"";"";"33";"0.16666666666666666"
"superstonk";"2021-05-04";"GET THE FU** OUT OF ROBINHOOD NOW! The fact shills are saying switch to Robinhood means they cannot be trusted.";"get the fu out of robinhood now the fact shills are saying switch to robinhood means they cannot be trusted";"-0.8215";"-0.8215";"0.0";"opinionated";"";"0";"";"robinhood";"";"https://web.archive.org/web/20210504073345im_/https://preview.redd.it/zir234s3g0x61.jpg?width=640&crop=smart&auto=webp&s=2f4874b429f4a5413251e26d80b2bf80b3a25231";"107";"0.24324324324324326"
"superstonk";"2021-05-04";"After investing $50k plus into GME after only Reading TLDR’s. 🚀🚀🚀";"after investing 50k plus into gme after only reading tldrs";"0.9454";"0.9454";"1.0";"opinionated";"🚀🚀🚀";"3";"";"drs";"";"";"58";"0.13846153846153847"
"superstonk";"2021-05-04";"No financial institution should be too big to fail and get special treatment when they get greedy. The hedge funds need to be held accountable. This sage needs to come to an end so we get change and a more fair and safe market.";"no financial institution should be too big to fail and get special treatment when they get greedy the hedge funds need to be held accountable this sage needs to come to an end so we get change and a more fair and safe market";"0.1171";"0.1171";"0.41020408163265304";"factual";"";"0";"";"hedge funds";"";"https://web.archive.org/web/20210504073345im_/https://external-preview.redd.it/uz-N9Y6-oEU3TUTGT-N0gkcLCJ70XqJ3QQVFgxShrdA.jpg?width=640&crop=smart&auto=webp&s=0f05f2fa0764aa5948f19639e5e9812a8d8a407b";"224";"0.013215859030837005"
"superstonk";"2021-05-05";"Something Big is happening! I think Citadel is throwing everything they got at us!";"something big is happening i think citadel is throwing everything they got at us";"-0.6792";"-0.6792";"0.1";"opinionated";"";"0";"";"hedge funds";"";"";"80";"0.04878048780487805"
"superstonk";"2021-05-05";"$GME Daily Discussion - May 04, 2021";"gme daily discussion  may 04 2021";"0.4995";"0.4995";"0.0";"opinionated";"";"0";"gme daily";"";"";"";"33";"0.16666666666666666"
"superstonk";"2021-05-05";"ONLY GME!!! 💎🤲🚀🚀🚀";"only gme";"0.9525";"1.0";"1.0";"opinionated";"💎🤲🚀🚀🚀";"5";"";"diamond hands";"";"https://web.archive.org/web/20210505005810im_/https://preview.redd.it/33ll7ct086x61.jpg?width=640&crop=smart&auto=webp&s=8b66eab89aa82204e8b0714e830cb5f51adf35a3";"8";"0.4117647058823529"
"superstonk";"2021-05-06";"$GME Daily Discussion - May 05, 2021";"gme daily discussion  may 05 2021";"0.4995";"0.4995";"0.0";"opinionated";"";"0";"gme daily";"";"";"";"33";"0.16666666666666666"
"superstonk";"2021-05-06";"NEW RECORD: GME HAD THE LOWEST VOLUME YTD BY A MILLION SHARES! (2,750,657) We are all holding the line! Volume has been suppressed to the point that any added buy pressure might launch the 🚀🚀🚀";"new record gme had the lowest volume ytd by a million shares 2750657 we are all holding the line volume has been suppressed to the point that any added buy pressure might launch the";"0.9351";"0.9351";"0.45454545454545453";"opinionated";"🚀🚀🚀";"3";"";"dd/analysis, diamond hands";"";"https://web.archive.org/web/20210506001003im_/https://preview.redd.it/vf8nqwdoycx61.jpg?width=640&crop=smart&auto=webp&s=806a5ed60b0964981d87e1538171cff2d8484f5a";"181";"0.265625"
"superstonk";"2021-05-06";"THE MOTHER OF ALL WEDGES: AN ENDGAME DD. Technical and Fundamental Analysis with Warden. Where we are now, where we are headed. When might the MOASS begin?";"the mother of all wedges an endgame dd technical and fundamental analysis with warden where we are now where we are headed when might the moass begin";"0.0";"0.0";"0.1";"factual";"";"0";"";"hedge funds, dd/analysis";"";"";"149";"0.2709677419354839"
"superstonk";"2021-05-07";"$GME Daily Discussion - May 06, 2021";"gme daily discussion  may 06 2021";"0.4995";"0.4995";"0.0";"opinionated";"";"0";"gme daily";"";"";"";"33";"0.16666666666666666"
"superstonk";"2021-05-09";"$GME Daily Discussion - May 08, 2021";"gme daily discussion  may 08 2021";"0.4995";"0.4995";"0.0";"opinionated";"";"0";"gme daily";"";"";"";"33";"0.16666666666666666"
"superstonk";"2021-05-09";"CITADEL HEADQUATER.";"citadel headquater";"-0.6124";"-0.6736400000000001";"0.0";"factual";"";"0";"";"hedge funds";"";"https://web.archive.org/web/20210509004736im_/https://preview.redd.it/3etfx5gmqxx61.jpg?width=640&crop=smart&auto=webp&s=33f5730ef0f75fbfd4afc708b0fb92d83a4ca90d";"18";"0.8947368421052632"
"superstonk";"2021-05-10";"Here is a Complete Compilation Documenting the Existence of Every Market Manipulation Tactic Used by Hedge Funds in this GameStop Saga";"here is a complete compilation documenting the existence of every market manipulation tactic used by hedge funds in this gamestop saga";"-0.296";"-0.296";"0.4";"factual";"";"0";"";"hedge funds";"";"";"134";"0.11194029850746269"
"superstonk";"2021-05-10";"$GME Daily Discussion - May 09, 2021";"gme daily discussion  may 09 2021";"0.4995";"0.4995";"0.0";"opinionated";"";"0";"gme daily";"";"";"";"33";"0.16666666666666666"
"superstonk";"2021-05-11";"$GME Daily Discussion - May 10, 2021";"gme daily discussion  may 10 2021";"0.4995";"0.4995";"0.0";"opinionated";"";"0";"gme daily";"";"";"";"33";"0.16666666666666666"
"superstonk";"2021-05-12";"$GME Daily Discussion - May 11, 2021";"gme daily discussion  may 11 2021";"0.4995";"0.4995";"0.0";"opinionated";"";"0";"gme daily";"";"";"";"33";"0.16666666666666666"
"superstonk";"2021-05-13";"$GME Daily Discussion - May 12, 2021";"gme daily discussion  may 12 2021";"0.4995";"0.4995";"0.0";"opinionated";"";"0";"gme daily";"";"";"";"33";"0.16666666666666666"
"superstonk";"2021-05-14";"JUST HOLD. TODAY WAS NOTHING. GME WAS AT 180 3 WEEKS AGO. If you WORKED your WHOLE LIFE will you be able to accumulate even a million? No? MAYBE?? So just hold on to your shares. Even if it takes MONTHS. 10M IS THE FLOOR 🚀 🚀";"just hold today was nothing gme was at 180 3 weeks ago if you worked your whole life will you be able to accumulate even a million no maybe so just hold on to your shares even if it takes months 10m is the floor";"0.9263";"0.9263";"0.5125";"opinionated";"🚀🚀";"2";"";"diamond hands";"";"";"211";"0.35714285714285715"
"superstonk";"2021-05-14";"$GME Daily Discussion - May 13, 2021";"gme daily discussion  may 13 2021";"0.4995";"0.4995";"0.0";"opinionated";"";"0";"gme daily";"";"";"";"33";"0.16666666666666666"
"superstonk";"2021-05-15";"Marketwatch: ""And Stonkinator3000 also encapsulated the response many retail investors have to that strategy, posting “Good luck with that fuckers, you’re going to have to pry my GME shares from my cold, dead hands.”";"marketwatch and stonkinator3000 also encapsulated the response many retail investors have to that strategy posting good luck with that fuckers youre going to have to pry my gme shares from my cold dead hands";"-0.1943";"-0.1943";"0.625";"opinionated";"";"0";"stonkinator3000";"";"";"https://web.archive.org/web/20210515005919im_/https://preview.redd.it/awgvr16p85z61.png?width=640&crop=smart&auto=webp&s=df0f8d2afa111068b03032473bf7c7f068f3d5e5";"207";"0.032407407407407406"
"superstonk";"2021-05-15";"$GME Daily Discussion - May 14, 2021";"gme daily discussion  may 14 2021";"0.4995";"0.4995";"0.0";"opinionated";"";"0";"gme daily";"";"";"";"33";"0.16666666666666666"
"superstonk";"2021-05-15";"New hf strategy is becoming so clear. Let the movie stock run, hold gme down, hope gme holders abandon ship partially or fully for the stock that’s ‘squeezing’ now. Good luck with that fuckers, you’re going to have to pry my gme shares from my cold, dead hands.";"new hf strategy is becoming so clear let the movie stock run hold gme down hope gme holders abandon ship partially or fully for the stock thats squeezing now good luck with that fuckers youre going to have to pry my gme shares from my cold dead hands";"0.8679";"0.8679";"0.5345959595959596";"opinionated";"";"0";"";"hedge funds, diamond hands, regulation";"";"";"250";"0.011494252873563218"
"superstonk";"2021-05-16";"$GME Daily Discussion - May 15, 2021";"gme daily discussion  may 15 2021";"0.4995";"0.4995";"0.0";"opinionated";"";"0";"gme daily";"";"";"";"33";"0.16666666666666666"
"superstonk";"2021-05-17";"Who else is and has been quietly buying and hodling to those precious GME shares, regardless of any DDs or findings or any attempts of FUD or shilling that come out? 🙋‍♂️";"who else is and has been quietly buying and hodling to those precious gme shares regardless of any dds or findings or any attempts of fud or shilling that come out";"0.743";"0.743";"0.6666666666666666";"opinionated";"🙋♂";"2";"";"dd/analysis, diamond hands";"";"";"163";"0.052941176470588235"
"superstonk";"2021-05-17";"$GME Daily Discussion - May 16, 2021";"gme daily discussion  may 16 2021";"0.4995";"0.4995";"0.0";"opinionated";"";"0";"gme daily";"";"";"";"33";"0.16666666666666666"
"superstonk";"2021-05-19";"$GME Daily Discussion - May 18, 2021";"gme daily discussion  may 18 2021";"0.4995";"0.4995";"0.0";"opinionated";"";"0";"gme daily";"";"";"";"33";"0.16666666666666666"
"superstonk";"2021-05-19";"When gme hits $1m, Apes: idk... still seems like a fake squeeze to me";"when gme hits 1m apes idk still seems like a fake squeeze to me";"0.6705";"0.6705";"1.0";"opinionated";"";"0";"";"apes/community";"";"https://web.archive.org/web/20210519001203im_/https://preview.redd.it/pfbscgclxwz61.jpg?width=640&crop=smart&auto=webp&s=08568b518da18a1f833cca066d5e5fdd0fa1ec66";"63";"0.028985507246376812"
"superstonk";"2021-05-20";"$GME Daily Discussion - May 19, 2021";"gme daily discussion  may 19 2021";"0.4995";"0.4995";"0.0";"opinionated";"";"0";"gme daily";"";"";"";"33";"0.16666666666666666"
"superstonk";"2021-05-21";"BREAKING: GME is officially an unshortable stock in Sweden";"breaking gme is officially an unshortable stock in sweden";"0.4995";"0.4995";"0.0";"opinionated";"";"0";"";"";"";"https://web.archive.org/web/20210521172420im_/https://preview.redd.it/5p37zcl3xg071.jpg?width=640&crop=smart&auto=webp&s=ba695a85cf39e30db079ef39f3d1a932121a84eb";"57";"0.20689655172413793"
"superstonk";"2021-05-22";"🚀Get Ready For The Biggest Short Squeeze Of Your Lifetime🚀";"get ready for the biggest short squeeze of your lifetime";"0.8885";"0.8885";"0.4";"opinionated";"🚀🚀";"2";"";"short squeeze";"";"";"56";"0.1724137931034483"
"superstonk";"2021-05-22";"GameStop (GME) is the worst kept secret on Wall Street with blatant market manipulation in plain sight. I've been asking around to my banking/industry friends. EVERYONE knows this is a fucking mess. The DTCC, SEC, FINRA, HF's, Institutions, Banks, and slowly the public is learning the truth!!!!";"gamestop gme is the worst kept secret on wall street with blatant market manipulation in plain sight ive been asking around to my bankingindustry friends everyone knows this is a fucking mess the dtcc sec finra hfs institutions banks and slowly the public is learning the truth";"-0.5526";"-0.5526";"0.4748511904761905";"opinionated";"";"0";"sec";"hedge funds, regulation";"";"";"277";"0.11186440677966102"
"superstonk";"2021-05-22";"$GME Daily Discussion - May 21, 2021";"gme daily discussion  may 21 2021";"0.4995";"0.4995";"0.0";"opinionated";"";"0";"gme daily";"";"";"";"33";"0.16666666666666666"
"superstonk";"2021-05-22";"/u/dlauer's most recent post correcting blatant misinformation isn't getting any traction. He even urges people who have had ""high cost basis when transferring out of Robinhood to file a whistleblower complaint""";"udlauers most recent post correcting blatant misinformation isnt getting any traction he even urges people who have had high cost basis when transferring out of robinhood to file a whistleblower complaint";"-0.7184";"-0.7184";"0.398";"factual";"";"0";"u/dlauer";"robinhood";"";"";"204";"0.009478672985781991"
"superstonk";"2021-05-23";"'Twas the Night Before MOASSMAS....";"twas the night before moassmas";"0.0";"0.0";"0.0";"factual";"";"0";"";"";"";"https://web.archive.org/web/20210523045736im_/https://preview.redd.it/c87xbufees071.jpg?width=640&crop=smart&auto=webp&s=d35007d99e88af3bfa1aee5b8010b697fdb0cbc0";"30";"0.3142857142857143"
"superstonk";"2021-05-23";"$GME Daily Discussion - May 22, 2021";"gme daily discussion  may 22 2021";"0.4995";"0.4995";"0.0";"opinionated";"";"0";"gme daily";"";"";"";"33";"0.16666666666666666"
"superstonk";"2021-05-24";"DRAFT: I have done my best to summarize the GME MOASS Thesis in a way that hopefully appeals to individuals outside of this community. I was thinking about reposting before opening bell tomorrow with updates depending on feedback I get tonight. Intention is for it to be a starting point prior to DD";"draft i have done my best to summarize the gme moass thesis in a way that hopefully appeals to individuals outside of this community i was thinking about reposting before opening bell tomorrow with updates depending on feedback i get tonight intention is for it to be a starting point prior to dd";"0.8788";"0.8788";"0.11249999999999999";"opinionated";"";"0";"";"dd/analysis, apes/community";"";"";"296";"0.06688963210702341"
"superstonk";"2021-05-25";"$GME Daily Discussion - May 24, 2021";"gme daily discussion  may 24 2021";"0.4995";"0.4995";"0.0";"opinionated";"";"0";"gme daily";"";"";"";"33";"0.16666666666666666"
"superstonk";"2021-05-26";"$GME Daily Discussion - May 25, 2021";"gme daily discussion  may 25 2021";"0.4995";"0.4995";"0.0";"opinionated";"";"0";"gme daily";"";"";"";"33";"0.16666666666666666"
"superstonk";"2021-05-26";"Update: Citadel has no clothes. The Walls are closing in. Mother of All Speedo Squeezes coming. LFFFFGGGGGG";"update citadel has no clothes the walls are closing in mother of all speedo squeezes coming lffffgggggg";"-0.7351";"-0.7351";"0.0";"factual";"";"0";"speedo";"hedge funds";"";"https://web.archive.org/web/20210526004812im_/https://preview.redd.it/adrmhsa37b171.jpg?width=640&crop=smart&auto=webp&s=fbbc60b1440e0f4a93c27a958336a00556cf4ebc";"103";"0.17757009345794392"
"superstonk";"2021-05-27";"$GME Daily Discussion - May 26, 2021";"gme daily discussion  may 26 2021";"0.4995";"0.4995";"0.0";"opinionated";"";"0";"gme daily";"";"";"";"33";"0.16666666666666666"
"superstonk";"2021-05-28";"$GME Daily Discussion - May 27, 2021";"gme daily discussion  may 27 2021";"0.4995";"0.4995";"0.0";"opinionated";"";"0";"gme daily";"";"";"";"33";"0.16666666666666666"
"superstonk";"2021-05-28";"Time to flood the sub. Jim Cramer is no friend of GME but he’s trying to worm his way into our psyche now—so he can convince people to sell at 4-500 when GME starts to go up. Spread the word. No floor. JIM CREAMER IS NOT ON OUR SIDE! He’s not welcome here.";"time to flood the sub jim cramer is no friend of gme but hes trying to worm his way into our psyche nowso he can convince people to sell at 4500 when gme starts to go up spread the word no floor jim creamer is not on our side hes not welcome here";"0.3451";"0.3451";"0.9";"opinionated";"";"0";"jim creamer, jim cramer";"";"";"https://web.archive.org/web/20210528014847im_/https://preview.redd.it/0ejqihogpp171.jpg?width=640&crop=smart&auto=webp&s=4c0fca49500c5877eaf770cec4e74c8e9f11fe2d";"246";"0.140625"
"superstonk";"2021-05-28";"No one's selling GME to buy into AMC.";"no ones selling gme to buy into amc";"0.505";"0.505";"0.0";"opinionated";"";"0";"";"";"";"";"35";"0.1891891891891892"
"superstonk";"2021-05-30";"Another GME DD dump from Hank";"another gme dd dump from hank";"0.1613";"0.1613";"0.0";"factual";"";"0";"hank";"dd/analysis";"";"";"29";"0.2413793103448276"
"superstonk";"2021-05-30";"$GME Daily Discussion - May 29, 2021";"gme daily discussion  may 29 2021";"0.4995";"0.4995";"0.0";"opinionated";"";"0";"gme daily";"";"";"";"33";"0.16666666666666666"
"superstonk";"2021-05-31";"$GME Daily Discussion - May 30, 2021";"gme daily discussion  may 30 2021";"0.4995";"0.4995";"0.0";"opinionated";"";"0";"gme daily";"";"";"";"33";"0.16666666666666666"
"superstonk";"2021-06-01";"Etoro got their 1.5% of all GME holder straight from the Gamestop There are over 89 Million Diamond handed Apes out there.";"etoro got their 15 of all gme holder straight from the gamestop there are over 89 million diamond handed apes out there";"0.7603";"0.7603";"0.4";"opinionated";"";"0";"";"apes/community, diamond hands";"";"";"119";"0.07377049180327869"
"superstonk";"2021-06-01";"$GME Daily Discussion - May 31, 2021";"gme daily discussion  may 31 2021";"0.4995";"0.4995";"0.0";"opinionated";"";"0";"gme daily";"";"";"";"33";"0.16666666666666666"
