"subreddit";"date";"title";"cleaned";"sentiment_vader_comp";"sentiment_final";"subjectivity";"subjectivity_label";"emojis";"emoji_count";"entities";"topic_tags";"upvotes";"image_urls";"title_length";"capslock_ratio"
"superstonk";"2022-11-24";"Ihor Dusaniwsky (S3 Partners) says that there is not enough stock borrow available to execute large short trades on $GME";"ihor dusaniwsky s3 partners says that there is not enough stock borrow available to execute large short trades on gme";"0.4995";"0.4995";"0.40714285714285714";"opinionated";"";"0";"";"";"";"https://web.archive.org/web/20221124004257im_/https://preview.redd.it/k4y8swd13t1a1.jpg?width=640&crop=smart&auto=webp&s=527f4dae38597ecd6be74f2d6fe0cc1881371235";"117";"0.058333333333333334"
"superstonk";"2022-11-25";"WEN DFV?";"wen dfv";"0.0";"0.0";"0.0";"factual";"";"0";"wen dfv";"";"";"https://web.archive.org/web/20221125021203im_/https://preview.redd.it/quo8ppc70x1a1.jpg?width=640&crop=smart&auto=webp&s=736fa14b54b451346fa47584f27be9a5d9bbd021";"7";"0.75"
"superstonk";"2022-11-27";"A Look Back: The Cellar Boxing Playbook DD discovered by u/thabat. GME managed to escape the cellar.";"a look back the cellar boxing playbook dd discovered by uthabat gme managed to escape the cellar";"0.6037";"0.6037";"0.0";"opinionated";"";"0";"u/thabat";"dd/analysis, apes/community";"";"";"96";"0.12"
"superstonk";"2022-11-28";"Rule 2a: Posts and comments must be related to GME - Help Revise Superstonk's Rules";"rule 2a posts and comments must be related to gme  help revise superstonks rules";"0.7125";"0.7125";"0.4";"opinionated";"";"0";"";"";"";"";"80";"0.10843373493975904"
"superstonk";"2022-12-01";"After seeing GME short volume was almost 72% yesterday, I decided to look at some other companies for comparison. One of these is not like the others…";"after seeing gme short volume was almost 72 yesterday i decided to look at some other companies for comparison one of these is not like the others";"0.2785";"0.2785";"0.3375";"factual";"";"0";"";"";"";"";"146";"0.04"
"superstonk";"2022-12-02";"GME 100% Utilization - Day 90 via Ortex";"gme 100 utilization  day 90 via ortex";"0.4995";"0.4995";"0.0";"opinionated";"";"0";"";"";"";"";"37";"0.15384615384615385"
"superstonk";"2022-12-06";"Citadel Securities Accused of Illicit Trading";"citadel securities accused of illicit trading";"-0.6124";"-0.6124";"0.0";"factual";"";"0";"";"hedge funds, regulation";"";"";"45";"0.1111111111111111"
"superstonk";"2022-12-06";"Todays GME short volume go Cray cray! 75.6% LFG 🚀🚀🚀🚀";"todays gme short volume go cray cray 756 lfg";"0.9662";"0.9662";"0.3";"opinionated";"🚀🚀🚀🚀";"4";"";"";"";"https://web.archive.org/web/20221206054050im_/https://preview.redd.it/tajzd60xf84a1.jpg?width=640&crop=smart&auto=webp&s=912007c19bbea19def773094acefc67c7fe43879";"44";"0.15384615384615385"
"superstonk";"2022-12-12";"Another 477 stonks, Booked and ready! Some amazing artwork with me in my top hat, enjoying a Cuban cigar, when MOASS kicks in tomorrow! This is the way!";"another 477 stonks booked and ready some amazing artwork with me in my top hat enjoying a cuban cigar when moass kicks in tomorrow this is the way";"0.9077";"0.9077";"0.625";"opinionated";"";"0";"";"regulation";"";"https://web.archive.org/web/20221212131720im_/https://preview.redd.it/1906qkt10h5a1.png?width=640&crop=smart&auto=webp&s=319dab1e45ac131224cda0684a2054d0bad0d198";"146";"0.06578947368421052"
"superstonk";"2022-12-12";"Hedge fund billionaire Ken Griffin spent $54 million to stop Illinois from taxing the super-rich. It worked. His savings over 10 years from beating the measure: $510 million. It's not much of a democracy when you can buy it";"hedge fund billionaire ken griffin spent 54 million to stop illinois from taxing the superrich it worked his savings over 10 years from beating the measure 510 million its not much of a democracy when you can buy it";"-0.6369";"-0.6369";"0.15000000000000002";"factual";"";"0";"illinois";"hedge funds";"";"https://web.archive.org/web/20221212131720im_/https://preview.redd.it/g7qborld0e5a1.jpg?width=640&crop=smart&auto=webp&s=5dc4e7ce46c0ef72a8c2e4d94dbbcf2fc98c20d1";"215";"0.03139013452914798"
"superstonk";"2022-12-13";"Senator Merkley Introduces Legislation to Ban Hedge Fund Ownership of Residential Housing | U.S. Senator Jeff Merkley of Oregon";"senator merkley introduces legislation to ban hedge fund ownership of residential housing  us senator jeff merkley of oregon";"-0.5574";"-0.5574";"0.0";"factual";"";"0";"merkley, us, jeff merkley, oregon";"hedge funds, regulation";"";"";"124";"0.12598425196850394"
"superstonk";"2022-12-14";"76.4% short volume today on GME. Over the past 30 days, the average Short Volume has been 69.97%. - NICE 🚀🚀🚀🚀🚀🚀🚀🚀🚀🚀🚀🚀🚀🚀🚀🚀🚀🚀";"764 short volume today on gme over the past 30 days the average short volume has been 6997  nice";"0.9978";"0.9978";"0.45";"opinionated";"🚀🚀🚀🚀🚀🚀🚀🚀🚀🚀🚀🚀🚀🚀🚀🚀🚀🚀";"18";"";"";"";"https://web.archive.org/web/20221214071459im_/https://preview.redd.it/qck3bu49kt5a1.jpg?width=640&crop=smart&auto=webp&v=enabled&s=a38fce78e2a87a5ad3d6c0fc04bd96ed2e4d31b5";"96";"0.08130081300813008"
"superstonk";"2022-12-14";"GME mirrored tokens shown to be delisted this whole time on Terra Luna blockchain.";"gme mirrored tokens shown to be delisted this whole time on terra luna blockchain";"0.4995";"0.4995";"0.4";"opinionated";"";"0";"gme";"";"";"";"81";"0.06097560975609756"
"superstonk";"2022-12-14";"The Securities and Exchange Commission is set to propose the biggest shake-up of the U.S. stock market in more than a decade. In the crosshairs: Ken Griffin’s Citadel Securities.";"the securities and exchange commission is set to propose the biggest shakeup of the us stock market in more than a decade in the crosshairs ken griffins citadel securities";"-0.1531";"-0.1531";"0.5";"opinionated";"";"0";"the securities and exchange commission, us";"hedge funds, regulation";"";"https://web.archive.org/web/20221214071459im_/https://preview.redd.it/ew5kdtlpgs5a1.jpg?width=640&crop=smart&auto=webp&v=enabled&s=6f96af55773133c7c71d861f1dcdf4870fa33f83";"171";"0.06179775280898876"
"superstonk";"2022-12-17";"D Lauer telling Gary to check out DRSGME 🟣📄🟣🚀 (repost with sauce)";"d lauer telling gary to check out drsgme  repost with sauce";"0.6124";"0.6124";"0.0";"opinionated";"🟣📄🟣🚀";"4";"";"drs";"";"";"59";"0.13846153846153847"
"superstonk";"2022-12-17";"$GME Daily Directory | New? Start Here! | DRS Guide | Wallet Help/Activation Megathread | Help Revise Superstonk's Rule! - Find out more inside";"gme daily directory  new start here  drs guide  wallet helpactivation megathread  help revise superstonks rule  find out more inside";"0.7592";"0.7592";"0.3181818181818182";"opinionated";"";"0";"gme daily";"drs";"";"";"132";"0.14685314685314685"
"superstonk";"2022-12-19";"Carl Icahn sold over $32 Million worth of Herc Holdings Inc (HRI) on 12/12-12/14 and then the following 2 days we saw massive trades in AH for GME.... Just posting this in case this entire Icahn theory proves right 🤷🏼‍♂️";"carl icahn sold over 32 million worth of herc holdings inc hri on 12121214 and then the following 2 days we saw massive trades in ah for gme just posting this in case this entire icahn theory proves right";"0.6289";"0.6289";"0.39345238095238094";"opinionated";"🤷🏼♂";"3";"carl, herc holdings inc hri";"dd/analysis, diamond hands";"";"https://web.archive.org/web/20221219082052im_/https://preview.redd.it/b6od7nqver6a1.png?width=640&crop=smart&auto=webp&s=1b72b50f694d384e7ff0dcc39b90b8dbcb62572c";"204";"0.07272727272727272"
"superstonk";"2022-12-23";"GME borrow fee was 2000% today?! :o";"gme borrow fee was 2000 today o";"0.481";"0.481";"0.0";"opinionated";"";"0";"gme";"";"";"https://web.archive.org/web/20221223040842im_/https://preview.redd.it/zn2j67idqi7a1.png?width=640&crop=smart&auto=webp&s=bcd05786b579355f7491954e312beefc0850863b";"31";"0.08571428571428572"
"superstonk";"2022-12-29";"So you’re telling me GameStop is going for $1.3M per share in the dark pools, but Citadel’s & Virtu’s synthetic printers will sell me a share for ~$19? And I can directly register it under my name then sell it back to a short who NEEDS it for whatever price I want? This shit too easy 😭🚀";"so youre telling me gamestop is going for 13m per share in the dark pools but citadels  virtus synthetic printers will sell me a share for 19 and i can directly register it under my name then sell it back to a short who needs it for whatever price i want this shit too easy";"0.5477";"0.5477";"0.45555555555555555";"opinionated";"😭🚀";"2";"";"hedge funds";"";"https://web.archive.org/web/20221229035214im_/https://preview.redd.it/3pk2xea9mo8a1.jpg?width=640&crop=smart&auto=webp&s=175c8b55735c97eeb30e77a84d3218a9b3b3b1f6";"273";"0.05226480836236934"
"superstonk";"2022-12-30";"Investors flee and withdraw 7 Billion from Ken Griffin's Citadel";"investors flee and withdraw 7 billion from ken griffins citadel";"-0.6124";"-0.6124";"0.0";"factual";"";"0";"ken griffins";"hedge funds";"";"";"63";"0.078125"
"superstonk";"2022-12-30";"Just submitted my Data on the GME Token in a meeting with the FBI, including this connected transaction of FTT Tokens. THEY ARE NOW LISTENING!";"just submitted my data on the gme token in a meeting with the fbi including this connected transaction of ftt tokens they are now listening";"0.5461";"0.5461";"0.0";"opinionated";"";"0";"fbi";"";"";"";"139";"0.22535211267605634"
"superstonk";"2023-01-05";"U.S. DOJ in process of seizing Robinhood shares tied to Alameda Research loans";"us doj in process of seizing robinhood shares tied to alameda research loans";"-0.0772";"-0.0772";"0.0";"factual";"";"0";"";"dd/analysis, robinhood";"";"";"76";"0.10256410256410256"
"superstonk";"2023-01-05";"The biggest bullflag in the history of the stock exchange just happens to break downwards at the end of the wedge. With liquidity being dry as it is, quite literally only points to infinite liquidity which can only be created by naked short selling and abuse of powers as a market maker / hedge fund.";"the biggest bullflag in the history of the stock exchange just happens to break downwards at the end of the wedge with liquidity being dry as it is quite literally only points to infinite liquidity which can only be created by naked short selling and abuse of powers as a market maker  hedge fund";"-0.4939";"-0.4939";"0.6599999999999999";"opinionated";"";"0";"";"hedge funds";"";"https://web.archive.org/web/20230105050534im_/https://preview.redd.it/f4sd15nfj1aa1.png?width=640&crop=smart&auto=webp&s=ca602e12de70ba3a8df369c7f6f1512253947813";"296";"0.006666666666666667"
"superstonk";"2023-01-08";"Possible proof Citadel absorbed Melvin on jan 28 to prevent their bust. (Posting this for an ape who doesn’t have enough karma, more about this topic in the comments)";"possible proof citadel absorbed melvin on jan 28 to prevent their bust posting this for an ape who doesnt have enough karma more about this topic in the comments";"-0.5267";"-0.5267";"0.725";"opinionated";"";"0";"";"hedge funds, apes/community";"";"https://web.archive.org/web/20230108033526im_/https://preview.redd.it/y166pl63rqaa1.jpg?width=640&crop=smart&auto=webp&s=cfdc225784dd79c4fa32c5486cd15b529e4e3d1e";"161";"0.024096385542168676"
"superstonk";"2023-01-09";"GME token whale appears to be 100x leverage futures betting platform";"gme token whale appears to be 100x leverage futures betting platform";"0.4995";"0.4995";"0.0";"opinionated";"";"0";"100x";"";"";"";"68";"0.04411764705882353"
"superstonk";"2023-01-09";"DOJ Officially Seizes Over $456,000,000 Worth of Robinhood Shares Tied to FTX Founder Sam Bankman-Fried";"doj officially seizes over 456000000 worth of robinhood shares tied to ftx founder sam bankmanfried";"0.1531";"0.1531";"0.1";"factual";"";"0";"sam";"regulation, robinhood";"";"";"99";"0.1650485436893204"
"superstonk";"2023-01-09";"Citadel mentioned in Illegal Short attack on TSLA and others";"citadel mentioned in illegal short attack on tsla and others";"-0.8934";"-0.8934";"0.4";"factual";"";"0";"";"hedge funds";"";"";"60";"0.11666666666666667"
"superstonk";"2023-01-10";"Remember this exact video when you hear stories about how well Citadel are allegedly doing in the news. ($65B sold, not purchased being the elephant in the room) Something hilariously doesn't add up Kenny boy, a stellar year for Citadel in a crippling year of markets while NOT being net short? 👀👀";"remember this exact video when you hear stories about how well citadel are allegedly doing in the news 65b sold not purchased being the elephant in the room something hilariously doesnt add up kenny boy a stellar year for citadel in a crippling year of markets while not being net short";"-0.7845";"-0.7845";"0.3166666666666667";"factual";"👀👀";"2";"";"hedge funds, dd/analysis";"";"";"286";"0.030303030303030304"
"superstonk";"2023-01-13";"Dr. Susanne Trimbath (Queen Kong) on Twitter...she said MOASS!!!";"dr susanne trimbath queen kong on twittershe said moass";"0.0";"0.0";"0.0";"opinionated";"";"0";"dr susanne trimbath, twittershe";"";"";"https://web.archive.org/web/20230113140037im_/https://external-preview.redd.it/uCKVjXpuRtZbA0bNATE7MNEYpX2Q0sdWVw7UcHTXlTI.png?width=640&crop=smart&auto=webp&v=enabled&s=ffe072e63b397d7a388b747568dc5f2204e94842";"55";"0.171875"
"superstonk";"2023-01-15";"$GME Daily Directory | New? Start Here! | Discussion, DRS Guide & NFT Megathreads, DD Library, and User Flair Guide";"gme daily directory  new start here  discussion drs guide  nft megathreads dd library and user flair guide";"0.5461";"0.5461";"0.22727272727272727";"opinionated";"";"0";"gme daily";"drs, dd/analysis";"";"";"106";"0.2"
"superstonk";"2023-01-16";"Brett Harrison said that he wasn't under investigation, so I filed a complaint that he made false statements on tokenized GME shares.";"brett harrison said that he wasnt under investigation so i filed a complaint that he made false statements on tokenized gme shares";"0.4995";"0.4995";"0.4";"opinionated";"";"0";"brett harrison";"regulation";"";"";"130";"0.045112781954887216"
"superstonk";"2023-01-17";"Two days ago I wrote the SEC and FBI about Brett Harrison's false FTX/GME statements. Today I wrote Congress.";"two days ago i wrote the sec and fbi about brett harrisons false ftxgme statements today i wrote congress";"-0.3034";"-0.3034";"0.6";"opinionated";"";"0";"congress, brett, fbi, sec";"regulation";"";"";"105";"0.1743119266055046"
"superstonk";"2023-01-20";"Rostin Benham Chair CFTC personally involved in FTX from the very start; LedgerX Board member CFTC official Mark Wetjen emailed Benham to tell him about FTX purchase before public announcement. Oct. 22, Benham said he was ""impressed"" by FTX US application, Benham replaced Heath Tarbert of Citadel 🔥";"rostin benham chair cftc personally involved in ftx from the very start ledgerx board member cftc official mark wetjen emailed benham to tell him about ftx purchase before public announcement oct 22 benham said he was impressed by ftx us application benham replaced heath tarbert of citadel";"-0.5106";"-0.5106";"0.41666666666666663";"factual";"🔥";"1";"benham, rostin benham, cftc, us";"hedge funds";"";"https://web.archive.org/web/20230120022224im_/https://i.redd.it/xwj6b0t6u2da1.png";"290";"0.11371237458193979"
"superstonk";"2023-01-21";"Can we please stop posting AI interviews about GME. It’s all over the sub today. I really don’t care what an AI bot, likely designed to agree with you, has to say about GME. Not for the millionth time anyways. Why do people feel the need to question a bot about their investments, and post it here?";"can we please stop posting ai interviews about gme its all over the sub today i really dont care what an ai bot likely designed to agree with you has to say about gme not for the millionth time anyways why do people feel the need to question a bot about their investments and post it here";"0.9108";"0.9108";"0.6";"opinionated";"";"0";"";"";"";"https://web.archive.org/web/20230121044546im_/https://i.redd.it/i53zaqap6cda1.jpg";"288";"0.050335570469798654"
"superstonk";"2023-01-22";"On May 25th, 2022 CFTC Chair Rostin Benham and Sam Bankman-Fried hosted an official CFTC meeting inviting notable participants Citadel & Virtu among other high-profile market players. Here is the 5-hour video of the meeting. I plan to marathon-watch the entire thing & comment relevant timestamps.";"on may 25th 2022 cftc chair rostin benham and sam bankmanfried hosted an official cftc meeting inviting notable participants citadel  virtu among other highprofile market players here is the 5hour video of the meeting i plan to marathonwatch the entire thing  comment relevant timestamps";"-0.4019";"-0.4019";"0.6";"opinionated";"";"0";"rostin benham, cftc, sam";"hedge funds, regulation";"";"";"287";"0.06734006734006734"
"superstonk";"2023-01-23";"Instinet, Citadel, & Virtue accused of Spoofing Market Manipulation by Northwest Biotherapeutics Inc. In Lawsuit";"instinet citadel  virtue accused of spoofing market manipulation by northwest biotherapeutics inc in lawsuit";"-0.7579";"-0.7579";"0.0";"factual";"";"0";"northwest biotherapeutics inc, instinet citadel  virtue";"hedge funds, drs, apes/community";"";"";"108";"0.09821428571428571"
"superstonk";"2023-01-26";"🚨 Citadel, Goldman Sachs etc are attacking Europes Settlement Discipline Rule. EU Commission and EU Committee ECON want to erase mandatory buy-ins. Please sign/spread the word about petition 0775/2022 - to force market-makers/brokerages to settle and deliver shares! 🚨";"citadel goldman sachs etc are attacking europes settlement discipline rule eu commission and eu committee econ want to erase mandatory buyins please signspread the word about petition 07752022  to force marketmakersbrokerages to settle and deliver shares";"-0.4926";"-0.4926";"0.0";"opinionated";"🚨🚨";"2";"citadel goldman sachs, eu committee";"hedge funds";"";"";"254";"0.06716417910447761"
"superstonk";"2023-01-28";"Gamestop is up 14.04% on no news and I haven’t seen any media outlet report about it. So I report about it with this headline: GME is up 14.04% on no news, start asking yourself why.";"gamestop is up 1404 on no news and i havent seen any media outlet report about it so i report about it with this headline gme is up 1404 on no news start asking yourself why";"-0.0431";"-0.0431";"0.0";"factual";"";"0";"";"";"";"";"173";"0.038461538461538464"
"superstonk";"2023-01-28";"The Citadel Empire, revealed: 500+ entities linked to Ken Griffin, all from public records. I have built the edge of the puzzle, can you help me fill in the middle? PS - Ken Griffin is still a butterfly lover";"the citadel empire revealed 500 entities linked to ken griffin all from public records i have built the edge of the puzzle can you help me fill in the middle ps  ken griffin is still a butterfly lover";"0.3612";"0.3612";"0.03333333333333333";"opinionated";"";"0";"ken, ps  ken";"hedge funds, dd/analysis";"";"";"200";"0.04807692307692308"
"superstonk";"2023-02-01";"✊🏻 DIAMOND HANDS";"diamond hands";"0.4824";"0.53064";"0.0";"opinionated";"✊🏻";"2";"";"diamond hands";"";"https://web.archive.org/web/20230201095735im_/https://preview.redd.it/j5f3gzmr3ifa1.jpg?width=640&crop=smart&auto=webp&v=enabled&s=f7c03af82470bdf442b88e1164d11738abad7584";"13";"0.75"
"superstonk";"2023-02-01";"GME FTX token prospectus located. Link in comments";"gme ftx token prospectus located link in comments";"0.4995";"0.4995";"0.0";"opinionated";"";"0";"";"";"";"";"49";"0.14"
"superstonk";"2023-02-07";"GMERICA: THE BUYOUT IS COMING!";"gmerica the buyout is coming";"0.0";"0.0";"0.0";"opinionated";"";"0";"";"";"";"";"28";"0.8"
"superstonk";"2023-02-08";"My email to the SEC. Dec 2nd, 2020. I never heard back from them and in the following six weeks $GME went from $16 to $500.";"my email to the sec dec 2nd 2020 i never heard back from them and in the following six weeks gme went from 16 to 500";"0.25";"0.25";"0.175";"factual";"";"0";"sec";"regulation";"";"https://web.archive.org/web/20230208102747im_/https://preview.redd.it/bmnlbumucxga1.jpg?width=640&crop=smart&auto=webp&v=enabled&s=22a140b550283696f3f9f690aeb318056d6be335";"116";"0.07317073170731707"
"superstonk";"2023-02-09";"Thought this reply was cool, Friendly Reminder: The GME movement is WORLDWIDE! 🌍🧑‍🚀";"thought this reply was cool friendly reminder the gme movement is worldwide";"0.919";"0.919";"0.575";"opinionated";"🌍🧑🚀";"3";"";"";"";"https://web.archive.org/web/20230209130814im_/https://preview.redd.it/ld1wkuwlh3ha1.jpg?width=640&crop=smart&auto=webp&v=enabled&s=c8c74572786cceabd156f6d0e9352a6df4cca76f";"75";"0.1927710843373494"
"superstonk";"2023-02-11";"BREAKING DEVELOPMENT || Instinet, NOT Robinhood, received THE LARGEST DTCC charge waiver on January 28, 2021. Of the 6 defaulting firms JAN|28|2021, Instinet received a $3.5B or higher DTCC Excess Capital Premium Charge Waiver. This is over $1B higher than Robinhood. Credit K**nap For Discovery Calc";"breaking development  instinet not robinhood received the largest dtcc charge waiver on january 28 2021 of the 6 defaulting firms jan282021 instinet received a 35b or higher dtcc excess capital premium charge waiver this is over 1b higher than robinhood credit knap for discovery calc";"0.2982";"0.2982";"0.5";"opinionated";"";"0";"";"robinhood";"";"";"284";"0.20666666666666667"
"superstonk";"2023-02-12";"$GME Daily Directory | New? Start Here! | Discussion, DRS Guide, DD Library, User Flair Guide and Superstonk Discord";"gme daily directory  new start here  discussion drs guide dd library user flair guide and superstonk discord";"0.2083";"0.2083";"0.22727272727272727";"opinionated";"";"0";"gme daily";"drs, dd/analysis";"";"";"108";"0.1810344827586207"
"superstonk";"2023-02-14";"What are the odds that the Average Age of XRT loans crashed from 129.33 days to 10.15 days...on GME Splivvy day July 22nd, 2022?";"what are the odds that the average age of xrt loans crashed from 12933 days to 1015 dayson gme splivvy day july 22nd 2022";"0.4995";"0.4995";"0.39999999999999997";"opinionated";"";"0";"";"dd/analysis";"";"https://web.archive.org/web/20230214063416im_/https://preview.redd.it/q6amfpkhl1ia1.jpg?width=640&crop=smart&auto=webp&v=enabled&s=a71d19d929fe92e907cc70a7560b006b3d6555d4";"121";"0.0859375"
"superstonk";"2023-02-15";"Citadel 13F for GME is now available, and they now have more call options than put options and increased their share count.";"citadel 13f for gme is now available and they now have more call options than put options and increased their share count";"0.368";"0.368";"0.45";"factual";"";"0";"";"hedge funds";"";"https://web.archive.org/web/20230215040402im_/https://preview.redd.it/mak9td11m9ia1.jpg?width=640&crop=smart&auto=webp&v=enabled&s=10469ef256cadf16de514234f43795da72265f5c";"121";"0.04065040650406504"
"superstonk";"2023-02-15";"Ray Dalio Increases GME Position By 3X";"ray dalio increases gme position by 3x";"0.4995";"0.4995";"0.0";"opinionated";"";"0";"";"";"";"";"38";"0.23684210526315788"
"superstonk";"2023-02-17";"We have a new HKD! SLND went from $8-$2000 today. Guess who had about 415k shares🤔🤔… Citadel Advisors LLC. You can’t make this up.";"we have a new hkd slnd went from 82000 today guess who had about 415k shares citadel advisors llc you cant make this up";"-0.4753";"-0.4753";"0.45454545454545453";"opinionated";"🤔🤔";"2";"";"hedge funds";"";"";"119";"0.11538461538461539"
"superstonk";"2023-02-19";"Two years ago today DFV was in front of Congress letting the world know that he just “likes the stock”";"two years ago today dfv was in front of congress letting the world know that he just likes the stock";"0.0";"0.0";"0.0";"factual";"";"0";"congress";"regulation";"";"https://web.archive.org/web/20230219065253im_/https://external-preview.redd.it/Sv4urLMDVNhitF8cZtDzVb-1kxwSaKWZbCtsruhb55w.jpg?width=640&crop=smart&auto=webp&v=enabled&s=140782747bce29482fd649e439a4a69a68d8909f";"100";"0.049019607843137254"
"superstonk";"2023-02-20";"Sneakpeek of the GMEVERSE being built in real time.";"sneakpeek of the gmeverse being built in real time";"0.0";"0.0";"0.30000000000000004";"factual";"";"0";"";"";"";"";"50";"0.17647058823529413"
"superstonk";"2023-02-20";"🚀🚀🚀🚀Another triangle for your viewing pleasure. GME is showing probably the largest triangle ever seen on a daily chart, more than 2 years in the making. It’s time to buy and DRS like never before 🚀🚀🚀🚀";"another triangle for your viewing pleasure gme is showing probably the largest triangle ever seen on a daily chart more than 2 years in the making its time to buy and drs like never before";"0.975";"0.975";"0.25";"opinionated";"🚀🚀🚀🚀🚀🚀🚀🚀";"8";"";"drs";"";"https://web.archive.org/web/20230220080156im_/https://preview.redd.it/dem1hdtyb9ja1.jpg?width=640&crop=smart&auto=webp&v=enabled&s=f0fc8a9b22e8077777bb3beeccd13eeee2735c0b";"188";"0.03980099502487562"
"superstonk";"2023-02-20";"Madoff was asked why it took so long to bring down his Ponzi, he replied that no one did basic due diligence. Checking Depository Trust Clearing Corp to verify his trades could have exposed him 2 years earlier. I asked my attorney general to look into GME. Here are all 50 US states & territories AG👇";"madoff was asked why it took so long to bring down his ponzi he replied that no one did basic due diligence checking depository trust clearing corp to verify his trades could have exposed him 2 years earlier i asked my attorney general to look into gme here are all 50 us states  territories ag";"0.6166";"0.6166";"0.36481481481481487";"opinionated";"👇";"1";"ag";"dd/analysis";"";"";"294";"0.05333333333333334"
