"subreddit";"date";"title";"cleaned";"sentiment_vader_comp";"sentiment_final";"subjectivity";"subjectivity_label";"emojis";"emoji_count";"entities";"topic_tags";"upvotes";"image_urls";"title_length";"capslock_ratio"
"superstonk";"2024-08-25";"Caught between MOASS and Gameshire Stopaway (a.k.a. ""Why I think the $4.1533 billion M&A war chest is, one way or another, highly likely to make us all filthy rich"")";"caught between moass and gameshire stopaway aka why i think the 41533 billion ma war chest is one way or another highly likely to make us all filthy rich";"-0.0772";"-0.0772";"0.9166666666666666";"opinionated";"";"0";"41533 billion";"";"2476.0";"";"153";"0.07272727272727272"
"superstonk";"2024-08-25";"Milano GameStop #3, has a post MOASS store to go with our new welcome mats. These post have been fun, thanks all! Safe travels!";"milano gamestop 3 has a post moass store to go with our new welcome mats these post have been fun thanks all safe travels";"0.9133";"0.9133";"0.45090909090909087";"opinionated";"";"0";"";"";"226.0";"";"121";"0.07874015748031496"
"superstonk";"2024-09-03";"Northen Trust - Crazy stuff with GME and not only ";"northen trust  crazy stuff with gme and not only";"0.6289";"0.6289";"0.95";"opinionated";"";"0";"";"";"1099.0";"";"48";"0.12"
"superstonk";"2024-09-05";"The walls are closing in on hedge funds engaged in illegal market manipulation. On 09/04/2024 a SINGLE hedge fund (the name of which has been REDACTED) triggered 2,940 alerts of potentially illegal spoofing activity 🔥 ";"the walls are closing in on hedge funds engaged in illegal market manipulation on 09042024 a single hedge fund the name of which has been redacted triggered 2940 alerts of potentially illegal spoofing activity";"-0.8442";"-0.8442";"0.4047619047619048";"factual";"🔥";"1";"";"hedge funds";"1627.0";"https://web.archive.org/web/20240905192605im_/https://preview.redd.it/the-walls-are-closing-in-on-hedge-funds-engaged-in-illegal-v0-vucqjbotf0nd1.jpeg?auto=webp&s=5e01752e1e0bdfcce3b6a830333e6318dd4d6a50";"209";"0.07339449541284404"
"superstonk";"2024-09-06";"""I think DFV was trying to tell us via his stockcharts account there is an algo pattern that repeats itself at different scales/time intervals -- and if this is correct, $GME is on track to skip past the Moon and ping Jupiter.""";"i think dfv was trying to tell us via his stockcharts account there is an algo pattern that repeats itself at different scalestime intervals  and if this is correct gme is on track to skip past the moon and ping jupiter";"0.8038";"0.8038";"0.425";"opinionated";"";"0";"ping jupiter";"";"203.0";"";"219";"0.039647577092511016"
"superstonk";"2024-09-06";"It's harder and harder to talk to anyone outside the ""ape community"" about GME - but I'd really like to !";"its harder and harder to talk to anyone outside the ape community about gme  but id really like to";"0.7813";"0.7813";"0.0625";"opinionated";"";"0";"";"apes/community";"86.0";"";"98";"0.047619047619047616"
"superstonk";"2024-09-06";"September might wreck the stock market... will GME be the only one to survive? Brace yourselves! This is the month where everything starts to unfold! 🔥💥🚀";"september might wreck the stock market will gme be the only one to survive brace yourselves this is the month where everything starts to unfold";"0.254";"0.254";"1.0";"opinionated";"🔥💥🚀";"3";"";"";"200.0";"https://web.archive.org/web/20240906144323im_/https://preview.redd.it/september-might-wreck-the-stock-market-will-gme-be-the-only-v0-gem92ip7p5nd1.jpeg?width=640&crop=smart&auto=webp&s=3f8d18c306e0024abeda7fd2b6165b3a298e45a3";"143";"0.0392156862745098"
"superstonk";"2024-09-06";"Max Pain Upgrade and New Baby Gamma Ramp Coming Up? - GME 9/6 Open Interest Price Movement Forecast and Options Analysis";"max pain upgrade and new baby gamma ramp coming up  gme 96 open interest price movement forecast and options analysis";"0.4466";"0.4466";"0.4772727272727273";"opinionated";"";"0";"max";"dd/analysis";"89.0";"";"117";"0.15833333333333333"
"superstonk";"2024-09-06";"Me post-MOASS";"me postmoass";"0.0";"0.0";"0.0";"factual";"";"0";"";"";"94.0";"https://web.archive.org/web/20240906144323im_/https://external-preview.redd.it/me-post-moass-v0-cGd3amsza3lkNm5kMUwqLgV8Y7Q5ktEULJYsH7novu-kzsk4uBwFfDTnK9Dy.png?width=640&crop=smart&format=pjpg&auto=webp&s=5b64d72583ff42206da3313cc530279f65057874";"12";"0.46153846153846156"
"superstonk";"2024-09-14";"Financial times taking a piss on GME (ps, the stock soared 2 weeks later the last time they did that) ";"financial times taking a piss on gme ps the stock soared 2 weeks later the last time they did that";"0.1363";"0.1363";"0.022222222222222223";"factual";"";"0";"gme ps";"";"1056.0";"";"98";"0.0392156862745098"
"superstonk";"2024-09-24";"Adding further perspective to a previous post, GME has the 17th highest Cash-Debt figure out of the 102 companies I could be bothered looking at (got another 98 to go).";"adding further perspective to a previous post gme has the 17th highest cashdebt figure out of the 102 companies i could be bothered looking at got another 98 to go";"0.2342";"0.2342";"0.3333333333333333";"factual";"";"0";"";"dd/analysis";"631.0";"";"163";"0.041666666666666664"
"superstonk";"2024-09-24";"Larry sends you a heads up. He is chatting with an obvious GME ape. Link in Comments";"larry sends you a heads up he is chatting with an obvious gme ape link in comments";"0.694";"0.694";"0.5";"opinionated";"";"0";"larry";"apes/community";"501.0";"https://web.archive.org/web/20240924115147im_/https://preview.redd.it/larry-sends-you-a-heads-up-he-is-chatting-with-an-obvious-v0-dfwqoc1dbqqd1.png?auto=webp&s=156185a9c4a27fcf80f2d65a86055ead86e23761";"82";"0.08333333333333333"
"superstonk";"2024-09-24";"At around 4.6 billion GME has the 117th biggest stockpile in America 🚀🚀";"at around 46 billion gme has the 117th biggest stockpile in america";"0.9049";"0.9049";"0.0";"opinionated";"🚀🚀";"2";"america, around 46 billion";"";"2877.0";"https://web.archive.org/web/20240924115147im_/https://preview.redd.it/at-around-4-6-billion-gme-has-the-117th-biggest-stockpile-v0-vcorbhkqemqd1.jpeg?width=640&crop=smart&auto=webp&s=0cdead1adb535971560483a27aae5ac55ff54455";"67";"0.07042253521126761"
"superstonk";"2024-09-30";"The masterpiece - MOASS (possibly) begins in January 2025";"the masterpiece  moass possibly begins in january 2025";"0.6249";"0.6249";"1.0";"opinionated";"";"0";"";"";"1529.0";"";"54";"0.12280701754385964"
"superstonk";"2024-09-30";"Kinda crazy to me that Analysts think GME is going to post a negative EPS in 64 days( q3). Are these guys forgetting about GME's short term interest income? GME should bank 55+ million from that alone! ";"kinda crazy to me that analysts think gme is going to post a negative eps in 64 days q3 are these guys forgetting about gmes short term interest income gme should bank 55 million from that alone";"0.4499";"0.4499";"0.5333333333333333";"opinionated";"";"0";"kinda";"regulation";"245.0";"https://web.archive.org/web/20240930221411im_/https://preview.redd.it/kinda-crazy-to-me-that-analysts-think-gme-is-going-to-post-v0-rxry4wgezzrd1.jpeg?auto=webp&s=b805f0b179425e00944bbb77f13a78961a7d822d";"194";"0.07425742574257425"
"superstonk";"2024-09-30";"GME under RC...";"gme under rc";"0.4995";"0.4995";"0.0";"opinionated";"";"0";"gme under rc";"";"1243.0";"";"12";"0.3333333333333333"
"superstonk";"2024-09-30";"GME FTDs for the first half of September";"gme ftds for the first half of september";"0.4995";"0.4995";"0.25";"opinionated";"";"0";"";"";"472.0";"https://web.archive.org/web/20240930221411im_/https://preview.redd.it/gme-ftds-for-the-first-half-of-september-v0-4db17w92uyrd1.png?auto=webp&s=a0732142078f2da79390611ab6d0496cd2f728a3";"40";"0.175"
"superstonk";"2024-09-30";"Ryan Cohen & DFV first time meeting each other 🚀";"ryan cohen  dfv first time meeting each other";"0.6124";"0.6124";"0.35416666666666663";"opinionated";"🚀";"1";"ryan cohen  dfv";"";"313.0";"https://web.archive.org/web/20240930221411im_/https://external-preview.redd.it/ryan-cohen-dfv-first-time-meeting-each-other-v0-NDNveDQ0cG5oenJkMZM4PviTXKXhdPkcMJcfkafXG1EhX3OxtRr7teOwwUZ_.png?width=640&crop=smart&format=pjpg&auto=webp&s=de88742c15871711f5f80361235115744dd9359e";"45";"0.10416666666666667"
"superstonk";"2024-09-30";"$GME tests $23 🎯";"gme tests 23";"0.4995";"0.4995";"0.0";"opinionated";"🎯";"1";"";"";"1195.0";"https://web.archive.org/web/20240930221411im_/https://preview.redd.it/gme-tests-23-v0-0tvfnvoziyrd1.jpeg?width=640&crop=smart&auto=webp&s=c82f6908e940cb8e129c5066533c7d9e7963f5af";"12";"0.1875"
"superstonk";"2024-11-09";"As long as it brings upon the MOASS";"as long as it brings upon the moass";"0.0";"0.0";"0.4";"factual";"";"0";"";"";"212.0";"";"35";"0.17142857142857143"
"superstonk";"2024-11-10";"Institutional filings of GME ownership this quarter are pouring in every day until November 15th – looks like they like the stock as well...";"institutional filings of gme ownership this quarter are pouring in every day until november 15th  looks like they like the stock as well";"0.8531";"0.8531";"0.0";"opinionated";"";"0";"";"";"663.0";"";"136";"0.03571428571428571"
"superstonk";"2024-11-10";"The 50 Moving Average is about to cross the 100 Moving Average on the weekly timeframe for $GME. Last time that happened was in mid-December 2020. Stock price then went from under 16$ to about 480$ (+3000%) over the next 6 weeks. Have a nice weekend!";"the 50 moving average is about to cross the 100 moving average on the weekly timeframe for gme last time that happened was in middecember 2020 stock price then went from under 16 to about 480 3000 over the next 6 weeks have a nice weekend";"0.745";"0.745";"0.3111111111111111";"opinionated";"";"0";"";"dd/analysis";"2899.0";"https://web.archive.org/web/20241110102948im_/https://preview.redd.it/the-50-moving-average-is-about-to-cross-the-100-moving-v0-qmchhqx6suzd1.png?width=640&crop=smart&auto=webp&s=a71876477e714e7ac099fba12414f5660465e5c5";"238";"0.048"
"superstonk";"2024-11-12";"MRW $GME runs 10% on no news";"mrw gme runs 10 on no news";"0.2577";"0.2577";"0.0";"factual";"";"0";"mrw gme";"";"2186.0";"";"26";"0.21428571428571427"
"superstonk";"2024-11-12";"We are past the 🇺🇸!!! Now on the 🔥   V for vendetta is GME starting the V and going on a bull run";"we are past the  now on the    v for vendetta is gme starting the v and going on a bull run";"0.5732";"0.5732";"0.175";"opinionated";"🔥";"1";"";"";"1486.0";"";"91";"0.07216494845360824"
"superstonk";"2024-11-12";"Gamestop is up 9.56% on the day and I haven’t seen any media outlet report the truth about it. So I report about it with this headline: GME is up 9.56% on no news - start asking yourself why.";"gamestop is up 956 on the day and i havent seen any media outlet report the truth about it so i report about it with this headline gme is up 956 on no news  start asking yourself why";"0.516";"0.516";"0.0";"opinionated";"";"0";"";"";"5379.0";"";"182";"0.03664921465968586"
"superstonk";"2024-11-13";"Insitutions keep piling on $GME with more long positions ";"insitutions keep piling on gme with more long positions";"0.4995";"0.4995";"0.45";"opinionated";"";"0";"";"";"2288.0";"https://web.archive.org/web/20241113000436im_/https://preview.redd.it/insitutions-keep-piling-on-gme-with-more-long-positions-v0-mudbqc408i0e1.jpeg?width=640&crop=smart&auto=webp&s=0a78d0d2f3043416f1c244910dcffdc31838bf4e";"55";"0.07017543859649122"
"superstonk";"2024-11-13";"GME's Cup and Handle pattern. Bullish AF.";"gmes cup and handle pattern bullish af";"0.5423";"0.5423";"0.0";"opinionated";"";"0";"";"";"230.0";"https://web.archive.org/web/20241113000436im_/https://preview.redd.it/gmes-cup-and-handle-pattern-bullish-af-v0-hi5mse948j0e1.png?width=640&crop=smart&auto=webp&s=6c3801bf3d4dbcd719626766e22e96f3702c4f58";"38";"0.1951219512195122"
"superstonk";"2024-11-13";"Remember the last time DFV made a 5,000 call block purchases he was telling us a new floor";"remember the last time dfv made a 5000 call block purchases he was telling us a new floor";"-0.4404";"-0.4404";"0.2606060606060606";"factual";"";"0";"";"";"576.0";"";"89";"0.044444444444444446"
"superstonk";"2024-11-13";"New 13F disclosure: Geode Capital Management added 1.8M shares of GME to their portfolio last quarter. You can track institutional trading of GME here:";"new 13f disclosure geode capital management added 18m shares of gme to their portfolio last quarter you can track institutional trading of gme here";"0.8256";"0.8256";"0.2606060606060606";"opinionated";"";"0";"";"dd/analysis";"986.0";"";"147";"0.08609271523178808"
"superstonk";"2024-11-15";"GME is up 33.1% since Ryan Cohen tweeted and deleted ‘yolo’";"gme is up 331 since ryan cohen tweeted and deleted yolo";"0.4995";"0.4995";"0.0";"opinionated";"";"0";"ryan cohen, gme";"meme stocks";"1091.0";"https://web.archive.org/web/20241115100812im_/https://preview.redd.it/gme-is-up-33-1-since-ryan-cohen-tweeted-and-deleted-yolo-v0-brnpv7m2iy0e1.jpeg?width=640&crop=smart&auto=webp&s=184aa67b4c424c06fbc3fb45ea7da08529915edd";"55";"0.0847457627118644"
"superstonk";"2024-11-15";"According to Recent 13Fs, Institutions now own 164.4M shares GME, 36.8% of shares outstanding";"according to recent 13fs institutions now own 1644m shares gme 368 of shares outstanding";"0.8918";"0.8918";"0.7083333333333334";"opinionated";"";"0";"";"";"1836.0";"";"88";"0.08602150537634409"
"superstonk";"2024-11-15";"Fund Update: SUSQUEHANNA INTERNATIONAL GROUP, LLP increases GameStop (GME) holdings";"fund update susquehanna international group llp increases gamestop gme holdings";"0.4995";"0.54945";"0.0";"opinionated";"";"0";"susquehanna international group";"hedge funds, diamond hands";"2299.0";"";"79";"0.46987951807228917"
"superstonk";"2024-11-16";"Fund Update: CITADEL ADVISORS LLC increases GameStop (GME) holdings";"fund update citadel advisors llc increases gamestop gme holdings";"-0.3612";"-0.3612";"0.0";"factual";"";"0";"";"hedge funds, diamond hands";"1933.0";"";"64";"0.373134328358209"
"superstonk";"2024-11-16";"Citadel is Lying (Again) - Failure to Accurately Disclose Q3 13F Institutional Holdings";"citadel is lying again  failure to accurately disclose q3 13f institutional holdings";"-0.8934";"-0.8934";"0.4666666666666667";"factual";"";"0";"";"hedge funds, diamond hands";"1816.0";"";"84";"0.11494252873563218"
"superstonk";"2024-11-16";"1 Year of IV Data, every day until MOASS or society collapses — Day 87";"1 year of iv data every day until moass or society collapses  day 87";"-0.296";"-0.296";"0.0";"factual";"";"0";"";"";"165.0";"https://web.archive.org/web/20241116000830im_/https://preview.redd.it/1-year-of-iv-data-every-day-until-moass-or-society-v0-9qfbkhbet41e1.png?width=640&crop=smart&auto=webp&s=36c8b3182c5952ef15e2f2a33f68c0e5b1e7966f";"68";"0.14285714285714285"
"superstonk";"2024-11-17";"What I heard when Ken Griffin stated, “Firms like Citadel set the price of companies to what we think they should be valued”";"what i heard when ken griffin stated firms like citadel set the price of companies to what we think they should be valued";"-0.3612";"-0.3612";"0.0";"factual";"";"0";"ken griffin";"hedge funds";"61.0";"https://web.archive.org/web/20241117052454im_/https://preview.redd.it/what-i-heard-when-ken-griffin-stated-firms-like-citadel-set-v0-5p7x1nwkyd1e1.jpeg?auto=webp&s=e5dffc7e5d8ba7597b84758099bc8dddcd552af6";"121";"0.04838709677419355"
"superstonk";"2024-11-18";"Earlier in the day of Buck's first tweet back, I was doing a final cleaning of the AirBnb I was staying at. Found this little bunny under a bed that did not belong to me. MOASS tomorrow confirmed.";"earlier in the day of bucks first tweet back i was doing a final cleaning of the airbnb i was staying at found this little bunny under a bed that did not belong to me moass tomorrow confirmed";"0.0";"0.0";"0.5555555555555555";"opinionated";"";"0";"";"";"217.0";"https://web.archive.org/web/20241118083652im_/https://preview.redd.it/earlier-in-the-day-of-bucks-first-tweet-back-i-was-doing-a-v0-ec6gst9vek1e1.png?width=640&crop=smart&auto=webp&s=5c47b5ef7298654a72f600203a0e4e769592f876";"191";"0.061224489795918366"
"superstonk";"2024-11-18";"For GME to gap up and boom tomorrow ";"for gme to gap up and boom tomorrow";"0.4995";"0.4995";"0.0";"opinionated";"";"0";"";"";"3459.0";"https://web.archive.org/web/20241118083652im_/https://preview.redd.it/for-gme-to-gap-up-and-boom-tomorrow-v0-bhhm57p4xh1e1.jpeg?auto=webp&s=3fcc98286e1b6294aaa5b527b7cb187d559d21d4";"35";"0.1111111111111111"
"superstonk";"2024-11-19";"GME's entry into PSA and collectibles is a classic Ryan Cohen move, and will happen fast, based on how he ran things at his first company.";"gmes entry into psa and collectibles is a classic ryan cohen move and will happen fast based on how he ran things at his first company";"0.0";"0.0";"0.36666666666666664";"factual";"";"0";"";"";"1479.0";"";"134";"0.057971014492753624"
"superstonk";"2024-11-19";"prediction that GME will hit $72.14 in the next 5 days according to coincodex 🐰📈";"prediction that gme will hit 7214 in the next 5 days according to coincodex";"0.4995";"0.4995";"0.0";"opinionated";"🐰📈";"2";"";"";"1640.0";"https://web.archive.org/web/20241119002513im_/https://preview.redd.it/prediction-that-gme-will-hit-72-14-in-the-next-5-days-v0-8dhf90wwrn1e1.jpeg?width=640&crop=smart&auto=webp&s=763dc70029cbd8bd1e2466004c408266192674d3";"75";"0.0375"
"superstonk";"2024-11-19";"$GME weekly 50EMA crossed the 200EMA. The last time this golden cross occurred was 1/19/2021.";"gme weekly 50ema crossed the 200ema the last time this golden cross occurred was 1192021";"0.4995";"0.4995";"0.18888888888888888";"opinionated";"";"0";"";"";"2403.0";"https://web.archive.org/web/20241119002513im_/https://preview.redd.it/gme-weekly-50ema-crossed-the-200ema-the-last-time-this-v0-03t13vcvxo1e1.jpeg?width=640&crop=smart&auto=webp&s=db998016f3d7bc08a89baf3d0d0170e3b7032208";"88";"0.10752688172043011"
"superstonk";"2024-11-20";"Nails for MOASS set 148th-154th 🧱x🧱 ComputerShare 741 buy 💵 🥃";"nails for moass set 148th154th x computershare 741 buy";"0.0";"0.0";"0.0";"factual";"🧱🧱💵🥃";"4";"";"drs";"67.0";"";"54";"0.13114754098360656"
"superstonk";"2024-11-20";"Check out these idiots.  Short 98,000 shares of GME at $22.66.  Get wrecked.";"check out these idiots  short 98000 shares of gme at 2266  get wrecked";"0.6633";"0.6633";"0.55";"opinionated";"";"0";"";"";"2978.0";"https://web.archive.org/web/20241120115905im_/https://preview.redd.it/check-out-these-idiots-short-98-000-shares-of-gme-at-22-66-v0-dwk0azd6tw1e1.png?width=640&crop=smart&auto=webp&s=e3324058e4150762d2e6dacfddc487f70ddf10f4";"70";"0.07894736842105263"
"superstonk";"2024-11-21";"Someone from the EXCHANGE FLOOR JUST OPENED $GME 50 C's for $55,000 expiring in .. 30 days";"someone from the exchange floor just opened gme 50 cs for 55000 expiring in  30 days";"0.4995";"0.4995";"0.0";"opinionated";"";"0";"";"drs";"3027.0";"";"84";"0.3111111111111111"
"superstonk";"2024-11-22";"Max Pain Keeps Rising? Will Bulls try to Thwart GME MMs today? - $GME 11/22 Open Interest Price Movement Forecast and Options Analysis";"max pain keeps rising will bulls try to thwart gme mms today  gme 1122 open interest price movement forecast and options analysis";"0.7598";"0.7598";"0.5";"opinionated";"";"0";"max";"dd/analysis";"650.0";"";"129";"0.16417910447761194"
"superstonk";"2024-11-22";"Swiss bank buys gme. ";"swiss bank buys gme";"0.3612";"0.3612";"0.0";"factual";"";"0";"swiss bank";"regulation";"5428.0";"https://web.archive.org/web/20241122212449im_/https://preview.redd.it/swiss-bank-buys-gme-v0-wdiq7foqrf2e1.jpeg?width=640&crop=smart&auto=webp&s=fa5a53f199a40a70445928bc5d159121d3743a3f";"19";"0.047619047619047616"
"superstonk";"2024-11-22";"+400 more before MOASS";"400 more before moass";"0.0";"0.0";"0.5";"opinionated";"";"0";"";"";"385.0";"https://web.archive.org/web/20241122212449im_/https://preview.redd.it/400-more-before-moass-v0-gpulqr8uhi2e1.jpeg?width=640&crop=smart&auto=webp&s=47f6f8c209f380a1320545454de8a7d281d89064";"21";"0.22727272727272727"
"superstonk";"2024-11-23";"Silently bought games, toys, and GME shares over Q2 and Q3. But I couldn't resist sharing my latest Q4 purchases! Can't wait to play these games!";"silently bought games toys and gme shares over q2 and q3 but i couldnt resist sharing my latest q4 purchases cant wait to play these games";"-0.5298";"-0.5298";"0.5";"opinionated";"";"0";"q3";"";"282.0";"https://web.archive.org/web/20241123183300im_/https://preview.redd.it/silently-bought-games-toys-and-gme-shares-over-q2-and-q3-v0-jo3tmhj4bm2e1.jpeg?width=640&crop=smart&auto=webp&s=c65d31a79d9ff2fc9f1e0afbf62e1c10c09e50b5";"138";"0.06896551724137931"
"superstonk";"2024-11-23";"Yeah, no cell no sell, and market reform would be huge …but really I’m just a chill guy waiting for MOASS";"yeah no cell no sell and market reform would be huge but really im just a chill guy waiting for moass";"0.4919";"0.4919";"0.55";"opinionated";"";"0";"";"";"330.0";"https://web.archive.org/web/20241123183300im_/https://preview.redd.it/yeah-no-cell-no-sell-and-market-reform-would-be-huge-but-v0-mh97gok3wn2e1.jpeg?width=640&crop=smart&auto=webp&s=5434fef2891c39d08af1bb0f5d1c23014a438510";"101";"0.06666666666666667"
"superstonk";"2024-11-25";"🚀🚀🚀🚀🚀🚀🚀🚀🚀🚀🚀🚀🚀🚀🚀🚀🚀🚀🚀🚀🚀🚀🚀🚀🌕🌕🌕🌕🌕🌕🌕🌕🌕🌕🌕🌕🌕🌕🌕🌕🌕🌕🌕🌕🌕🌕🌕🌕💎💎💎💎💎💎💎💎💎💎💎💎💎💎💎💎💎💎💎💎💎💎💎💎No dates, but remember, the MOASS is TOMORROW!!!!!!!!YOOOOOOOOOOLOOOOOOOOOOOOOOOOOOOOOOOOOOOOOOOOOOOOOOOOOOOOOOOOOOOOOOOOO💎💎💎💎💎💎💎💎💎💎💎💎💎💎💎💎💎💎💎💎💎💎💎💎 🌕🌕🌕🌕🌕🌕🌕🌕🌕🌕🌕🌕🌕🌕🌕🌕🌕🌕🌕🌕🌕🌕🌕🌕 🚀🚀🚀🚀🚀🚀🚀🚀🚀🚀🚀🚀🚀🚀🚀🚀🚀🚀🚀🚀🚀🚀🚀🚀";"no dates but remember the moass is tomorrowyoooooooooolooooooooooooooooooooooooooooooooooooooooooooooooooooooooo";"0.9999";"0.9999";"0.0";"opinionated";"🚀🚀🚀🚀🚀🚀🚀🚀🚀🚀🚀🚀🚀🚀🚀🚀🚀🚀🚀🚀🚀🚀🚀🚀🌕🌕🌕🌕🌕🌕🌕🌕🌕🌕🌕🌕🌕🌕🌕🌕🌕🌕🌕🌕🌕🌕🌕🌕💎💎💎💎💎💎💎💎💎💎💎💎💎💎💎💎💎💎💎💎💎💎💎💎💎💎💎💎💎💎💎💎💎💎💎💎💎💎💎💎💎💎💎💎💎💎💎💎🌕🌕🌕🌕🌕🌕🌕🌕🌕🌕🌕🌕🌕🌕🌕🌕🌕🌕🌕🌕🌕🌕🌕🌕🚀🚀🚀🚀🚀🚀🚀🚀🚀🚀🚀🚀🚀🚀🚀🚀🚀🚀🚀🚀🚀🚀🚀🚀";"144";"";"";"370.0";"https://web.archive.org/web/20241125045905im_/https://preview.redd.it/no-dates-but-remember-the-moass-is-tomorrow-v0-rm1xub54uw2e1.jpeg?width=640&crop=smart&auto=webp&s=f3229527344ad3b2f78d83b7211aa452d399c2c1";"112";"0.30970149253731344"
"superstonk";"2024-11-25";"Tomorrow we celebrate our MOASS day!";"tomorrow we celebrate our moass day";"0.6114";"0.6114";"0.0";"opinionated";"";"0";"";"";"53.0";"https://web.archive.org/web/20241125045905im_/https://external-preview.redd.it/tomorrow-we-celebrate-our-moass-day-v0-ODVqYnN3cDQzejJlMf80NJ4kD1CT_tRR2cHTGyoMiOY1vvD5SjxbiPEcT78s.png?width=640&crop=smart&format=pjpg&auto=webp&s=57fd66e26cf86df60fc1374d23ada1733e88184c";"35";"0.16666666666666666"
"superstonk";"2024-11-25";"$GME Forecast for the Week starting Nov 24th, 2024 🔮";"gme forecast for the week starting nov 24th 2024";"0.4995";"0.4995";"0.1";"opinionated";"🔮";"1";"gme forecast";"";"55.0";"";"48";"0.11538461538461539"
"superstonk";"2024-11-25";"Didn't somebody mention.. Aladdin? Well, make way for DFV 🎉 | REUPLOAD, not OP | (July, 2024)";"didnt somebody mention aladdin well make way for dfv   reupload not op  july 2024";"0.5859";"0.5859";"0.0";"opinionated";"🎉";"1";"";"dd/analysis";"173.0";"https://web.archive.org/web/20241125045905im_/https://external-preview.redd.it/didnt-somebody-mention-aladdin-well-make-way-for-dfv-v0-OWRxYWN5aG4weTJlMa_enDLWlqyeonOFMcwgLSElRbWbrXjw2TXK9Wd3qINl.png?width=640&crop=smart&format=pjpg&auto=webp&s=c6799e4a314b61e0383eda7b05cf1b817da10758";"81";"0.1827956989247312"
"superstonk";"2024-11-28";"If GME hits $35 by EOW I'll master out of my PhD program and apply for a job at my local GameStop. ";"if gme hits 35 by eow ill master out of my phd program and apply for a job at my local gamestop";"0.4995";"0.4995";"0.5";"opinionated";"";"0";"";"";"1184.0";"";"95";"0.12121212121212122"
"superstonk";"2024-11-29";"Just a little post to tell you that Gamestop stock ($GME) price is now positive/green on all Yahoo! Finance timeframes. Have a good day!";"just a little post to tell you that gamestop stock gme price is now positivegreen on all yahoo finance timeframes have a good day";"0.7729";"0.7729";"0.55";"opinionated";"";"0";"yahoo";"";"1190.0";"";"129";"0.058823529411764705"
"superstonk";"2024-11-29";"Life Savings to Bank of GMErica update. Brick by brick for 3 years";"life savings to bank of gmerica update brick by brick for 3 years";"0.0";"0.0";"0.0";"factual";"";"0";"bank of gmerica update brick";"regulation";"1645.0";"https://web.archive.org/web/20241129120308im_/https://preview.redd.it/life-savings-to-bank-of-gmerica-update-brick-by-brick-for-3-v0-jqeya5fgwr3e1.jpeg?width=640&crop=smart&auto=webp&s=a5e8e3a199620192a2477731a8090dc6a02d2978";"65";"0.10606060606060606"
