"subreddit";"date";"title";"cleaned";"sentiment_vader_comp";"sentiment_final";"subjectivity";"subjectivity_label";"emojis";"emoji_count";"entities";"topic_tags";"upvotes";"image_urls";"title_length";"capslock_ratio"
"superstonk";"2022-02-09";"GME Utilization is at 100% LFG! 🚀";"gme utilization is at 100 lfg";"0.8188";"0.8188";"0.0";"opinionated";"🚀";"1";"";"";"";"https://web.archive.org/web/20220209143419im_/https://preview.redd.it/3nvbmlu5ysg81.jpg?width=640&crop=smart&auto=webp&s=247e150646388f7f2192fe046cabe04c59038068";"29";"0.21212121212121213"
"superstonk";"2022-02-11";"CITADEL IS CREATING BILLIONS OF DOLLARS IN MARGIN OUT OF THIN AIR";"citadel is creating billions of dollars in margin out of thin air";"-0.4215";"-0.46365";"0.8500000000000001";"opinionated";"";"0";"billions of dollars";"hedge funds";"";"";"65";"0.8307692307692308"
"superstonk";"2022-02-11";"It looks like Melvin Capital had insider info on the development of Cyberpunk 2077, shorted it 3 months before release and were forced to close on CD Projekt Red in order to stay in on GME.";"it looks like melvin capital had insider info on the development of cyberpunk 2077 shorted it 3 months before release and were forced to close on cd projekt red in order to stay in on gme";"-0.1943";"-0.1943";"0.1";"factual";"";"0";"";"hedge funds";"";"";"187";"0.0582010582010582"
"superstonk";"2022-02-12";"If you want MOASS and you have a Twatter account I am asking you to go updoot our Superstonk Mod's reply to Jon Stewart 🦍🦧🐒";"if you want moass and you have a twatter account i am asking you to go updoot our superstonk mods reply to jon stewart";"0.0772";"0.0772";"0.0";"factual";"🦍🦧🐒";"3";"jon stewart";"";"";"https://web.archive.org/web/20220212070845im_/https://preview.redd.it/0r10ceihk9h81.png?width=640&crop=smart&auto=webp&s=705c15f55bbb8c76bae4d98288364d770740ec03";"118";"0.0975609756097561"
"superstonk";"2022-02-18";"Citadel Securities officially named in DOJ probe";"citadel securities officially named in doj probe";"-0.4215";"-0.4215";"0.0";"factual";"";"0";"";"hedge funds, regulation";"";"";"48";"0.10416666666666667"
"superstonk";"2022-02-18";"GMETA UPDATE - Hickory dickory dock, you shouldn't have shorted the stock.";"gmeta update  hickory dickory dock you shouldnt have shorted the stock";"0.0";"0.0";"0.0";"factual";"";"0";"";"";"";"";"70";"0.16216216216216217"
"superstonk";"2022-02-18";"�?️Citadel named directly in DOJ investigation. Listen closely.�?️";"citadel named directly in doj investigation listen closely";"0.0";"0.0";"0.4";"factual";"";"0";"";"hedge funds, regulation";"";"";"58";"0.07575757575757576"
"superstonk";"2022-02-19";"#CitadelScandal is trending on Twitter. Let's keep pushing! Twitter, Instagram, Facebook, MySpace, Friendster, Tik Tok! Party like it's 2008!";"citadelscandal is trending on twitter lets keep pushing twitter instagram facebook myspace friendster tik tok party like its 2008";"0.7249";"0.7249";"0.0";"opinionated";"";"0";"";"hedge funds, meme stocks";"";"";"129";"0.09219858156028368"
"superstonk";"2022-02-19";"[Anti FUD] DoJ Investigation of Citadel and SHFs is a VERY BIG DEAL! Posts saying 'don't get your hopes up' and 'nothing will happen' are designed to Kill Morale! Citadel just lost 75% of its Future Clients!!!";"anti fud doj investigation of citadel and shfs is a very big deal posts saying dont get your hopes up and nothing will happen are designed to kill morale citadel just lost 75 of its future clients";"-0.9739";"-0.9739";"0.1275";"opinionated";"";"0";"anti fud";"hedge funds, regulation";"";"";"196";"0.1339712918660287"
"superstonk";"2022-02-20";"If MOASS starts on Tuesday morning…";"if moass starts on tuesday morning";"0.0";"0.0";"0.0";"factual";"";"0";"";"";"";"";"34";"0.2"
"superstonk";"2022-02-20";"ATTENTION INVESTORS IN CITADEL LLC!! Yes, the company you hold funds in is under investigation, potentially for racketeering. Millionaires and Billionaires this one's for you. You are fucked. Liquidating Citadel yourselves is the only option.";"attention investors in citadel llc yes the company you hold funds in is under investigation potentially for racketeering millionaires and billionaires this ones for you you are fucked liquidating citadel yourselves is the only option";"-0.9004";"-0.9004";"0.9";"opinionated";"";"0";"";"hedge funds, diamond hands, regulation";"";"";"233";"0.1487603305785124"
"superstonk";"2022-02-21";"Force your shitty broker to prove they brought your GME shares in one simple step. CREDIT: u/Conscious_Diamond535";"force your shitty broker to prove they brought your gme shares in one simple step credit uconscious_diamond535";"0.6329";"0.6329";"0.35714285714285715";"opinionated";"";"0";"u/Conscious_Diamond535";"";"";"";"110";"0.10619469026548672"
"superstonk";"2022-02-21";"Further evidence Citadel is in trouble: public filings show Citadel has received financing from BNY Mellon and Mizuho Securities in the last 6 months. This mirrors what they did during the 2008 financial crisis.";"further evidence citadel is in trouble public filings show citadel has received financing from bny mellon and mizuho securities in the last 6 months this mirrors what they did during the 2008 financial crisis";"-0.9274";"-0.9274";"0.16666666666666666";"factual";"";"0";"mizuho securities";"hedge funds, regulation";"";"";"208";"0.04739336492890995"
"superstonk";"2022-02-21";"CITADEL IS **NOT** CREATING BILLIONS OF DOLLARS IN MARGIN OUT OF THIN AIR";"citadel is not creating billions of dollars in margin out of thin air";"-0.7085";"-0.7793500000000001";"0.8500000000000001";"opinionated";"";"0";"billions of dollars";"hedge funds";"";"";"69";"0.7808219178082192"
"superstonk";"2022-02-23";"Thank you to every GME holder who bought, held, and shut the fuck up";"thank you to every gme holder who bought held and shut the fuck up";"0.4995";"0.4995";"0.6";"opinionated";"";"0";"";"diamond hands";"";"";"66";"0.058823529411764705"
"superstonk";"2022-03-04";"3/3/22 GME Spoofing report: When the price started running up at 14:14 NY time, spoofing kicked in and sopped the run up, then cancelled orders at 14:52 clearly showing spoofing as orders were never intended to be executed. They even changed the spoofing price when stock went down at minute 35:50";"3322 gme spoofing report when the price started running up at 1414 ny time spoofing kicked in and sopped the run up then cancelled orders at 1452 clearly showing spoofing as orders were never intended to be executed they even changed the spoofing price when stock went down at minute 3550";"0.6037";"0.6037";"0.33611111111111114";"opinionated";"";"0";"";"";"";"";"288";"0.026936026936026935"
"superstonk";"2022-03-06";"This is Douglas Cifu. CEO of Virtu. Virtu is a market maker like Citadel that illegally makes counterfeit securities. He is a financial terrorist.";"this is douglas cifu ceo of virtu virtu is a market maker like citadel that illegally makes counterfeit securities he is a financial terrorist";"-0.7184";"-0.7184";"0.25";"factual";"";"0";"douglas cifu";"hedge funds, regulation";"";"https://web.archive.org/web/20220306080731im_/https://preview.redd.it/pasdaadvoml81.jpg?width=640&crop=smart&auto=webp&s=e11e2fddecceff0e8d83f5bae48dc6d39e94cf62";"142";"0.0684931506849315"
"superstonk";"2022-03-14";"From the horse mouth, former SEC commissioner, why it's even dumber to play options. I've been advocating for not touching options since the GME saga.";"from the horse mouth former sec commissioner why its even dumber to play options ive been advocating for not touching options since the gme saga";"0.2263";"0.2263";"0.3666666666666667";"factual";"";"0";"sec";"regulation";"";"";"144";"0.05333333333333334"
"superstonk";"2022-03-14";"Peruvian Bull on Twatter: ""JP Morgan, the same broker dealer bank fined hundreds of millions for manipulating silver prices, now is involved in talks to ensure a short squeeze in nickel can't happen again. Our markets are a fucking joke.""";"peruvian bull on twatter jp morgan the same broker dealer bank fined hundreds of millions for manipulating silver prices now is involved in talks to ensure a short squeeze in nickel cant happen again our markets are a fucking joke";"0.8074";"0.8074";"0.4083333333333334";"opinionated";"";"0";"hundreds of millions";"regulation, short squeeze";"";"";"230";"0.029411764705882353"
"superstonk";"2022-03-15";"It is cristal clear what will happen to Brokers/Banks during MOASS and that you will get a Shitsandwitch for your Shares or even get your trades canceled/reversed";"it is cristal clear what will happen to brokersbanks during moass and that you will get a shitsandwitch for your shares or even get your trades canceledreversed";"0.5859";"0.5859";"0.3833333333333333";"opinionated";"";"0";"";"regulation";"";"https://web.archive.org/web/20220315164536im_/https://preview.redd.it/6lmu87liqjn81.jpg?width=640&crop=smart&auto=webp&s=19e8c54cf9f5db0b4bc8b98dbf451a0ed07ac08c";"160";"0.06172839506172839"
"superstonk";"2022-03-16";"I also want to thank u/atobitt for his hard work and dedication toward GME. Don’t know where the feck you went, but who cares. You came back at a perfect time! Diamond ballz!!";"i also want to thank uatobitt for his hard work and dedication toward gme dont know where the feck you went but who cares you came back at a perfect time diamond ballz";"0.9505";"0.9505";"0.5138888888888888";"opinionated";"";"0";"u/atobitt";"";"";"https://web.archive.org/web/20220316000720im_/https://preview.redd.it/70uku0bp7mn81.jpg?width=640&crop=smart&auto=webp&s=543d20c16f33b117d19c5ef33adc403887c6b4c4";"167";"0.04"
"superstonk";"2022-03-16";"lol, wait till MOASS....";"lol wait till moass";"0.4215";"0.4215";"0.7";"opinionated";"";"0";"lol wait";"";"";"https://web.archive.org/web/20220316000720im_/https://preview.redd.it/g2k6428f4ln81.jpg?width=640&crop=smart&auto=webp&s=dd23f59d43cd0575d2847353394e46d03ca8248d";"19";"0.20833333333333334"
"superstonk";"2022-03-23";"DFV seen in the wild today on his brother’s Instagram page!";"dfv seen in the wild today on his brothers instagram page";"0.0";"0.0";"0.4";"opinionated";"";"0";"";"";"";"";"57";"0.06779661016949153"
"superstonk";"2022-03-28";"If GME passes $500 this week I’ll streak outside of citadel";"if gme passes 500 this week ill streak outside of citadel";"-0.1943";"-0.1943";"0.525";"opinionated";"";"0";"";"hedge funds";"";"";"57";"0.0847457627118644"
"superstonk";"2022-03-28";"If GME reaches $269.420 (USD) this week, I’ll legally change my name to GameStop 🍌";"if gme reaches 269420 usd this week ill legally change my name to gamestop";"0.5904";"0.5904";"0.6";"opinionated";"🍌";"1";"";"";"";"";"74";"0.12195121951219512"
"superstonk";"2022-03-31";"GME - 7.29 % (3/30/2020) NOBODY IS SELLING. ONE WORD - CRIME";"gme  729  3302020 nobody is selling one word  crime";"-0.25";"-0.275";"0.0";"factual";"";"0";"gme  ";"";"";"https://web.archive.org/web/20220331032113im_/https://preview.redd.it/id6fo54qtkq81.png?width=640&crop=smart&auto=webp&s=5d2330b2867447172be2456058d287daf1df9ea0";"51";"0.5"
"superstonk";"2022-04-01";"GME 8K";"gme 8k";"0.3612";"0.39732000000000006";"0.0";"factual";"";"0";"gme 8k";"";"";"";"6";"0.6666666666666666"
"superstonk";"2022-04-01";"Tomorrow is April Fools Day. Petition to make this sub free of April Fools Day jokes. There’s enough shenanigans going on with GME and we don’t need any more here.";"tomorrow is april fools day petition to make this sub free of april fools day jokes theres enough shenanigans going on with gme and we dont need any more here";"0.2808";"0.2808";"0.6";"opinionated";"";"0";"";"";"";"";"158";"0.0736196319018405"
"superstonk";"2022-04-01";"NO APRIL FOOLS JOKES || r/place is back! and we'll get GME its rightful place";"no april fools jokes  rplace is back and well get gme its rightful place";"0.7708";"0.7708";"0.0";"opinionated";"";"0";"";"";"";"";"72";"0.2597402597402597"
"superstonk";"2022-04-08";"Proof that GME Order Flow is Being Manipulated";"proof that gme order flow is being manipulated";"0.1613";"0.1613";"0.0";"factual";"";"0";"";"";"";"";"46";"0.17391304347826086"
"superstonk";"2022-04-09";"GMEdd.com on Twitter: ""In the main.js file on GameStop’s NFT Beta, code indicates that GameStop Wallet™ will be available as a browser extension and an iOS & Android app. The wallet will allow users to collect and trade NFTs and cryptos at a lower cost and with higher speed."" I NEED this wallet.";"gmeddcom on twitter in the mainjs file on gamestops nft beta code indicates that gamestop wallet will be available as a browser extension and an ios  android app the wallet will allow users to collect and trade nfts and cryptos at a lower cost and with higher speed i need this wallet";"-0.0772";"-0.0772";"0.45";"factual";"™";"1";"";"dd/analysis";"";"";"284";"0.08783783783783784"
"superstonk";"2022-04-13";"Hey Ryan Cohen, is it possible for you to connect the GME wallet to Computershare so when we sell 1 share at 100mil we can get the funds straight into our GME wallet and not have to deal with paper checks or banks? #beyourownbank";"hey ryan cohen is it possible for you to connect the gme wallet to computershare so when we sell 1 share at 100mil we can get the funds straight into our gme wallet and not have to deal with paper checks or banks beyourownbank";"0.8613";"0.8613";"0.7";"opinionated";"";"0";"ryan cohen";"hedge funds, drs, apes/community, regulation";"";"";"226";"0.043668122270742356"
"superstonk";"2022-04-15";"Kenny admitting to using BCG to spy on other hedge funds, having them on payroll and coverage on him performing 'death spirals' by excessive shorting - (2001)";"kenny admitting to using bcg to spy on other hedge funds having them on payroll and coverage on him performing death spirals by excessive shorting  2001";"-0.5994";"-0.5994";"0.6875";"opinionated";"";"0";"";"hedge funds";"";"";"152";"0.02531645569620253"
"superstonk";"2022-04-20";"Why is this getting hidden? The NSCC has proposed a rule to stop MOASS!";"why is this getting hidden the nscc has proposed a rule to stop moass";"-0.3595";"-0.3595";"0.3333333333333333";"opinionated";"";"0";"";"dd/analysis";"";"";"69";"0.15492957746478872"
"superstonk";"2022-04-20";"A Lot of Forum Sliding Today, While MOASS is Threatened";"a lot of forum sliding today while moass is threatened";"-0.4588";"-0.4588";"0.0";"factual";"";"0";"";"";"";"";"54";"0.21818181818181817"
"superstonk";"2022-04-29";"Robinhood Reports 43% Revenue Decline";"robinhood reports 43 revenue decline";"-0.3612";"-0.3612";"0.0";"factual";"";"0";"";"robinhood";"";"";"36";"0.10810810810810811"
"superstonk";"2022-04-29";"proposed rule for moass: no posts that imply you've sold";"proposed rule for moass no posts that imply youve sold";"-0.296";"-0.296";"0.0";"factual";"";"0";"";"";"";"";"54";"0.0"
"superstonk";"2022-05-02";"I will HODL for as long as this takes. May 5th, I don't expect shit. June 2nd, I don't expect shit. The day we DRS 100% of GME's TSO, I don't expect shit. I was the last person to physically leave Occupy in Jan, 2012. I'll be the last person to sell. This is a part of a bigger story. Buckle up. 💎🙌";"i will hodl for as long as this takes may 5th i dont expect shit june 2nd i dont expect shit the day we drs 100 of gmes tso i dont expect shit i was the last person to physically leave occupy in jan 2012 ill be the last person to sell this is a part of a bigger story buckle up";"0.8835";"0.8835";"0.4576190476190476";"opinionated";"💎🙌";"2";"";"drs, diamond hands";"";"";"277";"0.087248322147651"
"superstonk";"2022-05-02";"Ken Griffin is manipulating the Illinois gubernatorial elections by supporting Aurora Mayor Richard C. Irvin who has ties to a front company for Citadel called Scientel Solutions and ties to a major HFT Data Center in the city called CyrusOne.CyrusOne is owned by his billionaire friend Henry Kravis.";"ken griffin is manipulating the illinois gubernatorial elections by supporting aurora mayor richard c irvin who has ties to a front company for citadel called scientel solutions and ties to a major hft data center in the city called cyrusonecyrusone is owned by his billionaire friend henry kravis";"0.0772";"0.0772";"0.2833333333333333";"factual";"";"0";"richard, henry kravis, ken griffin";"hedge funds";"";"";"297";"0.07333333333333333"
"superstonk";"2022-05-03";"Hmmmm INTERESTING..Apparently we reserve the right to discover amount of FTD’s (Failure to Delivers) DTCC is hiding in their “Black Box.” Through the FREEDOM OF INFORMATION ACT, we can request the amount of FTD’s “secretly accumulated” for GME but ALSO ALL the FTDs currently throughout entire market";"hmmmm interestingapparently we reserve the right to discover amount of ftds failure to delivers dtcc is hiding in their black box through the freedom of information act we can request the amount of ftds secretly accumulated for gme but also all the ftds currently throughout entire market";"0.3254";"0.3254";"0.4990079365079365";"factual";"";"0";"";"regulation";"";"https://web.archive.org/web/20220503015901im_/https://preview.redd.it/lus5xyywv4x81.jpg?width=640&crop=smart&auto=webp&s=996e131d3d34afb3d256b53d6636c01a1dbaa68b";"288";"0.21333333333333335"
"superstonk";"2022-05-05";"Even without a squeeze (let alone MOASS) or NFT Marketplace revenue, GameStop should be trading at $277 based on the Price-to-Sales of the rest of the market.";"even without a squeeze let alone moass or nft marketplace revenue gamestop should be trading at 277 based on the pricetosales of the rest of the market";"-0.6393";"-0.6393";"0.0";"factual";"";"0";"";"";"";"";"151";"0.08860759493670886"
"superstonk";"2022-05-05";"LOL, look who increased their GME position by 4,150%.";"lol look who increased their gme position by 4150";"0.8345";"0.8345";"0.7";"opinionated";"";"0";"";"";"";"https://web.archive.org/web/20220505052354im_/https://preview.redd.it/958kwvkivjx81.jpg?width=640&crop=smart&auto=webp&s=bdb74931d6ce25c197a5b61f4c08e896e795d706";"49";"0.11320754716981132"
"superstonk";"2022-05-06";"All Citadel Leaked Files From Panama Papers";"all citadel leaked files from panama papers";"-0.743";"-0.743";"0.0";"factual";"";"0";"panama";"hedge funds, apes/community";"";"";"43";"0.16279069767441862"
"superstonk";"2022-05-06";"All Melvin files from Panama Paper Leaks.";"all melvin files from panama paper leaks";"-0.25";"-0.25";"0.0";"factual";"";"0";"panama";"hedge funds, apes/community";"";"";"40";"0.12195121951219512"
"superstonk";"2022-05-06";"GAMESTOP WALLET - GME Entertainment, LLC Trademark Registration";"gamestop wallet  gme entertainment llc trademark registration";"0.7213";"0.7213";"0.0";"opinionated";"";"0";"";"";"";"";"61";"0.36507936507936506"
"superstonk";"2022-05-07";"WHAT?! Is it just me being a smooth brained ape or the reflection in the astronaut helmet is Chicago by night with a black out at Citadel's HQ??";"what is it just me being a smooth brained ape or the reflection in the astronaut helmet is chicago by night with a black out at citadels hq";"0.5158";"0.5158";"0.4666666666666667";"opinionated";"";"0";"chicago";"hedge funds, apes/community";"";"https://web.archive.org/web/20220507212200im_/https://preview.redd.it/tf8jyhiir1y81.png?width=640&crop=smart&auto=webp&s=2373c0a2f9986da440ec535d9d766a905757ef65";"139";"0.0625"
"superstonk";"2022-05-07";"Idk if it’s occurred to anyone that with insights we can probably determine the exact number of bots here. We have 3 unknown variables so using Gaussian Elimination or Gauss-Jordan should be sufficient here. If you love GME and you’re not a bot ⬆️ let’s see some exposed bots 🔬";"idk if its occurred to anyone that with insights we can probably determine the exact number of bots here we have 3 unknown variables so using gaussian elimination or gaussjordan should be sufficient here if you love gme and youre not a bot  lets see some exposed bots";"0.7925";"0.7925";"0.48333333333333334";"opinionated";"⬆🔬";"2";"gaussjordan";"";"";"https://web.archive.org/web/20220507212200im_/https://preview.redd.it/2fm2k4ocg2y81.jpg?width=640&crop=smart&auto=webp&s=442ebea6d2e48a59119452e6f029b245f4d3f358";"267";"0.036101083032490974"
"superstonk";"2022-05-13";"FTX BAILS OUT ROBINHOOD, BUYS 7.6%. FTX CONNECTED TO CITADEL, Its all tied together. Need more eyes digging on this";"ftx bails out robinhood buys 76 ftx connected to citadel its all tied together need more eyes digging on this";"-0.8388";"-0.9226800000000001";"0.5";"opinionated";"";"0";"";"hedge funds, robinhood";"";"";"109";"0.40869565217391307"
"superstonk";"2022-05-14";"+30 😤 Finally flipped my 80/20 ISA-DRS ratio to 20/80 like promised. Shout out to GTA MOASS and DRONE guys while I'm at it.";"30  finally flipped my 8020 isadrs ratio to 2080 like promised shout out to gta moass and drone guys while im at it";"0.6124";"0.6124";"1.0";"opinionated";"😤";"1";"";"drs";"";"https://web.archive.org/web/20220514135330im_/https://preview.redd.it/tj2qoiih1fz81.jpg?width=640&crop=smart&auto=webp&s=b1c0094c9439aa349bc34e35e7d2c53372c97523";"115";"0.17886178861788618"
"superstonk";"2022-05-16";"I NEED A BIG BRAIN! I was looking for jobs when suddenly... I click on this job for GAMEUS and the company site link is GAMESTOP?? Am I high? Out of the loop? Are we aware of what the fuck ""GAMEUS"" is? Is it GAMEUS and not GMERICA? The jobs have been up for at least two weeks.";"i need a big brain i was looking for jobs when suddenly i click on this job for gameus and the company site link is gamestop am i high out of the loop are we aware of what the fuck gameus is is it gameus and not gmerica the jobs have been up for at least two weeks";"-0.5792";"-0.5792";"0.3983333333333334";"opinionated";"";"0";"";"dd/analysis";"";"";"264";"0.19855595667870035"
"superstonk";"2022-05-16";"Get voting. If some dude in Africa can vote for GME you can too. ✅";"get voting if some dude in africa can vote for gme you can too";"0.4995";"0.4995";"0.0";"opinionated";"✅";"1";"";"";"";"https://web.archive.org/web/20220516034214im_/https://preview.redd.it/gslupfplpoz81.jpg?width=640&crop=smart&auto=webp&s=edb928ab2e38ec666e1b181b043522f355d4508f";"62";"0.09090909090909091"
"superstonk";"2022-05-17";"mark your calendars & jack yer tits bc not only is MOASS TOMORROW, it's also day #69 that GME will be at 100% utilization --- 6️⃣9️⃣➕⏳🧨🟰💥 --- On a f*cking TUESDAY, no less :)";"mark your calendars  jack yer tits bc not only is moass tomorrow its also day 69 that gme will be at 100 utilization  69  on a fcking tuesday no less";"0.0145";"0.0145";"0.5333333333333333";"opinionated";"➕⏳🧨🟰💥";"5";"jack yer";"";"";"https://web.archive.org/web/20220517052342im_/https://preview.redd.it/xjp4twlr9wz81.png?width=640&crop=smart&auto=webp&s=5cbe4a013adfd40da76acf7a7bf8169d5ad231ff";"149";"0.13793103448275862"
"superstonk";"2022-05-18";"GME 100% Utilization - Day 70 via Ortex⏳🧨";"gme 100 utilization  day 70 via ortex";"0.4995";"0.4995";"0.0";"opinionated";"⏳🧨";"2";"";"";"";"";"37";"0.14634146341463414"
"superstonk";"2022-05-19";"Gabe Plotkin waves the white flag...Melvin Capital is to close! 🚀";"gabe plotkin waves the white flagmelvin capital is to close";"0.6476";"0.6476";"0.0";"opinionated";"🚀";"1";"";"hedge funds";"";"https://web.archive.org/web/20220519020843im_/https://preview.redd.it/izz496vo1b091.jpg?width=640&crop=smart&auto=webp&s=c4297269ff1d52baf67d487d66ab5c7fe519af91";"59";"0.06153846153846154"
"superstonk";"2022-05-20";"Ken takes ZERO accountability again. Puts all the blame on retail investors for bringing down Melvin and stealing the pension funds of teachers!";"ken takes zero accountability again puts all the blame on retail investors for bringing down melvin and stealing the pension funds of teachers";"-0.8356";"-0.8356";"0.2888888888888889";"opinionated";"";"0";"ken";"hedge funds";"";"";"142";"0.04861111111111111"
"superstonk";"2022-05-25";"Dan Pipitone, Co-Fouunder of Trade Zero, lied to all of Reddit in an ama last year about restricting GME trading";"dan pipitone cofouunder of trade zero lied to all of reddit in an ama last year about restricting gme trading";"-0.2422";"-0.2422";"0.06666666666666667";"factual";"";"0";"dan pipitone";"dd/analysis";"";"https://web.archive.org/web/20220525003034im_/https://preview.redd.it/9re2btbkhh191.jpg?width=640&crop=smart&auto=webp&s=5d79572e38ed164f6677448a23d638303414c1ba";"109";"0.08928571428571429"
"superstonk";"2022-05-26";"Current average Cosdt to Borrow for GME, as of 11:30 PM EDT: 231.82%!!! The cost to borrow is skyrocketing!";"current average cosdt to borrow for gme as of 1130 pm edt 23182 the cost to borrow is skyrocketing";"0.6598";"0.6598";"0.4";"opinionated";"";"0";"";"";"";"https://web.archive.org/web/20220526102152im_/https://preview.redd.it/rhfkxit6pq191.png?width=640&crop=smart&auto=webp&s=396a9a0fb6c1446a8ebb200ee2bd31f462b6d32a";"98";"0.11214953271028037"
"superstonk";"2022-05-27";"GME 100% Utilization - Day 77 via Ortex⏳🧨 (data help from u/RaucetheSoss)";"gme 100 utilization  day 77 via ortex data help from uraucethesoss";"0.7125";"0.7125";"0.0";"opinionated";"⏳🧨";"2";"u/RaucetheSoss";"";"";"";"66";"0.1095890410958904"
"superstonk";"2022-05-29";"| $GME Daily Discussion | New to the sub? Start here!";"gme daily discussion  new to the sub start here";"0.5461";"0.5461";"0.22727272727272727";"opinionated";"";"0";"gme daily";"";"";"";"47";"0.1320754716981132"
